data/Performance/gpt2-xgb_knob-cuda-autotvm.json
{"input": ["cuda -keys=cuda,gpu -max_num_threads=1024 -thread_warp_size=32", "dense_large_batch.gpu", [["TENSOR", [128, 3072], "float32"], ["TENSOR", [768, 3072], "float32"], null, "float32"], {}], "config": {"index": 2169915, "code_hash": null, "entity": [["tile_x", "sp", [-1, 1, 4, 4]], ["tile_y", "sp", [-1, 4, 4, 3]], ["tile_k", "sp", [-1, 8, 2]]]}, "result": [[0.0005776268267973856], 0, 1.8660898208618164, 1655908997.3554723], "version": 0.2, "tvm_version": "0.8.0"}
{"input": ["cuda -keys=cuda,gpu -max_num_threads=1024 -thread_warp_size=32", "dense_small_batch.gpu", [["TENSOR", [128, 3072], "float32"], ["TENSOR", [768, 3072], "float32"], null, "float32"], {}], "config": {"index": 16, "code_hash": null, "entity": [["tile_k", "sp", [-1, 384]]]}, "result": [[0.004165941351351351], 0, 1.304387092590332, 1655912070.040391], "version": 0.2, "tvm_version": "0.8.0"}
{"input": ["cuda -keys=cuda,gpu -max_num_threads=1024 -thread_warp_size=32", "dense_large_batch.gpu", [["TENSOR", [128, 768], "float32"], ["TENSOR", [3072, 768], "float32"], null, "float32"], {}], "config": {"index": 3090291, "code_hash": null, "entity": [["tile_x", "sp", [-1, 4, 4, 2]], ["tile_y", "sp", [-1, 2, 4, 6]], ["tile_k", "sp", [-1, 6, 2]]]}, "result": [[0.0005236111479452055], 0, 2.6143622398376465, 1655915569.0761075], "version": 0.2, "tvm_version": "0.8.0"}
{"input": ["cuda -keys=cuda,gpu -max_num_threads=1024 -thread_warp_size=32", "dense_small_batch.gpu", [["TENSOR", [128, 768], "float32"], ["TENSOR", [3072, 768], "float32"], null, "float32"], {}], "config": {"index": 13, "code_hash": null, "entity": [["tile_k", "sp", [-1, 128]]]}, "result": [[0.004163632081081081], 0, 1.219022274017334, 1655917459.2051032], "version": 0.2, "tvm_version": "0.8.0"}
{"input": ["cuda -keys=cuda,gpu -max_num_threads=1024 -thread_warp_size=32", "dense_large_batch.gpu", [["TENSOR", [128, 768], "float32"], ["TENSOR", [768, 768], "float32"], null, "float32"], {}], "config": {"index": 1909104, "code_hash": null, "entity": [["tile_x", "sp", [-1, 8, 8, 1]], ["tile_y", "sp", [-1, 6, 8, 1]], ["tile_k", "sp", [-1, 12, 2]]]}, "result": [[9.837911582278482e-05], 0, 3.2156410217285156, 1655918752.6876457], "version": 0.2, "tvm_version": "0.8.0"}
{"input": ["cuda -keys=cuda,gpu -max_num_threads=1024 -thread_warp_size=32", "dense_small_batch.gpu", [["TENSOR", [128, 768], "float32"], ["TENSOR", [768, 768], "float32"], null, "float32"], {}], "config": {"index": 9, "code_hash": null, "entity": [["tile_k", "sp", [-1, 32]]]}, "result": [[0.0003350544301242236], 0, 1.352447509765625, 1655922351.778457], "version": 0.2, "tvm_version": "0.8.0"}
{"input": ["cuda -keys=cuda,gpu -max_num_threads=1024 -thread_warp_size=32", "batch_matmul.cuda", [["TENSOR", [12, 128, 128], "float32"], ["TENSOR", [12, 64, 128], "float32"], [12, 128, 64], null, 0, 1], {}], "config": {"index": 21591, "code_hash": null, "entity": [["tile_y", "sp", [-1, 2, 16]], ["tile_x", "sp", [-1, 16, 2]], ["tile_k", "sp", [-1, 32]], ["auto_unroll_max_step", "ot", 32], ["unroll_explicit", "ot", 0]]}, "result": [[1.7354084482188152e-05], 0, 1.6225252151489258, 1655922796.0110176], "version": 0.2, "tvm_version": "0.8.0"}
{"input": ["cuda -keys=cuda,gpu -max_num_threads=1024 -thread_warp_size=32", "batch_matmul.cuda", [["TENSOR", [12, 128, 64], "float32"], ["TENSOR", [12, 128, 64], "float32"], [12, 128, 128], null, 0, 1], {}], "config": {"index": 34195, "code_hash": null, "entity": [["tile_y", "sp", [-1, 2, 32]], ["tile_x", "sp", [-1, 32, 2]], ["tile_k", "sp", [-1, 32]], ["auto_unroll_max_step", "ot", 64], ["unroll_explicit", "ot", 0]]}, "result": [[1.4016267619833196e-05], 0, 1.5250194072723389, 1655927056.6290758], "version": 0.2, "tvm_version": "0.8.0"}
{"input": ["cuda -keys=cuda,gpu -max_num_threads=1024 -thread_warp_size=32", "dense_large_batch.gpu", [["TENSOR", [128, 768], "float32"], ["TENSOR", [2304, 768], "float32"], null, "float32"], {}], "config": {"index": 9319464, "code_hash": null, "entity": [["tile_x", "sp", [-1, 8, 8, 1]], ["tile_y", "sp", [-1, 9, 8, 1]], ["tile_k", "sp", [-1, 6, 4]]]}, "result": [[0.00022872390125], 0, 3.3185102939605713, 1655931443.6523833], "version": 0.2, "tvm_version": "0.8.0"}
{"input": ["cuda -keys=cuda,gpu -max_num_threads=1024 -thread_warp_size=32", "dense_small_batch.gpu", [["TENSOR", [128, 768], "float32"], ["TENSOR", [2304, 768], "float32"], null, "float32"], {}], "config": {"index": 13, "code_hash": null, "entity": [["tile_k", "sp", [-1, 128]]]}, "result": [[0.003124224693877551], 0, 1.1857354640960693, 1655936234.004356], "version": 0.2, "tvm_version": "0.8.0"}
