data/Performance/lstm-xgb_knob-cuda-autotvm.json.tmp
{"input": ["cuda -keys=cuda,gpu -max_num_threads=1024 -thread_warp_size=32", "dense_small_batch.gpu", [["TENSOR", [1, 1024], "float32"], ["TENSOR", [4096, 1024], "float32"], null, "float32"], {}], "config": {"index": 3, "code_hash": null, "entity": [["tile_k", "sp", [-1, 8]]]}, "result": [[7.687472431826671e-05], 0, 1.5080575942993164, 1662628312.4430344], "version": 0.2, "tvm_version": "0.8.0"}
{"input": ["cuda -keys=cuda,gpu -max_num_threads=1024 -thread_warp_size=32", "dense_small_batch.gpu", [["TENSOR", [1, 1024], "float32"], ["TENSOR", [4096, 1024], "float32"], null, "float32"], {}], "config": {"index": 4, "code_hash": null, "entity": [["tile_k", "sp", [-1, 16]]]}, "result": [[6.809438402871244e-05], 0, 1.2278661727905273, 1662628313.4506996], "version": 0.2, "tvm_version": "0.8.0"}
{"input": ["cuda -keys=cuda,gpu -max_num_threads=1024 -thread_warp_size=32", "dense_small_batch.gpu", [["TENSOR", [1, 1024], "float32"], ["TENSOR", [4096, 1024], "float32"], null, "float32"], {}], "config": {"index": 0, "code_hash": null, "entity": [["tile_k", "sp", [-1, 1]]]}, "result": [[0.0003775819348314607], 0, 1.1582341194152832, 1662628315.0279746], "version": 0.2, "tvm_version": "0.8.0"}
{"input": ["cuda -keys=cuda,gpu -max_num_threads=1024 -thread_warp_size=32", "dense_small_batch.gpu", [["TENSOR", [1, 1024], "float32"], ["TENSOR", [4096, 1024], "float32"], null, "float32"], {}], "config": {"index": 8, "code_hash": null, "entity": [["tile_k", "sp", [-1, 256]]]}, "result": [[6.114721509281678e-05], 0, 1.179049015045166, 1662628316.0283093], "version": 0.2, "tvm_version": "0.8.0"}
{"input": ["cuda -keys=cuda,gpu -max_num_threads=1024 -thread_warp_size=32", "dense_small_batch.gpu", [["TENSOR", [1, 1024], "float32"], ["TENSOR", [4096, 1024], "float32"], null, "float32"], {}], "config": {"index": 10, "code_hash": null, "entity": [["tile_k", "sp", [-1, 1024]]]}, "result": [[0.00018129569596199527], 0, 1.1629157066345215, 1662628317.0159476], "version": 0.2, "tvm_version": "0.8.0"}
{"input": ["cuda -keys=cuda,gpu -max_num_threads=1024 -thread_warp_size=32", "dense_small_batch.gpu", [["TENSOR", [1, 1024], "float32"], ["TENSOR", [4096, 1024], "float32"], null, "float32"], {}], "config": {"index": 5, "code_hash": null, "entity": [["tile_k", "sp", [-1, 32]]]}, "result": [[6.47987552e-05], 0, 1.52632737159729, 1662628318.9566247], "version": 0.2, "tvm_version": "0.8.0"}
{"input": ["cuda -keys=cuda,gpu -max_num_threads=1024 -thread_warp_size=32", "dense_small_batch.gpu", [["TENSOR", [1, 1024], "float32"], ["TENSOR", [4096, 1024], "float32"], null, "float32"], {}], "config": {"index": 9, "code_hash": null, "entity": [["tile_k", "sp", [-1, 512]]]}, "result": [[8.791815141019297e-05], 0, 1.2050013542175293, 1662628320.5754464], "version": 0.2, "tvm_version": "0.8.0"}
{"input": ["cuda -keys=cuda,gpu -max_num_threads=1024 -thread_warp_size=32", "dense_small_batch.gpu", [["TENSOR", [1, 1024], "float32"], ["TENSOR", [4096, 1024], "float32"], null, "float32"], {}], "config": {"index": 7, "code_hash": null, "entity": [["tile_k", "sp", [-1, 128]]]}, "result": [[6.110249350649351e-05], 0, 1.1760444641113281, 1662628321.5848787], "version": 0.2, "tvm_version": "0.8.0"}
{"input": ["cuda -keys=cuda,gpu -max_num_threads=1024 -thread_warp_size=32", "dense_small_batch.gpu", [["TENSOR", [1, 1024], "float32"], ["TENSOR", [4096, 1024], "float32"], null, "float32"], {}], "config": {"index": 2, "code_hash": null, "entity": [["tile_k", "sp", [-1, 4]]]}, "result": [[0.00013718768996763756], 0, 1.2711141109466553, 1662628323.3240488], "version": 0.2, "tvm_version": "0.8.0"}
{"input": ["cuda -keys=cuda,gpu -max_num_threads=1024 -thread_warp_size=32", "dense_small_batch.gpu", [["TENSOR", [1, 1024], "float32"], ["TENSOR", [4096, 1024], "float32"], null, "float32"], {}], "config": {"index": 1, "code_hash": null, "entity": [["tile_k", "sp", [-1, 2]]]}, "result": [[0.00022848387209302326], 0, 1.2143585681915283, 1662628324.9575758], "version": 0.2, "tvm_version": "0.8.0"}
{"input": ["cuda -keys=cuda,gpu -max_num_threads=1024 -thread_warp_size=32", "dense_small_batch.gpu", [["TENSOR", [1, 1024], "float32"], ["TENSOR", [4096, 1024], "float32"], null, "float32"], {}], "config": {"index": 6, "code_hash": null, "entity": [["tile_k", "sp", [-1, 64]]]}, "result": [[6.511603586862576e-05], 0, 1.1653783321380615, 1662628325.9602466], "version": 0.2, "tvm_version": "0.8.0"}
