data/Performance/resnet-18-grid-cuda-autotvm.json
{"input": ["cuda -keys=cuda,gpu -arch=sm_75 -max_num_threads=1024 -thread_warp_size=32", "dense_small_batch.gpu", [["TENSOR", [1, 512], "float32"], ["TENSOR", [1000, 512], "float32"], null, "float32"], {}], "config": {"index": 5, "code_hash": null, "entity": [["tile_k", "sp", [-1, 32]]]}, "result": [[4.3917546793745136e-06], 0, 1.4259076118469238, 1655272803.081322], "version": 0.2, "tvm_version": "0.9.dev0"}
{"input": ["cuda -keys=cuda,gpu -arch=sm_75 -max_num_threads=1024 -thread_warp_size=32", "conv2d_nchw_winograd.cuda", [["TENSOR", [1, 512, 7, 7], "float32"], ["TENSOR", [512, 512, 3, 3], "float32"], [1, 1], [1, 1, 1, 1], [1, 1], "float32"], {}], "config": {"index": 2569, "code_hash": null, "entity": [["tile_b", "sp", [-1, 1, 1, 1]], ["tile_y", "sp", [-1, 1, 4, 8]], ["tile_x", "sp", [-1, 4, 4, 1]], ["tile_rc", "sp", [-1, 1]], ["auto_unroll_max_step", "ot", 0], ["unroll_explicit", "ot", 0]]}, "result": [[0.00014788730424143557], 0, 1.8959596157073975, 1655276267.9889798], "version": 0.2, "tvm_version": "0.9.dev0"}
{"input": ["cuda -keys=cuda,gpu -arch=sm_75 -max_num_threads=1024 -thread_warp_size=32", "conv2d_nchw.cuda", [["TENSOR", [1, 512, 7, 7], "float32"], ["TENSOR", [512, 512, 3, 3], "float32"], [1, 1], [1, 1, 1, 1], [1, 1], "float32"], {}], "config": {"index": 2203, "code_hash": null, "entity": [["tile_f", "sp", [-1, 8, 1, 1]], ["tile_y", "sp", [-1, 1, 7, 1]], ["tile_x", "sp", [-1, 1, 7, 1]], ["tile_rc", "sp", [-1, 1]], ["tile_ry", "sp", [-1, 1]], ["tile_rx", "sp", [-1, 1]], ["auto_unroll_max_step", "ot", 0], ["unroll_explicit", "ot", 0]]}, "result": [[0.0004927378875], 0, 1.4564449787139893, 1655280961.1377082], "version": 0.2, "tvm_version": "0.9.dev0"}
{"input": ["cuda -keys=cuda,gpu -arch=sm_75 -max_num_threads=1024 -thread_warp_size=32", "conv2d_nchw.cuda", [["TENSOR", [1, 256, 14, 14], "float32"], ["TENSOR", [512, 256, 1, 1], "float32"], [2, 2], [0, 0, 0, 0], [1, 1], "float32"], {}], "config": {"index": 2221, "code_hash": null, "entity": [["tile_f", "sp", [-1, 4, 4, 1]], ["tile_y", "sp", [-1, 1, 7, 1]], ["tile_x", "sp", [-1, 1, 7, 1]], ["tile_rc", "sp", [-1, 1]], ["tile_ry", "sp", [-1, 1]], ["tile_rx", "sp", [-1, 1]], ["auto_unroll_max_step", "ot", 0], ["unroll_explicit", "ot", 0]]}, "result": [[4.5412254384310774e-05], 0, 1.90604567527771, 1655284955.368791], "version": 0.2, "tvm_version": "0.9.dev0"}
{"input": ["cuda -keys=cuda,gpu -arch=sm_75 -max_num_threads=1024 -thread_warp_size=32", "conv2d_nchw.cuda", [["TENSOR", [1, 256, 14, 14], "float32"], ["TENSOR", [512, 256, 3, 3], "float32"], [2, 2], [1, 1, 1, 1], [1, 1], "float32"], {}], "config": {"index": 461, "code_hash": null, "entity": [["tile_f", "sp", [-1, 4, 4, 1]], ["tile_y", "sp", [-1, 1, 7, 1]], ["tile_x", "sp", [-1, 1, 1, 1]], ["tile_rc", "sp", [-1, 1]], ["tile_ry", "sp", [-1, 1]], ["tile_rx", "sp", [-1, 1]], ["auto_unroll_max_step", "ot", 0], ["unroll_explicit", "ot", 0]]}, "result": [[0.0006298043591836734], 0, 1.5189688205718994, 1655286449.217099], "version": 0.2, "tvm_version": "0.9.dev0"}
{"input": ["cuda -keys=cuda,gpu -arch=sm_75 -max_num_threads=1024 -thread_warp_size=32", "conv2d_nchw_winograd.cuda", [["TENSOR", [1, 256, 14, 14], "float32"], ["TENSOR", [256, 256, 3, 3], "float32"], [1, 1], [1, 1, 1, 1], [1, 1], "float32"], {}], "config": {"index": 2413, "code_hash": null, "entity": [["tile_b", "sp", [-1, 1, 1, 1]], ["tile_y", "sp", [-1, 1, 16, 4]], ["tile_x", "sp", [-1, 7, 7, 1]], ["tile_rc", "sp", [-1, 2]], ["auto_unroll_max_step", "ot", 0], ["unroll_explicit", "ot", 0]]}, "result": [[9.445361094586557e-05], 0, 1.8760027885437012, 1655294168.71713], "version": 0.2, "tvm_version": "0.9.dev0"}
{"input": ["cuda -keys=cuda,gpu -arch=sm_75 -max_num_threads=1024 -thread_warp_size=32", "conv2d_nchw.cuda", [["TENSOR", [1, 256, 14, 14], "float32"], ["TENSOR", [256, 256, 3, 3], "float32"], [1, 1], [1, 1, 1, 1], [1, 1], "float32"], {}], "config": {"index": 1950, "code_hash": null, "entity": [["tile_f", "sp", [-1, 1, 2, 16]], ["tile_y", "sp", [-1, 1, 7, 2]], ["tile_x", "sp", [-1, 1, 1, 1]], ["tile_rc", "sp", [-1, 1]], ["tile_ry", "sp", [-1, 1]], ["tile_rx", "sp", [-1, 1]], ["auto_unroll_max_step", "ot", 0], ["unroll_explicit", "ot", 0]]}, "result": [[0.0005087616270096463], 0, 1.6319198608398438, 1655297546.4874005], "version": 0.2, "tvm_version": "0.9.dev0"}
{"input": ["cuda -keys=cuda,gpu -arch=sm_75 -max_num_threads=1024 -thread_warp_size=32", "conv2d_nchw.cuda", [["TENSOR", [1, 128, 28, 28], "float32"], ["TENSOR", [256, 128, 1, 1], "float32"], [2, 2], [0, 0, 0, 0], [1, 1], "float32"], {}], "config": {"index": 861, "code_hash": null, "entity": [["tile_f", "sp", [-1, 2, 32, 1]], ["tile_y", "sp", [-1, 7, 2, 1]], ["tile_x", "sp", [-1, 1, 1, 1]], ["tile_rc", "sp", [-1, 1]], ["tile_ry", "sp", [-1, 1]], ["tile_rx", "sp", [-1, 1]], ["auto_unroll_max_step", "ot", 0], ["unroll_explicit", "ot", 0]]}, "result": [[3.6303998557692304e-05], 0, 1.5071840286254883, 1655300125.3573542], "version": 0.2, "tvm_version": "0.9.dev0"}
{"input": ["cuda -keys=cuda,gpu -arch=sm_75 -max_num_threads=1024 -thread_warp_size=32", "conv2d_nchw.cuda", [["TENSOR", [1, 128, 28, 28], "float32"], ["TENSOR", [256, 128, 3, 3], "float32"], [2, 2], [1, 1, 1, 1], [1, 1], "float32"], {}], "config": {"index": 896, "code_hash": null, "entity": [["tile_f", "sp", [-1, 1, 16, 2]], ["tile_y", "sp", [-1, 7, 2, 1]], ["tile_x", "sp", [-1, 1, 1, 1]], ["tile_rc", "sp", [-1, 1]], ["tile_ry", "sp", [-1, 1]], ["tile_rx", "sp", [-1, 1]], ["auto_unroll_max_step", "ot", 0], ["unroll_explicit", "ot", 0]]}, "result": [[0.00038009123484848483], 0, 1.6847288608551025, 1655303470.014816], "version": 0.2, "tvm_version": "0.9.dev0"}
{"input": ["cuda -keys=cuda,gpu -arch=sm_75 -max_num_threads=1024 -thread_warp_size=32", "conv2d_nchw_winograd.cuda", [["TENSOR", [1, 128, 28, 28], "float32"], ["TENSOR", [128, 128, 3, 3], "float32"], [1, 1], [1, 1, 1, 1], [1, 1], "float32"], {}], "config": {"index": 2432, "code_hash": null, "entity": [["tile_b", "sp", [-1, 1, 1, 1]], ["tile_y", "sp", [-1, 4, 32, 1]], ["tile_x", "sp", [-1, 4, 7, 1]], ["tile_rc", "sp", [-1, 1]], ["auto_unroll_max_step", "ot", 0], ["unroll_explicit", "ot", 0]]}, "result": [[8.400803524672709e-05], 0, 1.9657261371612549, 1655309387.2385755], "version": 0.2, "tvm_version": "0.9.dev0"}
{"input": ["cuda -keys=cuda,gpu -arch=sm_75 -max_num_threads=1024 -thread_warp_size=32", "conv2d_nchw.cuda", [["TENSOR", [1, 128, 28, 28], "float32"], ["TENSOR", [128, 128, 3, 3], "float32"], [1, 1], [1, 1, 1, 1], [1, 1], "float32"], {}], "config": {"index": 1757, "code_hash": null, "entity": [["tile_f", "sp", [-1, 4, 4, 4]], ["tile_y", "sp", [-1, 4, 7, 1]], ["tile_x", "sp", [-1, 1, 1, 1]], ["tile_rc", "sp", [-1, 1]], ["tile_ry", "sp", [-1, 1]], ["tile_rx", "sp", [-1, 1]], ["auto_unroll_max_step", "ot", 0], ["unroll_explicit", "ot", 0]]}, "result": [[0.0002831558949275362], 0, 1.6115822792053223, 1655312172.9899042], "version": 0.2, "tvm_version": "0.9.dev0"}
{"input": ["cuda -keys=cuda,gpu -arch=sm_75 -max_num_threads=1024 -thread_warp_size=32", "conv2d_nchw.cuda", [["TENSOR", [1, 64, 56, 56], "float32"], ["TENSOR", [128, 64, 1, 1], "float32"], [2, 2], [0, 0, 0, 0], [1, 1], "float32"], {}], "config": {"index": 1708, "code_hash": null, "entity": [["tile_f", "sp", [-1, 4, 16, 1]], ["tile_y", "sp", [-1, 4, 7, 1]], ["tile_x", "sp", [-1, 1, 1, 1]], ["tile_rc", "sp", [-1, 1]], ["tile_ry", "sp", [-1, 1]], ["tile_rx", "sp", [-1, 1]], ["auto_unroll_max_step", "ot", 0], ["unroll_explicit", "ot", 0]]}, "result": [[2.978623039126478e-05], 0, 1.5206561088562012, 1655315350.8395166], "version": 0.2, "tvm_version": "0.9.dev0"}
{"input": ["cuda -keys=cuda,gpu -arch=sm_75 -max_num_threads=1024 -thread_warp_size=32", "conv2d_nchw.cuda", [["TENSOR", [1, 64, 56, 56], "float32"], ["TENSOR", [128, 64, 3, 3], "float32"], [2, 2], [1, 1, 1, 1], [1, 1], "float32"], {}], "config": {"index": 1379, "code_hash": null, "entity": [["tile_f", "sp", [-1, 2, 16, 2]], ["tile_y", "sp", [-1, 7, 4, 1]], ["tile_x", "sp", [-1, 1, 1, 1]], ["tile_rc", "sp", [-1, 1]], ["tile_ry", "sp", [-1, 1]], ["tile_rx", "sp", [-1, 1]], ["auto_unroll_max_step", "ot", 0], ["unroll_explicit", "ot", 0]]}, "result": [[0.00025308892744479495], 0, 2.0474462509155273, 1655318255.147032], "version": 0.2, "tvm_version": "0.9.dev0"}
{"input": ["cuda -keys=cuda,gpu -arch=sm_75 -max_num_threads=1024 -thread_warp_size=32", "conv2d_nchw.cuda", [["TENSOR", [1, 64, 56, 56], "float32"], ["TENSOR", [64, 64, 1, 1], "float32"], [1, 1], [0, 0, 0, 0], [1, 1], "float32"], {}], "config": {"index": 2246, "code_hash": null, "entity": [["tile_f", "sp", [-1, 2, 8, 4]], ["tile_y", "sp", [-1, 4, 14, 1]], ["tile_x", "sp", [-1, 1, 1, 1]], ["tile_rc", "sp", [-1, 1]], ["tile_ry", "sp", [-1, 1]], ["tile_rx", "sp", [-1, 1]], ["auto_unroll_max_step", "ot", 0], ["unroll_explicit", "ot", 0]]}, "result": [[4.0222587506197326e-05], 0, 1.6551332473754883, 1655322120.8423622], "version": 0.2, "tvm_version": "0.9.dev0"}
{"input": ["cuda -keys=cuda,gpu -arch=sm_75 -max_num_threads=1024 -thread_warp_size=32", "conv2d_nchw_winograd.cuda", [["TENSOR", [1, 64, 56, 56], "float32"], ["TENSOR", [64, 64, 3, 3], "float32"], [1, 1], [1, 1, 1, 1], [1, 1], "float32"], {}], "config": {"index": 2765, "code_hash": null, "entity": [["tile_b", "sp", [-1, 1, 1, 1]], ["tile_y", "sp", [-1, 1, 2, 16]], ["tile_x", "sp", [-1, 4, 49, 1]], ["tile_rc", "sp", [-1, 1]], ["auto_unroll_max_step", "ot", 0], ["unroll_explicit", "ot", 0]]}, "result": [[6.138468289832489e-05], 0, 4.833231687545776, 1655325881.839948], "version": 0.2, "tvm_version": "0.9.dev0"}
{"input": ["cuda -keys=cuda,gpu -arch=sm_75 -max_num_threads=1024 -thread_warp_size=32", "conv2d_nchw.cuda", [["TENSOR", [1, 64, 56, 56], "float32"], ["TENSOR", [64, 64, 3, 3], "float32"], [1, 1], [1, 1, 1, 1], [1, 1], "float32"], {}], "config": {"index": 2244, "code_hash": null, "entity": [["tile_f", "sp", [-1, 4, 4, 4]], ["tile_y", "sp", [-1, 4, 14, 1]], ["tile_x", "sp", [-1, 1, 1, 1]], ["tile_rc", "sp", [-1, 1]], ["tile_ry", "sp", [-1, 1]], ["tile_rx", "sp", [-1, 1]], ["auto_unroll_max_step", "ot", 0], ["unroll_explicit", "ot", 0]]}, "result": [[0.00019003262073027092], 0, 1.7466776371002197, 1655328752.3708103], "version": 0.2, "tvm_version": "0.9.dev0"}
{"input": ["cuda -keys=cuda,gpu -arch=sm_75 -max_num_threads=1024 -thread_warp_size=32", "conv2d_nchw.cuda", [["TENSOR", [1, 3, 224, 224], "float32"], ["TENSOR", [64, 3, 7, 7], "float32"], [2, 2], [3, 3, 3, 3], [1, 1], "float32"], {}], "config": {"index": 2664, "code_hash": null, "entity": [["tile_f", "sp", [-1, 4, 4, 4]], ["tile_y", "sp", [-1, 7, 8, 1]], ["tile_x", "sp", [-1, 1, 1, 1]], ["tile_rc", "sp", [-1, 1]], ["tile_ry", "sp", [-1, 1]], ["tile_rx", "sp", [-1, 1]], ["auto_unroll_max_step", "ot", 0], ["unroll_explicit", "ot", 0]]}, "result": [[0.00030264496996466433], 0, 1.8742544651031494, 1655333392.465262], "version": 0.2, "tvm_version": "0.9.dev0"}
