exp/partial_log/bert_xgb_knob_cuda_300.json
{"input": ["cuda -keys=cuda,gpu -max_num_threads=1024 -thread_warp_size=32", "dense_small_batch.gpu", [["TENSOR", [1, 768], "float32"], ["TENSOR", [768, 768], "float32"], null, "float32"], {}], "config": {"index": 9, "code_hash": null, "entity": [["tile_k", "sp", [-1, 32]]]}, "result": [[4.360221310875137e-06], 0, 1.5269749164581299, 1662525386.1668563], "version": 0.2, "tvm_version": "0.8.0"}
{"input": ["cuda -keys=cuda,gpu -max_num_threads=1024 -thread_warp_size=32", "dense_large_batch.gpu", [["TENSOR", [128, 3072], "float32"], ["TENSOR", [768, 3072], "float32"], null, "float32"], {}], "config": {"index": 399164, "code_hash": null, "entity": [["tile_x", "sp", [-1, 2, 2, 2]], ["tile_y", "sp", [-1, 24, 2, 1]], ["tile_k", "sp", [-1, 8, 1]]]}, "result": [[0.00142091856302521], 0, 1.9628162384033203, 1662525708.847518], "version": 0.2, "tvm_version": "0.8.0"}
{"input": ["cuda -keys=cuda,gpu -max_num_threads=1024 -thread_warp_size=32", "dense_small_batch.gpu", [["TENSOR", [128, 3072], "float32"], ["TENSOR", [768, 3072], "float32"], null, "float32"], {}], "config": {"index": 16, "code_hash": null, "entity": [["tile_k", "sp", [-1, 384]]]}, "result": [[0.004171878270270271], 0, 1.3636839389801025, 1662531009.5145192], "version": 0.2, "tvm_version": "0.8.0"}
{"input": ["cuda -keys=cuda,gpu -max_num_threads=1024 -thread_warp_size=32", "dense_large_batch.gpu", [["TENSOR", [128, 768], "float32"], ["TENSOR", [3072, 768], "float32"], null, "float32"], {}], "config": {"index": 2909651, "code_hash": null, "entity": [["tile_x", "sp", [-1, 8, 2, 1]], ["tile_y", "sp", [-1, 8, 2, 2]], ["tile_k", "sp", [-1, 4, 2]]]}, "result": [[0.001019543105263158], 0, 2.4782795906066895, 1662531535.963662], "version": 0.2, "tvm_version": "0.8.0"}
{"input": ["cuda -keys=cuda,gpu -max_num_threads=1024 -thread_warp_size=32", "dense_small_batch.gpu", [["TENSOR", [128, 768], "float32"], ["TENSOR", [3072, 768], "float32"], null, "float32"], {}], "config": {"index": 13, "code_hash": null, "entity": [["tile_k", "sp", [-1, 128]]]}, "result": [[0.004168303810810811], 0, 1.2866263389587402, 1662537087.4089901], "version": 0.2, "tvm_version": "0.8.0"}
{"input": ["cuda -keys=cuda,gpu -max_num_threads=1024 -thread_warp_size=32", "batch_matmul.cuda", [["TENSOR", [12, 128, 128], "float32"], ["TENSOR", [12, 64, 128], "float32"], [12, 128, 64], null, 0, 1], {}], "config": {"index": 61946, "code_hash": null, "entity": [["tile_y", "sp", [-1, 1, 16]], ["tile_x", "sp", [-1, 32, 2]], ["tile_k", "sp", [-1, 32]], ["auto_unroll_max_step", "ot", 64], ["unroll_explicit", "ot", 1]]}, "result": [[1.805037332087373e-05], 0, 2.2030181884765625, 1662537485.955468], "version": 0.2, "tvm_version": "0.8.0"}
{"input": ["cuda -keys=cuda,gpu -max_num_threads=1024 -thread_warp_size=32", "batch_matmul.cuda", [["TENSOR", [12, 128, 64], "float32"], ["TENSOR", [12, 128, 64], "float32"], [12, 128, 128], null, 0, 1], {}], "config": {"index": 70483, "code_hash": null, "entity": [["tile_y", "sp", [-1, 2, 32]], ["tile_x", "sp", [-1, 32, 2]], ["tile_k", "sp", [-1, 32]], ["auto_unroll_max_step", "ot", 64], ["unroll_explicit", "ot", 1]]}, "result": [[1.4181002645744003e-05], 0, 1.7867417335510254, 1662541936.376423], "version": 0.2, "tvm_version": "0.8.0"}
{"input": ["cuda -keys=cuda,gpu -max_num_threads=1024 -thread_warp_size=32", "dense_small_batch.gpu", [["TENSOR", [128, 768], "float32"], ["TENSOR", [768, 768], "float32"], null, "float32"], {}], "config": {"index": 9, "code_hash": null, "entity": [["tile_k", "sp", [-1, 32]]]}, "result": [[0.00034506167182130586], 0, 1.361821174621582, 1662551581.4834933], "version": 0.2, "tvm_version": "0.8.0"}
{"input": ["cuda -keys=cuda,gpu -max_num_threads=1024 -thread_warp_size=32", "dense_large_batch.gpu", [["TENSOR", [128, 768], "float32"], ["TENSOR", [768, 768], "float32"], null, "float32"], {}], "config": {"index": 441731, "code_hash": null, "entity": [["tile_x", "sp", [-1, 8, 2, 1]], ["tile_y", "sp", [-1, 2, 2, 6]], ["tile_k", "sp", [-1, 8, 1]]]}, "result": [[0.00028874152181818184], 0, 1.7802691459655762, 1662546169.2459886], "version": 0.2, "tvm_version": "0.8.0"}
