exp/partial_log/bert_xgb_knob_cuda_100.json.tmp
{"input": ["cuda -keys=cuda,gpu -max_num_threads=1024 -thread_warp_size=32", "dense_small_batch.gpu", [["TENSOR", [1, 768], "float32"], ["TENSOR", [768, 768], "float32"], null, "float32"], {}], "config": {"index": 16, "code_hash": null, "entity": [["tile_k", "sp", [-1, 384]]]}, "result": [[1.2617479366100875e-05], 0, 1.5890247821807861, 1655820220.9396827], "version": 0.2, "tvm_version": "0.8.0"}
{"input": ["cuda -keys=cuda,gpu -max_num_threads=1024 -thread_warp_size=32", "dense_small_batch.gpu", [["TENSOR", [1, 768], "float32"], ["TENSOR", [768, 768], "float32"], null, "float32"], {}], "config": {"index": 9, "code_hash": null, "entity": [["tile_k", "sp", [-1, 32]]]}, "result": [[4.259612471012626e-06], 0, 1.4450702667236328, 1655820222.1871912], "version": 0.2, "tvm_version": "0.8.0"}
{"input": ["cuda -keys=cuda,gpu -max_num_threads=1024 -thread_warp_size=32", "dense_small_batch.gpu", [["TENSOR", [1, 768], "float32"], ["TENSOR", [768, 768], "float32"], null, "float32"], {}], "config": {"index": 13, "code_hash": null, "entity": [["tile_k", "sp", [-1, 128]]]}, "result": [[5.499210904882919e-06], 0, 1.4501962661743164, 1655820224.1092296], "version": 0.2, "tvm_version": "0.8.0"}
{"input": ["cuda -keys=cuda,gpu -max_num_threads=1024 -thread_warp_size=32", "dense_small_batch.gpu", [["TENSOR", [1, 768], "float32"], ["TENSOR", [768, 768], "float32"], null, "float32"], {}], "config": {"index": 8, "code_hash": null, "entity": [["tile_k", "sp", [-1, 24]]]}, "result": [[5.311176240067552e-06], 0, 1.5325653553009033, 1655820225.3938048], "version": 0.2, "tvm_version": "0.8.0"}
{"input": ["cuda -keys=cuda,gpu -max_num_threads=1024 -thread_warp_size=32", "dense_small_batch.gpu", [["TENSOR", [1, 768], "float32"], ["TENSOR", [768, 768], "float32"], null, "float32"], {}], "config": {"index": 14, "code_hash": null, "entity": [["tile_k", "sp", [-1, 192]]]}, "result": [[6.759238427699731e-06], 0, 1.4596335887908936, 1655820227.3066862], "version": 0.2, "tvm_version": "0.8.0"}
{"input": ["cuda -keys=cuda,gpu -max_num_threads=1024 -thread_warp_size=32", "dense_small_batch.gpu", [["TENSOR", [1, 768], "float32"], ["TENSOR", [768, 768], "float32"], null, "float32"], {}], "config": {"index": 3, "code_hash": null, "entity": [["tile_k", "sp", [-1, 4]]]}, "result": [[1.4355614565157498e-05], 0, 1.145228624343872, 1655820228.8189104], "version": 0.2, "tvm_version": "0.8.0"}
{"input": ["cuda -keys=cuda,gpu -max_num_threads=1024 -thread_warp_size=32", "dense_small_batch.gpu", [["TENSOR", [1, 768], "float32"], ["TENSOR", [768, 768], "float32"], null, "float32"], {}], "config": {"index": 1, "code_hash": null, "entity": [["tile_k", "sp", [-1, 2]]]}, "result": [[2.5999288464786352e-05], 0, 1.1022655963897705, 1655820230.3084655], "version": 0.2, "tvm_version": "0.8.0"}
{"input": ["cuda -keys=cuda,gpu -max_num_threads=1024 -thread_warp_size=32", "dense_small_batch.gpu", [["TENSOR", [1, 768], "float32"], ["TENSOR", [768, 768], "float32"], null, "float32"], {}], "config": {"index": 10, "code_hash": null, "entity": [["tile_k", "sp", [-1, 48]]]}, "result": [[5.348471325069832e-06], 0, 1.5249817371368408, 1655820231.590311], "version": 0.2, "tvm_version": "0.8.0"}
{"input": ["cuda -keys=cuda,gpu -max_num_threads=1024 -thread_warp_size=32", "dense_small_batch.gpu", [["TENSOR", [1, 768], "float32"], ["TENSOR", [768, 768], "float32"], null, "float32"], {}], "config": {"index": 11, "code_hash": null, "entity": [["tile_k", "sp", [-1, 64]]]}, "result": [[4.845447056672018e-06], 0, 1.4897160530090332, 1655820233.490368], "version": 0.2, "tvm_version": "0.8.0"}
{"input": ["cuda -keys=cuda,gpu -max_num_threads=1024 -thread_warp_size=32", "dense_small_batch.gpu", [["TENSOR", [1, 768], "float32"], ["TENSOR", [768, 768], "float32"], null, "float32"], {}], "config": {"index": 4, "code_hash": null, "entity": [["tile_k", "sp", [-1, 6]]]}, "result": [[1.0871599127484245e-05], 0, 1.0676043033599854, 1655820235.0084558], "version": 0.2, "tvm_version": "0.8.0"}
{"input": ["cuda -keys=cuda,gpu -max_num_threads=1024 -thread_warp_size=32", "dense_small_batch.gpu", [["TENSOR", [1, 768], "float32"], ["TENSOR", [768, 768], "float32"], null, "float32"], {}], "config": {"index": 12, "code_hash": null, "entity": [["tile_k", "sp", [-1, 96]]]}, "result": [[5.2760622820569405e-06], 0, 1.4655201435089111, 1655820236.2649782], "version": 0.2, "tvm_version": "0.8.0"}
{"input": ["cuda -keys=cuda,gpu -max_num_threads=1024 -thread_warp_size=32", "dense_small_batch.gpu", [["TENSOR", [1, 768], "float32"], ["TENSOR", [768, 768], "float32"], null, "float32"], {}], "config": {"index": 17, "code_hash": null, "entity": [["tile_k", "sp", [-1, 768]]]}, "result": [[2.6116234647632e-05], 0, 1.4882841110229492, 1655820237.5272415], "version": 0.2, "tvm_version": "0.8.0"}
{"input": ["cuda -keys=cuda,gpu -max_num_threads=1024 -thread_warp_size=32", "dense_small_batch.gpu", [["TENSOR", [1, 768], "float32"], ["TENSOR", [768, 768], "float32"], null, "float32"], {}], "config": {"index": 15, "code_hash": null, "entity": [["tile_k", "sp", [-1, 256]]]}, "result": [[7.75212544661881e-06], 0, 1.420577049255371, 1655820239.4067261], "version": 0.2, "tvm_version": "0.8.0"}
{"input": ["cuda -keys=cuda,gpu -max_num_threads=1024 -thread_warp_size=32", "dense_small_batch.gpu", [["TENSOR", [1, 768], "float32"], ["TENSOR", [768, 768], "float32"], null, "float32"], {}], "config": {"index": 5, "code_hash": null, "entity": [["tile_k", "sp", [-1, 8]]]}, "result": [[8.945469402773848e-06], 0, 1.0778729915618896, 1655820240.272236], "version": 0.2, "tvm_version": "0.8.0"}
{"input": ["cuda -keys=cuda,gpu -max_num_threads=1024 -thread_warp_size=32", "dense_small_batch.gpu", [["TENSOR", [1, 768], "float32"], ["TENSOR", [768, 768], "float32"], null, "float32"], {}], "config": {"index": 7, "code_hash": null, "entity": [["tile_k", "sp", [-1, 16]]]}, "result": [[6.032058136123607e-06], 0, 1.4663715362548828, 1655820242.205842], "version": 0.2, "tvm_version": "0.8.0"}
{"input": ["cuda -keys=cuda,gpu -max_num_threads=1024 -thread_warp_size=32", "dense_small_batch.gpu", [["TENSOR", [1, 768], "float32"], ["TENSOR", [768, 768], "float32"], null, "float32"], {}], "config": {"index": 2, "code_hash": null, "entity": [["tile_k", "sp", [-1, 3]]]}, "result": [[1.8905034507634966e-05], 0, 1.0686209201812744, 1655820243.0987449], "version": 0.2, "tvm_version": "0.8.0"}
{"input": ["cuda -keys=cuda,gpu -max_num_threads=1024 -thread_warp_size=32", "dense_small_batch.gpu", [["TENSOR", [1, 768], "float32"], ["TENSOR", [768, 768], "float32"], null, "float32"], {}], "config": {"index": 6, "code_hash": null, "entity": [["tile_k", "sp", [-1, 12]]]}, "result": [[7.061209571331367e-06], 0, 1.0235486030578613, 1655820244.6063523], "version": 0.2, "tvm_version": "0.8.0"}
{"input": ["cuda -keys=cuda,gpu -max_num_threads=1024 -thread_warp_size=32", "dense_small_batch.gpu", [["TENSOR", [1, 768], "float32"], ["TENSOR", [768, 768], "float32"], null, "float32"], {}], "config": {"index": 0, "code_hash": null, "entity": [["tile_k", "sp", [-1, 1]]]}, "result": [[4.7953091748644855e-05], 0, 1.447007417678833, 1655820245.8684113], "version": 0.2, "tvm_version": "0.8.0"}
{"input": ["cuda -keys=cuda,gpu -max_num_threads=1024 -thread_warp_size=32", "dense_small_batch.gpu", [["TENSOR", [128, 3072], "float32"], ["TENSOR", [768, 3072], "float32"], null, "float32"], {}], "config": {"index": 12, "code_hash": null, "entity": [["tile_k", "sp", [-1, 96]]]}, "result": [[0.004563202787878788], 0, 1.236865758895874, 1655825674.7968814], "version": 0.2, "tvm_version": "0.8.0"}
{"input": ["cuda -keys=cuda,gpu -max_num_threads=1024 -thread_warp_size=32", "dense_small_batch.gpu", [["TENSOR", [128, 3072], "float32"], ["TENSOR", [768, 3072], "float32"], null, "float32"], {}], "config": {"index": 17, "code_hash": null, "entity": [["tile_k", "sp", [-1, 512]]]}, "result": [[0.004168188702702703], 0, 1.2069740295410156, 1655825675.7826006], "version": 0.2, "tvm_version": "0.8.0"}
{"input": ["cuda -keys=cuda,gpu -max_num_threads=1024 -thread_warp_size=32", "dense_small_batch.gpu", [["TENSOR", [128, 3072], "float32"], ["TENSOR", [768, 3072], "float32"], null, "float32"], {}], "config": {"index": 2, "code_hash": null, "entity": [["tile_k", "sp", [-1, 3]]]}, "result": [[0.0128209459], 0, 1.4531142711639404, 1655825676.9920576], "version": 0.2, "tvm_version": "0.8.0"}
{"input": ["cuda -keys=cuda,gpu -max_num_threads=1024 -thread_warp_size=32", "dense_small_batch.gpu", [["TENSOR", [128, 3072], "float32"], ["TENSOR", [768, 3072], "float32"], null, "float32"], {}], "config": {"index": 11, "code_hash": null, "entity": [["tile_k", "sp", [-1, 64]]]}, "result": [[0.00457875403030303], 0, 1.2494630813598633, 1655825677.9819217], "version": 0.2, "tvm_version": "0.8.0"}
{"input": ["cuda -keys=cuda,gpu -max_num_threads=1024 -thread_warp_size=32", "dense_small_batch.gpu", [["TENSOR", [128, 3072], "float32"], ["TENSOR", [768, 3072], "float32"], null, "float32"], {}], "config": {"index": 6, "code_hash": null, "entity": [["tile_k", "sp", [-1, 12]]]}, "result": [[0.004737416625], 0, 1.2264957427978516, 1655825678.9762504], "version": 0.2, "tvm_version": "0.8.0"}
{"input": ["cuda -keys=cuda,gpu -max_num_threads=1024 -thread_warp_size=32", "dense_small_batch.gpu", [["TENSOR", [128, 3072], "float32"], ["TENSOR", [768, 3072], "float32"], null, "float32"], {}], "config": {"index": 14, "code_hash": null, "entity": [["tile_k", "sp", [-1, 192]]]}, "result": [[0.0044552074411764704], 0, 1.3035268783569336, 1655825679.959194], "version": 0.2, "tvm_version": "0.8.0"}
{"input": ["cuda -keys=cuda,gpu -max_num_threads=1024 -thread_warp_size=32", "dense_small_batch.gpu", [["TENSOR", [128, 3072], "float32"], ["TENSOR", [768, 3072], "float32"], null, "float32"], {}], "config": {"index": 10, "code_hash": null, "entity": [["tile_k", "sp", [-1, 48]]]}, "result": [[0.00482547890625], 0, 1.2688779830932617, 1655825680.9609823], "version": 0.2, "tvm_version": "0.8.0"}
{"input": ["cuda -keys=cuda,gpu -max_num_threads=1024 -thread_warp_size=32", "dense_small_batch.gpu", [["TENSOR", [128, 3072], "float32"], ["TENSOR", [768, 3072], "float32"], null, "float32"], {}], "config": {"index": 13, "code_hash": null, "entity": [["tile_k", "sp", [-1, 128]]]}, "result": [[0.0045252813235294115], 0, 1.2480716705322266, 1655825681.9596882], "version": 0.2, "tvm_version": "0.8.0"}
{"input": ["cuda -keys=cuda,gpu -max_num_threads=1024 -thread_warp_size=32", "dense_small_batch.gpu", [["TENSOR", [128, 3072], "float32"], ["TENSOR", [768, 3072], "float32"], null, "float32"], {}], "config": {"index": 8, "code_hash": null, "entity": [["tile_k", "sp", [-1, 24]]]}, "result": [[0.004654371121212121], 0, 1.261869192123413, 1655825682.9515257], "version": 0.2, "tvm_version": "0.8.0"}
{"input": ["cuda -keys=cuda,gpu -max_num_threads=1024 -thread_warp_size=32", "dense_small_batch.gpu", [["TENSOR", [128, 3072], "float32"], ["TENSOR", [768, 3072], "float32"], null, "float32"], {}], "config": {"index": 1, "code_hash": null, "entity": [["tile_k", "sp", [-1, 2]]]}, "result": [[0.017526614850000004], 0, 1.7310466766357422, 1655825684.47821], "version": 0.2, "tvm_version": "0.8.0"}
{"input": ["cuda -keys=cuda,gpu -max_num_threads=1024 -thread_warp_size=32", "dense_small_batch.gpu", [["TENSOR", [128, 3072], "float32"], ["TENSOR", [768, 3072], "float32"], null, "float32"], {}], "config": {"index": 0, "code_hash": null, "entity": [["tile_k", "sp", [-1, 1]]]}, "result": [[0.02797485835], 0, 2.48341703414917, 1655825686.6362548], "version": 0.2, "tvm_version": "0.8.0"}
{"input": ["cuda -keys=cuda,gpu -max_num_threads=1024 -thread_warp_size=32", "dense_small_batch.gpu", [["TENSOR", [128, 3072], "float32"], ["TENSOR", [768, 3072], "float32"], null, "float32"], {}], "config": {"index": 15, "code_hash": null, "entity": [["tile_k", "sp", [-1, 256]]]}, "result": [[0.004347029971428572], 0, 1.2858762741088867, 1655825687.6393104], "version": 0.2, "tvm_version": "0.8.0"}
{"input": ["cuda -keys=cuda,gpu -max_num_threads=1024 -thread_warp_size=32", "dense_small_batch.gpu", [["TENSOR", [128, 3072], "float32"], ["TENSOR", [768, 3072], "float32"], null, "float32"], {}], "config": {"index": 9, "code_hash": null, "entity": [["tile_k", "sp", [-1, 32]]]}, "result": [[0.004488974205882353], 0, 1.2413105964660645, 1655825688.634002], "version": 0.2, "tvm_version": "0.8.0"}
{"input": ["cuda -keys=cuda,gpu -max_num_threads=1024 -thread_warp_size=32", "dense_small_batch.gpu", [["TENSOR", [128, 3072], "float32"], ["TENSOR", [768, 3072], "float32"], null, "float32"], {}], "config": {"index": 5, "code_hash": null, "entity": [["tile_k", "sp", [-1, 8]]]}, "result": [[0.00709643578125], 0, 1.4416675567626953, 1655825689.872131], "version": 0.2, "tvm_version": "0.8.0"}
{"input": ["cuda -keys=cuda,gpu -max_num_threads=1024 -thread_warp_size=32", "dense_small_batch.gpu", [["TENSOR", [128, 3072], "float32"], ["TENSOR", [768, 3072], "float32"], null, "float32"], {}], "config": {"index": 19, "code_hash": null, "entity": [["tile_k", "sp", [-1, 1024]]]}, "result": [[0.0060386568125], 0, 1.3608601093292236, 1655825691.024439], "version": 0.2, "tvm_version": "0.8.0"}
{"input": ["cuda -keys=cuda,gpu -max_num_threads=1024 -thread_warp_size=32", "dense_small_batch.gpu", [["TENSOR", [128, 3072], "float32"], ["TENSOR", [768, 3072], "float32"], null, "float32"], {}], "config": {"index": 7, "code_hash": null, "entity": [["tile_k", "sp", [-1, 16]]]}, "result": [[0.0046580730606060605], 0, 1.3014476299285889, 1655825692.0479999], "version": 0.2, "tvm_version": "0.8.0"}
{"input": ["cuda -keys=cuda,gpu -max_num_threads=1024 -thread_warp_size=32", "dense_small_batch.gpu", [["TENSOR", [128, 3072], "float32"], ["TENSOR", [768, 3072], "float32"], null, "float32"], {}], "config": {"index": 18, "code_hash": null, "entity": [["tile_k", "sp", [-1, 768]]]}, "result": [[0.005479944], 0, 1.273040771484375, 1655825693.1221576], "version": 0.2, "tvm_version": "0.8.0"}
{"input": ["cuda -keys=cuda,gpu -max_num_threads=1024 -thread_warp_size=32", "dense_small_batch.gpu", [["TENSOR", [128, 3072], "float32"], ["TENSOR", [768, 3072], "float32"], null, "float32"], {}], "config": {"index": 16, "code_hash": null, "entity": [["tile_k", "sp", [-1, 384]]]}, "result": [[0.004163583405405405], 0, 1.207005262374878, 1655825694.1248448], "version": 0.2, "tvm_version": "0.8.0"}
{"input": ["cuda -keys=cuda,gpu -max_num_threads=1024 -thread_warp_size=32", "dense_small_batch.gpu", [["TENSOR", [128, 3072], "float32"], ["TENSOR", [768, 3072], "float32"], null, "float32"], {}], "config": {"index": 3, "code_hash": null, "entity": [["tile_k", "sp", [-1, 4]]]}, "result": [[0.01036976925], 0, 1.2665646076202393, 1655825695.1825151], "version": 0.2, "tvm_version": "0.8.0"}
{"input": ["cuda -keys=cuda,gpu -max_num_threads=1024 -thread_warp_size=32", "dense_small_batch.gpu", [["TENSOR", [128, 3072], "float32"], ["TENSOR", [768, 3072], "float32"], null, "float32"], {}], "config": {"index": 4, "code_hash": null, "entity": [["tile_k", "sp", [-1, 6]]]}, "result": [[0.0083434645625], 0, 1.7471013069152832, 1655825696.664036], "version": 0.2, "tvm_version": "0.8.0"}
{"input": ["cuda -keys=cuda,gpu -max_num_threads=1024 -thread_warp_size=32", "dense_large_batch.gpu", [["TENSOR", [128, 768], "float32"], ["TENSOR", [3072, 768], "float32"], null, "float32"], {}], "config": {"index": 5979250, "code_hash": null, "entity": [["tile_x", "sp", [-1, 4, 2, 1]], ["tile_y", "sp", [-1, 1, 2, 8]], ["tile_k", "sp", [-1, 1, 4]]]}, "result": [[0.0039793129215686274], 0, 1.702852725982666, 1655825749.577763], "version": 0.2, "tvm_version": "0.8.0"}
{"input": ["cuda -keys=cuda,gpu -max_num_threads=1024 -thread_warp_size=32", "dense_large_batch.gpu", [["TENSOR", [128, 768], "float32"], ["TENSOR", [3072, 768], "float32"], null, "float32"], {}], "config": {"index": 5979251, "code_hash": null, "entity": [["tile_x", "sp", [-1, 8, 2, 1]], ["tile_y", "sp", [-1, 1, 2, 8]], ["tile_k", "sp", [-1, 1, 4]]]}, "result": [[0.0028981940363636363], 0, 1.428283929824829, 1655825750.6366026], "version": 0.2, "tvm_version": "0.8.0"}
{"input": ["cuda -keys=cuda,gpu -max_num_threads=1024 -thread_warp_size=32", "dense_large_batch.gpu", [["TENSOR", [128, 768], "float32"], ["TENSOR", [3072, 768], "float32"], null, "float32"], {}], "config": {"index": 5971930, "code_hash": null, "entity": [["tile_x", "sp", [-1, 4, 2, 1]], ["tile_y", "sp", [-1, 1, 2, 6]], ["tile_k", "sp", [-1, 1, 4]]]}, "result": [[0.003660036], 0, 1.2595622539520264, 1655825751.6581056], "version": 0.2, "tvm_version": "0.8.0"}
{"input": ["cuda -keys=cuda,gpu -max_num_threads=1024 -thread_warp_size=32", "dense_large_batch.gpu", [["TENSOR", [128, 768], "float32"], ["TENSOR", [3072, 768], "float32"], null, "float32"], {}], "config": {"index": 5971931, "code_hash": null, "entity": [["tile_x", "sp", [-1, 8, 2, 1]], ["tile_y", "sp", [-1, 1, 2, 6]], ["tile_k", "sp", [-1, 1, 4]]]}, "result": [[0.0029822314716981134], 0, 1.3294684886932373, 1655825752.6979487], "version": 0.2, "tvm_version": "0.8.0"}
{"input": ["cuda -keys=cuda,gpu -max_num_threads=1024 -thread_warp_size=32", "dense_large_batch.gpu", [["TENSOR", [128, 768], "float32"], ["TENSOR", [3072, 768], "float32"], null, "float32"], {}], "config": {"index": 4736445, "code_hash": null, "entity": [["tile_x", "sp", [-1, 4, 2, 2]], ["tile_y", "sp", [-1, 1, 2, 6]], ["tile_k", "sp", [-1, 1, 3]]]}, "result": [[0.003263190816326531], 0, 1.281808853149414, 1655825753.7441719], "version": 0.2, "tvm_version": "0.8.0"}
{"input": ["cuda -keys=cuda,gpu -max_num_threads=1024 -thread_warp_size=32", "dense_large_batch.gpu", [["TENSOR", [128, 768], "float32"], ["TENSOR", [3072, 768], "float32"], null, "float32"], {}], "config": {"index": 4743791, "code_hash": null, "entity": [["tile_x", "sp", [-1, 2, 2, 4]], ["tile_y", "sp", [-1, 1, 2, 8]], ["tile_k", "sp", [-1, 1, 3]]]}, "result": [[0.0027069153050847455], 0, 1.4489920139312744, 1655825754.7740698], "version": 0.2, "tvm_version": "0.8.0"}
{"input": ["cuda -keys=cuda,gpu -max_num_threads=1024 -thread_warp_size=32", "dense_large_batch.gpu", [["TENSOR", [128, 768], "float32"], ["TENSOR", [3072, 768], "float32"], null, "float32"], {}], "config": {"index": 4743730, "code_hash": null, "entity": [["tile_x", "sp", [-1, 4, 2, 1]], ["tile_y", "sp", [-1, 1, 2, 8]], ["tile_k", "sp", [-1, 1, 3]]]}, "result": [[0.004167471837837838], 0, 1.2413170337677002, 1655825755.7989008], "version": 0.2, "tvm_version": "0.8.0"}
{"input": ["cuda -keys=cuda,gpu -max_num_threads=1024 -thread_warp_size=32", "dense_large_batch.gpu", [["TENSOR", [128, 768], "float32"], ["TENSOR", [3072, 768], "float32"], null, "float32"], {}], "config": {"index": 5971929, "code_hash": null, "entity": [["tile_x", "sp", [-1, 2, 2, 1]], ["tile_y", "sp", [-1, 1, 2, 6]], ["tile_k", "sp", [-1, 1, 4]]]}, "result": [[0.0058083443125], 0, 1.4045634269714355, 1655825756.961079], "version": 0.2, "tvm_version": "0.8.0"}
{"input": ["cuda -keys=cuda,gpu -max_num_threads=1024 -thread_warp_size=32", "dense_large_batch.gpu", [["TENSOR", [128, 768], "float32"], ["TENSOR", [3072, 768], "float32"], null, "float32"], {}], "config": {"index": 4743731, "code_hash": null, "entity": [["tile_x", "sp", [-1, 8, 2, 1]], ["tile_y", "sp", [-1, 1, 2, 8]], ["tile_k", "sp", [-1, 1, 3]]]}, "result": [[0.0029485418703703702], 0, 1.4142656326293945, 1655825757.9940045], "version": 0.2, "tvm_version": "0.8.0"}
{"input": ["cuda -keys=cuda,gpu -max_num_threads=1024 -thread_warp_size=32", "dense_large_batch.gpu", [["TENSOR", [128, 768], "float32"], ["TENSOR", [3072, 768], "float32"], null, "float32"], {}], "config": {"index": 4736410, "code_hash": null, "entity": [["tile_x", "sp", [-1, 4, 2, 1]], ["tile_y", "sp", [-1, 1, 2, 6]], ["tile_k", "sp", [-1, 1, 3]]]}, "result": [[0.0047513559375], 0, 1.387493371963501, 1655825759.043771], "version": 0.2, "tvm_version": "0.8.0"}
{"input": ["cuda -keys=cuda,gpu -max_num_threads=1024 -thread_warp_size=32", "dense_large_batch.gpu", [["TENSOR", [128, 768], "float32"], ["TENSOR", [3072, 768], "float32"], null, "float32"], {}], "config": {"index": 5948085, "code_hash": null, "entity": [["tile_x", "sp", [-1, 4, 2, 2]], ["tile_y", "sp", [-1, 2, 2, 3]], ["tile_k", "sp", [-1, 1, 4]]]}, "result": [[0.002984520245283019], 0, 1.3884222507476807, 1655825760.0863771], "version": 0.2, "tvm_version": "0.8.0"}
{"input": ["cuda -keys=cuda,gpu -max_num_threads=1024 -thread_warp_size=32", "dense_large_batch.gpu", [["TENSOR", [128, 768], "float32"], ["TENSOR", [3072, 768], "float32"], null, "float32"], {}], "config": {"index": 5971991, "code_hash": null, "entity": [["tile_x", "sp", [-1, 2, 2, 4]], ["tile_y", "sp", [-1, 1, 2, 6]], ["tile_k", "sp", [-1, 1, 4]]]}, "result": [[0.0029854388679245287], 0, 1.378049373626709, 1655825761.1133184], "version": 0.2, "tvm_version": "0.8.0"}
{"input": ["cuda -keys=cuda,gpu -max_num_threads=1024 -thread_warp_size=32", "dense_large_batch.gpu", [["TENSOR", [128, 768], "float32"], ["TENSOR", [3072, 768], "float32"], null, "float32"], {}], "config": {"index": 5971965, "code_hash": null, "entity": [["tile_x", "sp", [-1, 4, 2, 2]], ["tile_y", "sp", [-1, 1, 2, 6]], ["tile_k", "sp", [-1, 1, 4]]]}, "result": [[0.0029861862075471696], 0, 1.3038578033447266, 1655825762.1534753], "version": 0.2, "tvm_version": "0.8.0"}
{"input": ["cuda -keys=cuda,gpu -max_num_threads=1024 -thread_warp_size=32", "dense_large_batch.gpu", [["TENSOR", [128, 768], "float32"], ["TENSOR", [3072, 768], "float32"], null, "float32"], {}], "config": {"index": 4743765, "code_hash": null, "entity": [["tile_x", "sp", [-1, 4, 2, 2]], ["tile_y", "sp", [-1, 1, 2, 8]], ["tile_k", "sp", [-1, 1, 3]]]}, "result": [[0.002790343122807017], 0, 1.4300434589385986, 1655825763.182217], "version": 0.2, "tvm_version": "0.8.0"}
{"input": ["cuda -keys=cuda,gpu -max_num_threads=1024 -thread_warp_size=32", "dense_large_batch.gpu", [["TENSOR", [128, 768], "float32"], ["TENSOR", [3072, 768], "float32"], null, "float32"], {}], "config": {"index": 4736411, "code_hash": null, "entity": [["tile_x", "sp", [-1, 8, 2, 1]], ["tile_y", "sp", [-1, 1, 2, 6]], ["tile_k", "sp", [-1, 1, 3]]]}, "result": [[0.0034927393777777777], 0, 1.3187282085418701, 1655825764.2236028], "version": 0.2, "tvm_version": "0.8.0"}
{"input": ["cuda -keys=cuda,gpu -max_num_threads=1024 -thread_warp_size=32", "dense_large_batch.gpu", [["TENSOR", [128, 768], "float32"], ["TENSOR", [3072, 768], "float32"], null, "float32"], {}], "config": {"index": 5979311, "code_hash": null, "entity": [["tile_x", "sp", [-1, 2, 2, 4]], ["tile_y", "sp", [-1, 1, 2, 8]], ["tile_k", "sp", [-1, 1, 4]]]}, "result": [[0.0029416314074074074], 0, 1.378298282623291, 1655825765.2823212], "version": 0.2, "tvm_version": "0.8.0"}
{"input": ["cuda -keys=cuda,gpu -max_num_threads=1024 -thread_warp_size=32", "dense_large_batch.gpu", [["TENSOR", [128, 768], "float32"], ["TENSOR", [3072, 768], "float32"], null, "float32"], {}], "config": {"index": 5971964, "code_hash": null, "entity": [["tile_x", "sp", [-1, 2, 2, 2]], ["tile_y", "sp", [-1, 1, 2, 6]], ["tile_k", "sp", [-1, 1, 4]]]}, "result": [[0.0036950665116279066], 0, 1.3201642036437988, 1655825766.3097825], "version": 0.2, "tvm_version": "0.8.0"}
{"input": ["cuda -keys=cuda,gpu -max_num_threads=1024 -thread_warp_size=32", "dense_large_batch.gpu", [["TENSOR", [128, 768], "float32"], ["TENSOR", [3072, 768], "float32"], null, "float32"], {}], "config": {"index": 5956690, "code_hash": null, "entity": [["tile_x", "sp", [-1, 4, 2, 1]], ["tile_y", "sp", [-1, 1, 2, 4]], ["tile_k", "sp", [-1, 1, 4]]]}, "result": [[0.004399274611111111], 0, 1.397562026977539, 1655825767.3647456], "version": 0.2, "tvm_version": "0.8.0"}
{"input": ["cuda -keys=cuda,gpu -max_num_threads=1024 -thread_warp_size=32", "dense_large_batch.gpu", [["TENSOR", [128, 768], "float32"], ["TENSOR", [3072, 768], "float32"], null, "float32"], {}], "config": {"index": 5979249, "code_hash": null, "entity": [["tile_x", "sp", [-1, 2, 2, 1]], ["tile_y", "sp", [-1, 1, 2, 8]], ["tile_k", "sp", [-1, 1, 4]]]}, "result": [[0.0067751816874999995], 0, 1.5181841850280762, 1655825768.628771], "version": 0.2, "tvm_version": "0.8.0"}
{"input": ["cuda -keys=cuda,gpu -max_num_threads=1024 -thread_warp_size=32", "dense_large_batch.gpu", [["TENSOR", [128, 768], "float32"], ["TENSOR", [3072, 768], "float32"], null, "float32"], {}], "config": {"index": 5948084, "code_hash": null, "entity": [["tile_x", "sp", [-1, 2, 2, 2]], ["tile_y", "sp", [-1, 2, 2, 3]], ["tile_k", "sp", [-1, 1, 4]]]}, "result": [[0.003699140651162791], 0, 1.3480114936828613, 1655825769.6511583], "version": 0.2, "tvm_version": "0.8.0"}
{"input": ["cuda -keys=cuda,gpu -max_num_threads=1024 -thread_warp_size=32", "dense_large_batch.gpu", [["TENSOR", [128, 768], "float32"], ["TENSOR", [3072, 768], "float32"], null, "float32"], {}], "config": {"index": 4736471, "code_hash": null, "entity": [["tile_x", "sp", [-1, 2, 2, 4]], ["tile_y", "sp", [-1, 1, 2, 6]], ["tile_k", "sp", [-1, 1, 3]]]}, "result": [[0.0031955199599999996], 0, 1.5330476760864258, 1655825770.6784272], "version": 0.2, "tvm_version": "0.8.0"}
{"input": ["cuda -keys=cuda,gpu -max_num_threads=1024 -thread_warp_size=32", "dense_large_batch.gpu", [["TENSOR", [128, 768], "float32"], ["TENSOR", [3072, 768], "float32"], null, "float32"], {}], "config": {"index": 7893850, "code_hash": null, "entity": [["tile_x", "sp", [-1, 4, 2, 1]], ["tile_y", "sp", [-1, 1, 2, 6]], ["tile_k", "sp", [-1, 1, 6]]]}, "result": [[0.002967585722222222], 0, 1.261582374572754, 1655825771.696956], "version": 0.2, "tvm_version": "0.8.0"}
{"input": ["cuda -keys=cuda,gpu -max_num_threads=1024 -thread_warp_size=32", "dense_large_batch.gpu", [["TENSOR", [128, 768], "float32"], ["TENSOR", [3072, 768], "float32"], null, "float32"], {}], "config": {"index": 5979310, "code_hash": null, "entity": [["tile_x", "sp", [-1, 1, 2, 4]], ["tile_y", "sp", [-1, 1, 2, 8]], ["tile_k", "sp", [-1, 1, 4]]]}, "result": [[0.00401463117948718], 0, 1.30631685256958, 1655825772.7486992], "version": 0.2, "tvm_version": "0.8.0"}
{"input": ["cuda -keys=cuda,gpu -max_num_threads=1024 -thread_warp_size=32", "dense_large_batch.gpu", [["TENSOR", [128, 768], "float32"], ["TENSOR", [3072, 768], "float32"], null, "float32"], {}], "config": {"index": 4743790, "code_hash": null, "entity": [["tile_x", "sp", [-1, 1, 2, 4]], ["tile_y", "sp", [-1, 1, 2, 8]], ["tile_k", "sp", [-1, 1, 3]]]}, "result": [[0.003974932205128205], 0, 1.333958625793457, 1655825773.7928028], "version": 0.2, "tvm_version": "0.8.0"}
{"input": ["cuda -keys=cuda,gpu -max_num_threads=1024 -thread_warp_size=32", "dense_large_batch.gpu", [["TENSOR", [128, 768], "float32"], ["TENSOR", [3072, 768], "float32"], null, "float32"], {}], "config": {"index": 7851250, "code_hash": null, "entity": [["tile_x", "sp", [-1, 4, 2, 1]], ["tile_y", "sp", [-1, 2, 2, 2]], ["tile_k", "sp", [-1, 1, 6]]]}, "result": [[0.003378013638297872], 0, 1.2862739562988281, 1655825774.8093739], "version": 0.2, "tvm_version": "0.8.0"}
{"input": ["cuda -keys=cuda,gpu -max_num_threads=1024 -thread_warp_size=32", "dense_large_batch.gpu", [["TENSOR", [128, 768], "float32"], ["TENSOR", [3072, 768], "float32"], null, "float32"], {}], "config": {"index": 5979285, "code_hash": null, "entity": [["tile_x", "sp", [-1, 4, 2, 2]], ["tile_y", "sp", [-1, 1, 2, 8]], ["tile_k", "sp", [-1, 1, 4]]]}, "result": [[0.002960867759259259], 0, 1.4376857280731201, 1655825775.8479488], "version": 0.2, "tvm_version": "0.8.0"}
{"input": ["cuda -keys=cuda,gpu -max_num_threads=1024 -thread_warp_size=32", "dense_large_batch.gpu", [["TENSOR", [128, 768], "float32"], ["TENSOR", [3072, 768], "float32"], null, "float32"], {}], "config": {"index": 4736490, "code_hash": null, "entity": [["tile_x", "sp", [-1, 1, 2, 8]], ["tile_y", "sp", [-1, 1, 2, 6]], ["tile_k", "sp", [-1, 1, 3]]]}, "result": [[0.00318574838], 0, 1.319218397140503, 1655825776.866527], "version": 0.2, "tvm_version": "0.8.0"}
{"input": ["cuda -keys=cuda,gpu -max_num_threads=1024 -thread_warp_size=32", "dense_large_batch.gpu", [["TENSOR", [128, 768], "float32"], ["TENSOR", [3072, 768], "float32"], null, "float32"], {}], "config": {"index": 7893849, "code_hash": null, "entity": [["tile_x", "sp", [-1, 2, 2, 1]], ["tile_y", "sp", [-1, 1, 2, 6]], ["tile_k", "sp", [-1, 1, 6]]]}, "result": [[0.004663801088235294], 0, 1.2885334491729736, 1655825777.92188], "version": 0.2, "tvm_version": "0.8.0"}
{"input": ["cuda -keys=cuda,gpu -max_num_threads=1024 -thread_warp_size=32", "dense_large_batch.gpu", [["TENSOR", [128, 768], "float32"], ["TENSOR", [3072, 768], "float32"], null, "float32"], {}], "config": {"index": 7851284, "code_hash": null, "entity": [["tile_x", "sp", [-1, 2, 2, 2]], ["tile_y", "sp", [-1, 2, 2, 2]], ["tile_k", "sp", [-1, 1, 6]]]}, "result": [[0.00322949842], 0, 1.342642068862915, 1655825778.9842644], "version": 0.2, "tvm_version": "0.8.0"}
{"input": ["cuda -keys=cuda,gpu -max_num_threads=1024 -thread_warp_size=32", "dense_large_batch.gpu", [["TENSOR", [128, 768], "float32"], ["TENSOR", [3072, 768], "float32"], null, "float32"], {}], "config": {"index": 4712445, "code_hash": null, "entity": [["tile_x", "sp", [-1, 4, 2, 2]], ["tile_y", "sp", [-1, 1, 2, 3]], ["tile_k", "sp", [-1, 1, 3]]]}, "result": [[0.00520937978125], 0, 1.331535816192627, 1655825780.0645077], "version": 0.2, "tvm_version": "0.8.0"}
{"input": ["cuda -keys=cuda,gpu -max_num_threads=1024 -thread_warp_size=32", "dense_large_batch.gpu", [["TENSOR", [128, 768], "float32"], ["TENSOR", [3072, 768], "float32"], null, "float32"], {}], "config": {"index": 5956751, "code_hash": null, "entity": [["tile_x", "sp", [-1, 2, 2, 4]], ["tile_y", "sp", [-1, 1, 2, 4]], ["tile_k", "sp", [-1, 1, 4]]]}, "result": [[0.003943954275], 0, 1.3476624488830566, 1655825781.0940733], "version": 0.2, "tvm_version": "0.8.0"}
{"input": ["cuda -keys=cuda,gpu -max_num_threads=1024 -thread_warp_size=32", "dense_large_batch.gpu", [["TENSOR", [128, 768], "float32"], ["TENSOR", [3072, 768], "float32"], null, "float32"], {}], "config": {"index": 5956725, "code_hash": null, "entity": [["tile_x", "sp", [-1, 4, 2, 2]], ["tile_y", "sp", [-1, 1, 2, 4]], ["tile_k", "sp", [-1, 1, 4]]]}, "result": [[0.003935362125], 0, 1.3477365970611572, 1655825782.144375], "version": 0.2, "tvm_version": "0.8.0"}
{"input": ["cuda -keys=cuda,gpu -max_num_threads=1024 -thread_warp_size=32", "dense_large_batch.gpu", [["TENSOR", [128, 768], "float32"], ["TENSOR", [3072, 768], "float32"], null, "float32"], {}], "config": {"index": 4721325, "code_hash": null, "entity": [["tile_x", "sp", [-1, 4, 2, 2]], ["tile_y", "sp", [-1, 2, 2, 4]], ["tile_k", "sp", [-1, 1, 3]]]}, "result": [[0.0028190740175438596], 0, 1.419525384902954, 1655825783.1930263], "version": 0.2, "tvm_version": "0.8.0"}
{"input": ["cuda -keys=cuda,gpu -max_num_threads=1024 -thread_warp_size=32", "dense_large_batch.gpu", [["TENSOR", [128, 768], "float32"], ["TENSOR", [3072, 768], "float32"], null, "float32"], {}], "config": {"index": 5956871, "code_hash": null, "entity": [["tile_x", "sp", [-1, 2, 2, 4]], ["tile_y", "sp", [-1, 2, 2, 4]], ["tile_k", "sp", [-1, 1, 4]]]}, "result": [[0.0029135545636363633], 0, 1.5607872009277344, 1655825784.2389982], "version": 0.2, "tvm_version": "0.8.0"}
{"input": ["cuda -keys=cuda,gpu -max_num_threads=1024 -thread_warp_size=32", "dense_large_batch.gpu", [["TENSOR", [128, 768], "float32"], ["TENSOR", [3072, 768], "float32"], null, "float32"], {}], "config": {"index": 7901170, "code_hash": null, "entity": [["tile_x", "sp", [-1, 4, 2, 1]], ["tile_y", "sp", [-1, 1, 2, 8]], ["tile_k", "sp", [-1, 1, 6]]]}, "result": [[0.0025272018], 0, 1.2798771858215332, 1655825785.2665958], "version": 0.2, "tvm_version": "0.8.0"}
{"input": ["cuda -keys=cuda,gpu -max_num_threads=1024 -thread_warp_size=32", "dense_large_batch.gpu", [["TENSOR", [128, 768], "float32"], ["TENSOR", [3072, 768], "float32"], null, "float32"], {}], "config": {"index": 5956724, "code_hash": null, "entity": [["tile_x", "sp", [-1, 2, 2, 2]], ["tile_y", "sp", [-1, 1, 2, 4]], ["tile_k", "sp", [-1, 1, 4]]]}, "result": [[0.004422089971428571], 0, 1.2900404930114746, 1655825786.289013], "version": 0.2, "tvm_version": "0.8.0"}
{"input": ["cuda -keys=cuda,gpu -max_num_threads=1024 -thread_warp_size=32", "dense_large_batch.gpu", [["TENSOR", [128, 768], "float32"], ["TENSOR", [3072, 768], "float32"], null, "float32"], {}], "config": {"index": 7869969, "code_hash": null, "entity": [["tile_x", "sp", [-1, 2, 2, 1]], ["tile_y", "sp", [-1, 2, 2, 3]], ["tile_k", "sp", [-1, 1, 6]]]}, "result": [[0.0050034382812500005], 0, 1.3179230690002441, 1655825787.3415878], "version": 0.2, "tvm_version": "0.8.0"}
{"input": ["cuda -keys=cuda,gpu -max_num_threads=1024 -thread_warp_size=32", "dense_large_batch.gpu", [["TENSOR", [128, 768], "float32"], ["TENSOR", [3072, 768], "float32"], null, "float32"], {}], "config": {"index": 4743764, "code_hash": null, "entity": [["tile_x", "sp", [-1, 2, 2, 2]], ["tile_y", "sp", [-1, 1, 2, 8]], ["tile_k", "sp", [-1, 1, 3]]]}, "result": [[0.004073453236842105], 0, 1.3090903759002686, 1655825788.3779595], "version": 0.2, "tvm_version": "0.8.0"}
{"input": ["cuda -keys=cuda,gpu -max_num_threads=1024 -thread_warp_size=32", "dense_large_batch.gpu", [["TENSOR", [128, 768], "float32"], ["TENSOR", [3072, 768], "float32"], null, "float32"], {}], "config": {"index": 4755850, "code_hash": null, "entity": [["tile_x", "sp", [-1, 4, 2, 1]], ["tile_y", "sp", [-1, 1, 2, 12]], ["tile_k", "sp", [-1, 1, 3]]]}, "result": [[0.0036875492790697673], 0, 1.4944543838500977, 1655825789.5562027], "version": 0.2, "tvm_version": "0.8.0"}
{"input": ["cuda -keys=cuda,gpu -max_num_threads=1024 -thread_warp_size=32", "dense_large_batch.gpu", [["TENSOR", [128, 768], "float32"], ["TENSOR", [3072, 768], "float32"], null, "float32"], {}], "config": {"index": 4743810, "code_hash": null, "entity": [["tile_x", "sp", [-1, 1, 2, 8]], ["tile_y", "sp", [-1, 1, 2, 8]], ["tile_k", "sp", [-1, 1, 3]]]}, "result": [[0.002766360372881356], 0, 1.371509075164795, 1655825790.594475], "version": 0.2, "tvm_version": "0.8.0"}
{"input": ["cuda -keys=cuda,gpu -max_num_threads=1024 -thread_warp_size=32", "dense_large_batch.gpu", [["TENSOR", [128, 768], "float32"], ["TENSOR", [3072, 768], "float32"], null, "float32"], {}], "config": {"index": 7869970, "code_hash": null, "entity": [["tile_x", "sp", [-1, 4, 2, 1]], ["tile_y", "sp", [-1, 2, 2, 3]], ["tile_k", "sp", [-1, 1, 6]]]}, "result": [[0.0031456391764705877], 0, 1.4525423049926758, 1655825803.5455713], "version": 0.2, "tvm_version": "0.8.0"}
{"input": ["cuda -keys=cuda,gpu -max_num_threads=1024 -thread_warp_size=32", "dense_large_batch.gpu", [["TENSOR", [128, 768], "float32"], ["TENSOR", [3072, 768], "float32"], null, "float32"], {}], "config": {"index": 4721231, "code_hash": null, "entity": [["tile_x", "sp", [-1, 2, 2, 4]], ["tile_y", "sp", [-1, 1, 2, 4]], ["tile_k", "sp", [-1, 1, 3]]]}, "result": [[0.003966799769230769], 0, 1.272580862045288, 1655825804.587108], "version": 0.2, "tvm_version": "0.8.0"}
{"input": ["cuda -keys=cuda,gpu -max_num_threads=1024 -thread_warp_size=32", "dense_large_batch.gpu", [["TENSOR", [128, 768], "float32"], ["TENSOR", [3072, 768], "float32"], null, "float32"], {}], "config": {"index": 7851249, "code_hash": null, "entity": [["tile_x", "sp", [-1, 2, 2, 1]], ["tile_y", "sp", [-1, 2, 2, 2]], ["tile_k", "sp", [-1, 1, 6]]]}, "result": [[0.00497537496875], 0, 1.3121943473815918, 1655825805.630155], "version": 0.2, "tvm_version": "0.8.0"}
{"input": ["cuda -keys=cuda,gpu -max_num_threads=1024 -thread_warp_size=32", "dense_large_batch.gpu", [["TENSOR", [128, 768], "float32"], ["TENSOR", [3072, 768], "float32"], null, "float32"], {}], "config": {"index": 4721351, "code_hash": null, "entity": [["tile_x", "sp", [-1, 2, 2, 4]], ["tile_y", "sp", [-1, 2, 2, 4]], ["tile_k", "sp", [-1, 1, 3]]]}, "result": [[0.0027384712203389833], 0, 1.2952463626861572, 1655825806.7530987], "version": 0.2, "tvm_version": "0.8.0"}
{"input": ["cuda -keys=cuda,gpu -max_num_threads=1024 -thread_warp_size=32", "dense_large_batch.gpu", [["TENSOR", [128, 768], "float32"], ["TENSOR", [3072, 768], "float32"], null, "float32"], {}], "config": {"index": 5991370, "code_hash": null, "entity": [["tile_x", "sp", [-1, 4, 2, 1]], ["tile_y", "sp", [-1, 1, 2, 12]], ["tile_k", "sp", [-1, 1, 4]]]}, "result": [[0.003042560150943396], 0, 1.297694206237793, 1655825807.8040154], "version": 0.2, "tvm_version": "0.8.0"}
{"input": ["cuda -keys=cuda,gpu -max_num_threads=1024 -thread_warp_size=32", "dense_large_batch.gpu", [["TENSOR", [128, 768], "float32"], ["TENSOR", [3072, 768], "float32"], null, "float32"], {}], "config": {"index": 5947931, "code_hash": null, "entity": [["tile_x", "sp", [-1, 8, 2, 1]], ["tile_y", "sp", [-1, 1, 2, 3]], ["tile_k", "sp", [-1, 1, 4]]]}, "result": [[0.00477638546875], 0, 1.2706446647644043, 1655825808.8601582], "version": 0.2, "tvm_version": "0.8.0"}
{"input": ["cuda -keys=cuda,gpu -max_num_threads=1024 -thread_warp_size=32", "dense_large_batch.gpu", [["TENSOR", [128, 768], "float32"], ["TENSOR", [3072, 768], "float32"], null, "float32"], {}], "config": {"index": 5956750, "code_hash": null, "entity": [["tile_x", "sp", [-1, 1, 2, 4]], ["tile_y", "sp", [-1, 1, 2, 4]], ["tile_k", "sp", [-1, 1, 4]]]}, "result": [[0.004439528055555556], 0, 1.3194239139556885, 1655825809.9003508], "version": 0.2, "tvm_version": "0.8.0"}
{"input": ["cuda -keys=cuda,gpu -max_num_threads=1024 -thread_warp_size=32", "dense_large_batch.gpu", [["TENSOR", [128, 768], "float32"], ["TENSOR", [3072, 768], "float32"], null, "float32"], {}], "config": {"index": 4736470, "code_hash": null, "entity": [["tile_x", "sp", [-1, 1, 2, 4]], ["tile_y", "sp", [-1, 1, 2, 6]], ["tile_k", "sp", [-1, 1, 3]]]}, "result": [[0.00453238194117647], 0, 1.2536437511444092, 1655825810.9273791], "version": 0.2, "tvm_version": "0.8.0"}
{"input": ["cuda -keys=cuda,gpu -max_num_threads=1024 -thread_warp_size=32", "dense_large_batch.gpu", [["TENSOR", [128, 768], "float32"], ["TENSOR", [3072, 768], "float32"], null, "float32"], {}], "config": {"index": 8949369, "code_hash": null, "entity": [["tile_x", "sp", [-1, 2, 2, 1]], ["tile_y", "sp", [-1, 1, 2, 2]], ["tile_k", "sp", [-1, 1, 8]]]}, "result": [[0.0049564908437500005], 0, 1.223907232284546, 1655825811.9650912], "version": 0.2, "tvm_version": "0.8.0"}
{"input": ["cuda -keys=cuda,gpu -max_num_threads=1024 -thread_warp_size=32", "dense_large_batch.gpu", [["TENSOR", [128, 768], "float32"], ["TENSOR", [3072, 768], "float32"], null, "float32"], {}], "config": {"index": 5929365, "code_hash": null, "entity": [["tile_x", "sp", [-1, 4, 2, 2]], ["tile_y", "sp", [-1, 2, 2, 2]], ["tile_k", "sp", [-1, 1, 4]]]}, "result": [[0.0039692403], 0, 1.278975248336792, 1655825813.0064943], "version": 0.2, "tvm_version": "0.8.0"}
{"input": ["cuda -keys=cuda,gpu -max_num_threads=1024 -thread_warp_size=32", "dense_large_batch.gpu", [["TENSOR", [128, 768], "float32"], ["TENSOR", [3072, 768], "float32"], null, "float32"], {}], "config": {"index": 5948050, "code_hash": null, "entity": [["tile_x", "sp", [-1, 4, 2, 1]], ["tile_y", "sp", [-1, 2, 2, 3]], ["tile_k", "sp", [-1, 1, 4]]]}, "result": [[0.003732751674418604], 0, 1.2830426692962646, 1655825814.0510705], "version": 0.2, "tvm_version": "0.8.0"}
{"input": ["cuda -keys=cuda,gpu -max_num_threads=1024 -thread_warp_size=32", "dense_large_batch.gpu", [["TENSOR", [128, 768], "float32"], ["TENSOR", [3072, 768], "float32"], null, "float32"], {}], "config": {"index": 5947965, "code_hash": null, "entity": [["tile_x", "sp", [-1, 4, 2, 2]], ["tile_y", "sp", [-1, 1, 2, 3]], ["tile_k", "sp", [-1, 1, 4]]]}, "result": [[0.00482169871875], 0, 1.285085678100586, 1655825815.1055224], "version": 0.2, "tvm_version": "0.8.0"}
{"input": ["cuda -keys=cuda,gpu -max_num_threads=1024 -thread_warp_size=32", "dense_large_batch.gpu", [["TENSOR", [128, 768], "float32"], ["TENSOR", [3072, 768], "float32"], null, "float32"], {}], "config": {"index": 5956845, "code_hash": null, "entity": [["tile_x", "sp", [-1, 4, 2, 2]], ["tile_y", "sp", [-1, 2, 2, 4]], ["tile_k", "sp", [-1, 1, 4]]]}, "result": [[0.0029157968363636368], 0, 1.342630386352539, 1655825816.1560469], "version": 0.2, "tvm_version": "0.8.0"}
{"input": ["cuda -keys=cuda,gpu -max_num_threads=1024 -thread_warp_size=32", "dense_large_batch.gpu", [["TENSOR", [128, 768], "float32"], ["TENSOR", [3072, 768], "float32"], null, "float32"], {}], "config": {"index": 2547311, "code_hash": null, "entity": [["tile_x", "sp", [-1, 2, 2, 4]], ["tile_y", "sp", [-1, 1, 2, 8]], ["tile_k", "sp", [-1, 1, 2]]]}, "result": [[0.0035791664186046513], 0, 1.339674711227417, 1655825817.1977785], "version": 0.2, "tvm_version": "0.8.0"}
{"input": ["cuda -keys=cuda,gpu -max_num_threads=1024 -thread_warp_size=32", "dense_large_batch.gpu", [["TENSOR", [128, 768], "float32"], ["TENSOR", [3072, 768], "float32"], null, "float32"], {}], "config": {"index": 4736444, "code_hash": null, "entity": [["tile_x", "sp", [-1, 2, 2, 2]], ["tile_y", "sp", [-1, 1, 2, 6]], ["tile_k", "sp", [-1, 1, 3]]]}, "result": [[0.004648678588235294], 0, 1.3538496494293213, 1655825818.2485068], "version": 0.2, "tvm_version": "0.8.0"}
{"input": ["cuda -keys=cuda,gpu -max_num_threads=1024 -thread_warp_size=32", "dense_large_batch.gpu", [["TENSOR", [128, 768], "float32"], ["TENSOR", [3072, 768], "float32"], null, "float32"], {}], "config": {"index": 8949490, "code_hash": null, "entity": [["tile_x", "sp", [-1, 4, 2, 1]], ["tile_y", "sp", [-1, 2, 2, 2]], ["tile_k", "sp", [-1, 1, 8]]]}, "result": [[0.0030467026792452834], 0, 1.2935380935668945, 1655825819.2643325], "version": 0.2, "tvm_version": "0.8.0"}
{"input": ["cuda -keys=cuda,gpu -max_num_threads=1024 -thread_warp_size=32", "dense_large_batch.gpu", [["TENSOR", [128, 768], "float32"], ["TENSOR", [3072, 768], "float32"], null, "float32"], {}], "config": {"index": 5956689, "code_hash": null, "entity": [["tile_x", "sp", [-1, 2, 2, 1]], ["tile_y", "sp", [-1, 1, 2, 4]], ["tile_k", "sp", [-1, 1, 4]]]}, "result": [[0.00656826996875], 0, 1.4731009006500244, 1655825820.5176272], "version": 0.2, "tvm_version": "0.8.0"}
{"input": ["cuda -keys=cuda,gpu -max_num_threads=1024 -thread_warp_size=32", "dense_large_batch.gpu", [["TENSOR", [128, 768], "float32"], ["TENSOR", [3072, 768], "float32"], null, "float32"], {}], "config": {"index": 5956810, "code_hash": null, "entity": [["tile_x", "sp", [-1, 4, 2, 1]], ["tile_y", "sp", [-1, 2, 2, 4]], ["tile_k", "sp", [-1, 1, 4]]]}, "result": [[0.003942782274999999], 0, 1.3287644386291504, 1655825821.5455341], "version": 0.2, "tvm_version": "0.8.0"}
{"input": ["cuda -keys=cuda,gpu -max_num_threads=1024 -thread_warp_size=32", "dense_large_batch.gpu", [["TENSOR", [128, 768], "float32"], ["TENSOR", [3072, 768], "float32"], null, "float32"], {}], "config": {"index": 7893851, "code_hash": null, "entity": [["tile_x", "sp", [-1, 8, 2, 1]], ["tile_y", "sp", [-1, 1, 2, 6]], ["tile_k", "sp", [-1, 1, 6]]]}, "result": [[0.002132805602564102], 0, 1.3855583667755127, 1655825822.6047134], "version": 0.2, "tvm_version": "0.8.0"}
{"input": ["cuda -keys=cuda,gpu -max_num_threads=1024 -thread_warp_size=32", "dense_large_batch.gpu", [["TENSOR", [128, 768], "float32"], ["TENSOR", [3072, 768], "float32"], null, "float32"], {}], "config": {"index": 8968089, "code_hash": null, "entity": [["tile_x", "sp", [-1, 2, 2, 1]], ["tile_y", "sp", [-1, 1, 2, 3]], ["tile_k", "sp", [-1, 1, 8]]]}, "result": [[0.0036461619772727273], 0, 1.2424116134643555, 1655825823.638892], "version": 0.2, "tvm_version": "0.8.0"}
{"input": ["cuda -keys=cuda,gpu -max_num_threads=1024 -thread_warp_size=32", "dense_large_batch.gpu", [["TENSOR", [128, 768], "float32"], ["TENSOR", [3072, 768], "float32"], null, "float32"], {}], "config": {"index": 4712564, "code_hash": null, "entity": [["tile_x", "sp", [-1, 2, 2, 2]], ["tile_y", "sp", [-1, 2, 2, 3]], ["tile_k", "sp", [-1, 1, 3]]]}, "result": [[0.00498880375], 0, 1.2906227111816406, 1655825824.7094665], "version": 0.2, "tvm_version": "0.8.0"}
{"input": ["cuda -keys=cuda,gpu -max_num_threads=1024 -thread_warp_size=32", "dense_large_batch.gpu", [["TENSOR", [128, 768], "float32"], ["TENSOR", [3072, 768], "float32"], null, "float32"], {}], "config": {"index": 7278730, "code_hash": null, "entity": [["tile_x", "sp", [-1, 4, 2, 1]], ["tile_y", "sp", [-1, 3, 2, 1]], ["tile_k", "sp", [-1, 48, 4]]]}, "result": [[0.0037377109024390245], 0, 6.733144998550415, 1655825826.5622427], "version": 0.2, "tvm_version": "0.8.0"}
{"input": ["cuda -keys=cuda,gpu -max_num_threads=1024 -thread_warp_size=32", "dense_large_batch.gpu", [["TENSOR", [128, 768], "float32"], ["TENSOR", [3072, 768], "float32"], null, "float32"], {}], "config": {"index": 7901252, "code_hash": null, "entity": [["tile_x", "sp", [-1, 4, 2, 8]], ["tile_y", "sp", [-1, 1, 2, 8]], ["tile_k", "sp", [-1, 1, 6]]]}, "result": [[0.023908552800000003], 0, 3.0427329540252686, 1655825869.681218], "version": 0.2, "tvm_version": "0.8.0"}
{"input": ["cuda -keys=cuda,gpu -max_num_threads=1024 -thread_warp_size=32", "dense_large_batch.gpu", [["TENSOR", [128, 768], "float32"], ["TENSOR", [3072, 768], "float32"], null, "float32"], {}], "config": {"index": 7901266, "code_hash": null, "entity": [["tile_x", "sp", [-1, 4, 2, 16]], ["tile_y", "sp", [-1, 1, 2, 8]], ["tile_k", "sp", [-1, 1, 6]]]}, "result": [[0.05735646725], 0, 4.906194448471069, 1655825873.7731562], "version": 0.2, "tvm_version": "0.8.0"}
{"input": ["cuda -keys=cuda,gpu -max_num_threads=1024 -thread_warp_size=32", "dense_large_batch.gpu", [["TENSOR", [128, 768], "float32"], ["TENSOR", [3072, 768], "float32"], null, "float32"], {}], "config": {"index": 4743813, "code_hash": null, "entity": [["tile_x", "sp", [-1, 8, 2, 8]], ["tile_y", "sp", [-1, 1, 2, 8]], ["tile_k", "sp", [-1, 1, 3]]]}, "result": [[0.05878217685], 0, 5.302829265594482, 1655825886.4784636], "version": 0.2, "tvm_version": "0.8.0"}
{"input": ["cuda -keys=cuda,gpu -max_num_threads=1024 -thread_warp_size=32", "dense_large_batch.gpu", [["TENSOR", [128, 768], "float32"], ["TENSOR", [3072, 768], "float32"], null, "float32"], {}], "config": {"index": 8999492, "code_hash": null, "entity": [["tile_x", "sp", [-1, 4, 2, 8]], ["tile_y", "sp", [-1, 1, 2, 8]], ["tile_k", "sp", [-1, 1, 8]]]}, "result": [[0.01615749315], 0, 2.8089239597320557, 1655825888.176317], "version": 0.2, "tvm_version": "0.8.0"}
{"input": ["cuda -keys=cuda,gpu -max_num_threads=1024 -thread_warp_size=32", "dense_large_batch.gpu", [["TENSOR", [128, 768], "float32"], ["TENSOR", [3072, 768], "float32"], null, "float32"], {}], "config": {"index": 7919372, "code_hash": null, "entity": [["tile_x", "sp", [-1, 4, 2, 8]], ["tile_y", "sp", [-1, 1, 2, 16]], ["tile_k", "sp", [-1, 1, 6]]]}, "result": [[0.0600141712], 0, 5.254175186157227, 1655825892.3909445], "version": 0.2, "tvm_version": "0.8.0"}
{"input": ["cuda -keys=cuda,gpu -max_num_threads=1024 -thread_warp_size=32", "dense_large_batch.gpu", [["TENSOR", [128, 768], "float32"], ["TENSOR", [3072, 768], "float32"], null, "float32"], {}], "config": {"index": 7919373, "code_hash": null, "entity": [["tile_x", "sp", [-1, 8, 2, 8]], ["tile_y", "sp", [-1, 1, 2, 16]], ["tile_k", "sp", [-1, 1, 6]]]}, "result": [[0.055153815550000006], 0, 4.739113807678223, 1655825896.3119226], "version": 0.2, "tvm_version": "0.8.0"}
{"input": ["cuda -keys=cuda,gpu -max_num_threads=1024 -thread_warp_size=32", "dense_large_batch.gpu", [["TENSOR", [128, 768], "float32"], ["TENSOR", [3072, 768], "float32"], null, "float32"], {}], "config": {"index": 5979451, "code_hash": null, "entity": [["tile_x", "sp", [-1, 2, 2, 8]], ["tile_y", "sp", [-1, 2, 2, 8]], ["tile_k", "sp", [-1, 1, 4]]]}, "result": [[0.0083415568], 0, 1.9807250499725342, 1655825897.658431], "version": 0.2, "tvm_version": "0.8.0"}
{"input": ["cuda -keys=cuda,gpu -max_num_threads=1024 -thread_warp_size=32", "dense_large_batch.gpu", [["TENSOR", [128, 768], "float32"], ["TENSOR", [3072, 768], "float32"], null, "float32"], {}], "config": {"index": 7919386, "code_hash": null, "entity": [["tile_x", "sp", [-1, 4, 2, 16]], ["tile_y", "sp", [-1, 1, 2, 16]], ["tile_k", "sp", [-1, 1, 6]]]}, "result": [[0.05618384049999999], 0, 4.463196277618408, 1655825905.888166], "version": 0.2, "tvm_version": "0.8.0"}
{"input": ["cuda -keys=cuda,gpu -max_num_threads=1024 -thread_warp_size=32", "dense_large_batch.gpu", [["TENSOR", [128, 768], "float32"], ["TENSOR", [3072, 768], "float32"], null, "float32"], {}], "config": {"index": 8999506, "code_hash": null, "entity": [["tile_x", "sp", [-1, 4, 2, 16]], ["tile_y", "sp", [-1, 1, 2, 8]], ["tile_k", "sp", [-1, 1, 8]]]}, "result": [[0.0584098601], 0, 5.1949663162231445, 1655825910.047078], "version": 0.2, "tvm_version": "0.8.0"}
{"input": ["cuda -keys=cuda,gpu -max_num_threads=1024 -thread_warp_size=32", "dense_large_batch.gpu", [["TENSOR", [128, 768], "float32"], ["TENSOR", [3072, 768], "float32"], null, "float32"], {}], "config": {"index": 10646852, "code_hash": null, "entity": [["tile_x", "sp", [-1, 4, 2, 8]], ["tile_y", "sp", [-1, 1, 2, 8]], ["tile_k", "sp", [-1, 1, 12]]]}, "result": [[0.02222455585], 0, 2.6769070625305176, 1655825912.095134], "version": 0.2, "tvm_version": "0.8.0"}
{"input": ["cuda -keys=cuda,gpu -max_num_threads=1024 -thread_warp_size=32", "dense_large_batch.gpu", [["TENSOR", [128, 768], "float32"], ["TENSOR", [3072, 768], "float32"], null, "float32"], {}], "config": {"index": 5979465, "code_hash": null, "entity": [["tile_x", "sp", [-1, 2, 2, 16]], ["tile_y", "sp", [-1, 2, 2, 8]], ["tile_k", "sp", [-1, 1, 4]]]}, "result": [[0.05351191485000001], 0, 4.609102725982666, 1655825920.2617319], "version": 0.2, "tvm_version": "0.8.0"}
{"input": ["cuda -keys=cuda,gpu -max_num_threads=1024 -thread_warp_size=32", "dense_small_batch.gpu", [["TENSOR", [128, 768], "float32"], ["TENSOR", [3072, 768], "float32"], null, "float32"], {}], "config": {"index": 6, "code_hash": null, "entity": [["tile_k", "sp", [-1, 12]]]}, "result": [[0.0048272331875], 0, 1.2824957370758057, 1655831431.109951], "version": 0.2, "tvm_version": "0.8.0"}
{"input": ["cuda -keys=cuda,gpu -max_num_threads=1024 -thread_warp_size=32", "dense_small_batch.gpu", [["TENSOR", [128, 768], "float32"], ["TENSOR", [3072, 768], "float32"], null, "float32"], {}], "config": {"index": 14, "code_hash": null, "entity": [["tile_k", "sp", [-1, 192]]]}, "result": [[0.004211692916666667], 0, 1.2066881656646729, 1655831432.093796], "version": 0.2, "tvm_version": "0.8.0"}
{"input": ["cuda -keys=cuda,gpu -max_num_threads=1024 -thread_warp_size=32", "dense_small_batch.gpu", [["TENSOR", [128, 768], "float32"], ["TENSOR", [3072, 768], "float32"], null, "float32"], {}], "config": {"index": 5, "code_hash": null, "entity": [["tile_k", "sp", [-1, 8]]]}, "result": [[0.0070321959375], 0, 1.4946277141571045, 1655831433.3495317], "version": 0.2, "tvm_version": "0.8.0"}
{"input": ["cuda -keys=cuda,gpu -max_num_threads=1024 -thread_warp_size=32", "dense_small_batch.gpu", [["TENSOR", [128, 768], "float32"], ["TENSOR", [3072, 768], "float32"], null, "float32"], {}], "config": {"index": 2, "code_hash": null, "entity": [["tile_k", "sp", [-1, 3]]]}, "result": [[0.013036075349999999], 0, 1.48588228225708, 1655831434.5786936], "version": 0.2, "tvm_version": "0.8.0"}
{"input": ["cuda -keys=cuda,gpu -max_num_threads=1024 -thread_warp_size=32", "dense_small_batch.gpu", [["TENSOR", [128, 768], "float32"], ["TENSOR", [3072, 768], "float32"], null, "float32"], {}], "config": {"index": 13, "code_hash": null, "entity": [["tile_k", "sp", [-1, 128]]]}, "result": [[0.004162689324324324], 0, 1.203437328338623, 1655831435.5672235], "version": 0.2, "tvm_version": "0.8.0"}
{"input": ["cuda -keys=cuda,gpu -max_num_threads=1024 -thread_warp_size=32", "dense_small_batch.gpu", [["TENSOR", [128, 768], "float32"], ["TENSOR", [3072, 768], "float32"], null, "float32"], {}], "config": {"index": 11, "code_hash": null, "entity": [["tile_k", "sp", [-1, 64]]]}, "result": [[0.004450455852941176], 0, 1.3269257545471191, 1655831436.6474667], "version": 0.2, "tvm_version": "0.8.0"}
{"input": ["cuda -keys=cuda,gpu -max_num_threads=1024 -thread_warp_size=32", "dense_small_batch.gpu", [["TENSOR", [128, 768], "float32"], ["TENSOR", [3072, 768], "float32"], null, "float32"], {}], "config": {"index": 1, "code_hash": null, "entity": [["tile_k", "sp", [-1, 2]]]}, "result": [[0.01751259345], 0, 1.7400741577148438, 1655831438.1739311], "version": 0.2, "tvm_version": "0.8.0"}
{"input": ["cuda -keys=cuda,gpu -max_num_threads=1024 -thread_warp_size=32", "dense_small_batch.gpu", [["TENSOR", [128, 768], "float32"], ["TENSOR", [3072, 768], "float32"], null, "float32"], {}], "config": {"index": 0, "code_hash": null, "entity": [["tile_k", "sp", [-1, 1]]]}, "result": [[0.0275239291], 0, 2.4367387294769287, 1655831440.3258526], "version": 0.2, "tvm_version": "0.8.0"}
{"input": ["cuda -keys=cuda,gpu -max_num_threads=1024 -thread_warp_size=32", "dense_small_batch.gpu", [["TENSOR", [128, 768], "float32"], ["TENSOR", [3072, 768], "float32"], null, "float32"], {}], "config": {"index": 15, "code_hash": null, "entity": [["tile_k", "sp", [-1, 256]]]}, "result": [[0.004694596314285714], 0, 1.3190441131591797, 1655831441.3662474], "version": 0.2, "tvm_version": "0.8.0"}
{"input": ["cuda -keys=cuda,gpu -max_num_threads=1024 -thread_warp_size=32", "dense_small_batch.gpu", [["TENSOR", [128, 768], "float32"], ["TENSOR", [3072, 768], "float32"], null, "float32"], {}], "config": {"index": 9, "code_hash": null, "entity": [["tile_k", "sp", [-1, 32]]]}, "result": [[0.004448960411764706], 0, 1.210815191268921, 1655831442.3486688], "version": 0.2, "tvm_version": "0.8.0"}
{"input": ["cuda -keys=cuda,gpu -max_num_threads=1024 -thread_warp_size=32", "dense_small_batch.gpu", [["TENSOR", [128, 768], "float32"], ["TENSOR", [3072, 768], "float32"], null, "float32"], {}], "config": {"index": 10, "code_hash": null, "entity": [["tile_k", "sp", [-1, 48]]]}, "result": [[0.004651602848484849], 0, 1.1948554515838623, 1655831443.341275], "version": 0.2, "tvm_version": "0.8.0"}
{"input": ["cuda -keys=cuda,gpu -max_num_threads=1024 -thread_warp_size=32", "dense_small_batch.gpu", [["TENSOR", [128, 768], "float32"], ["TENSOR", [3072, 768], "float32"], null, "float32"], {}], "config": {"index": 4, "code_hash": null, "entity": [["tile_k", "sp", [-1, 6]]]}, "result": [[0.008423995718749999], 0, 1.7820470333099365, 1655831444.8372216], "version": 0.2, "tvm_version": "0.8.0"}
{"input": ["cuda -keys=cuda,gpu -max_num_threads=1024 -thread_warp_size=32", "dense_small_batch.gpu", [["TENSOR", [128, 768], "float32"], ["TENSOR", [3072, 768], "float32"], null, "float32"], {}], "config": {"index": 17, "code_hash": null, "entity": [["tile_k", "sp", [-1, 768]]]}, "result": [[0.01513156025], 0, 1.6049244403839111, 1655831446.2044427], "version": 0.2, "tvm_version": "0.8.0"}
{"input": ["cuda -keys=cuda,gpu -max_num_threads=1024 -thread_warp_size=32", "dense_small_batch.gpu", [["TENSOR", [128, 768], "float32"], ["TENSOR", [3072, 768], "float32"], null, "float32"], {}], "config": {"index": 3, "code_hash": null, "entity": [["tile_k", "sp", [-1, 4]]]}, "result": [[0.0106597154], 0, 1.3387813568115234, 1655831447.2926052], "version": 0.2, "tvm_version": "0.8.0"}
{"input": ["cuda -keys=cuda,gpu -max_num_threads=1024 -thread_warp_size=32", "dense_small_batch.gpu", [["TENSOR", [128, 768], "float32"], ["TENSOR", [3072, 768], "float32"], null, "float32"], {}], "config": {"index": 7, "code_hash": null, "entity": [["tile_k", "sp", [-1, 16]]]}, "result": [[0.00463337406060606], 0, 1.2146880626678467, 1655831448.2831676], "version": 0.2, "tvm_version": "0.8.0"}
{"input": ["cuda -keys=cuda,gpu -max_num_threads=1024 -thread_warp_size=32", "dense_small_batch.gpu", [["TENSOR", [128, 768], "float32"], ["TENSOR", [3072, 768], "float32"], null, "float32"], {}], "config": {"index": 12, "code_hash": null, "entity": [["tile_k", "sp", [-1, 96]]]}, "result": [[0.0041816942499999996], 0, 1.2239315509796143, 1655831449.2587342], "version": 0.2, "tvm_version": "0.8.0"}
{"input": ["cuda -keys=cuda,gpu -max_num_threads=1024 -thread_warp_size=32", "dense_small_batch.gpu", [["TENSOR", [128, 768], "float32"], ["TENSOR", [3072, 768], "float32"], null, "float32"], {}], "config": {"index": 16, "code_hash": null, "entity": [["tile_k", "sp", [-1, 384]]]}, "result": [[0.007201026625], 0, 1.5039668083190918, 1655831450.527976], "version": 0.2, "tvm_version": "0.8.0"}
{"input": ["cuda -keys=cuda,gpu -max_num_threads=1024 -thread_warp_size=32", "dense_small_batch.gpu", [["TENSOR", [128, 768], "float32"], ["TENSOR", [3072, 768], "float32"], null, "float32"], {}], "config": {"index": 8, "code_hash": null, "entity": [["tile_k", "sp", [-1, 24]]]}, "result": [[0.0046544281515151515], 0, 1.3297343254089355, 1655831451.541059], "version": 0.2, "tvm_version": "0.8.0"}
{"input": ["cuda -keys=cuda,gpu -max_num_threads=1024 -thread_warp_size=32", "batch_matmul.cuda", [["TENSOR", [12, 128, 128], "float32"], ["TENSOR", [12, 64, 128], "float32"], [12, 128, 64], null, 0, 1], {}], "config": {"index": 29059, "code_hash": null, "entity": [["tile_y", "sp", [-1, 128, 1]], ["tile_x", "sp", [-1, 2, 16]], ["tile_k", "sp", [-1, 16]], ["auto_unroll_max_step", "ot", 64], ["unroll_explicit", "ot", 0]]}, "result": [[7.633942330287206e-05], 0, 1.7696309089660645, 1655831456.66443], "version": 0.2, "tvm_version": "0.8.0"}
{"input": ["cuda -keys=cuda,gpu -max_num_threads=1024 -thread_warp_size=32", "batch_matmul.cuda", [["TENSOR", [12, 128, 128], "float32"], ["TENSOR", [12, 64, 128], "float32"], [12, 128, 64], null, 0, 1], {}], "config": {"index": 8436, "code_hash": null, "entity": [["tile_y", "sp", [-1, 16, 2]], ["tile_x", "sp", [-1, 8, 2]], ["tile_k", "sp", [-1, 1]], ["auto_unroll_max_step", "ot", 16], ["unroll_explicit", "ot", 0]]}, "result": [[6.942021137483206e-05], 0, 1.2977776527404785, 1655831457.5829377], "version": 0.2, "tvm_version": "0.8.0"}
{"input": ["cuda -keys=cuda,gpu -max_num_threads=1024 -thread_warp_size=32", "batch_matmul.cuda", [["TENSOR", [12, 128, 128], "float32"], ["TENSOR", [12, 64, 128], "float32"], [12, 128, 64], null, 0, 1], {}], "config": {"index": 28392, "code_hash": null, "entity": [["tile_y", "sp", [-1, 8, 8]], ["tile_x", "sp", [-1, 16, 1]], ["tile_k", "sp", [-1, 16]], ["auto_unroll_max_step", "ot", 64], ["unroll_explicit", "ot", 0]]}, "result": [[2.3625262292697122e-05], 0, 1.2398779392242432, 1655831458.4598944], "version": 0.2, "tvm_version": "0.8.0"}
{"input": ["cuda -keys=cuda,gpu -max_num_threads=1024 -thread_warp_size=32", "batch_matmul.cuda", [["TENSOR", [12, 128, 128], "float32"], ["TENSOR", [12, 64, 128], "float32"], [12, 128, 64], null, 0, 1], {}], "config": {"index": 13278, "code_hash": null, "entity": [["tile_y", "sp", [-1, 1, 32]], ["tile_x", "sp", [-1, 16, 1]], ["tile_k", "sp", [-1, 32]], ["auto_unroll_max_step", "ot", 16], ["unroll_explicit", "ot", 0]]}, "result": [[2.4695937947494033e-05], 0, 1.6600968837738037, 1655831459.7466154], "version": 0.2, "tvm_version": "0.8.0"}
{"input": ["cuda -keys=cuda,gpu -max_num_threads=1024 -thread_warp_size=32", "batch_matmul.cuda", [["TENSOR", [12, 128, 128], "float32"], ["TENSOR", [12, 64, 128], "float32"], [12, 128, 64], null, 0, 1], {}], "config": {"index": 59366, "code_hash": null, "entity": [["tile_y", "sp", [-1, 4, 1]], ["tile_x", "sp", [-1, 1, 32]], ["tile_k", "sp", [-1, 4]], ["auto_unroll_max_step", "ot", 64], ["unroll_explicit", "ot", 1]]}, "result": [[0.00018656221454545454], 0, 1.7540433406829834, 1655831461.0494027], "version": 0.2, "tvm_version": "0.8.0"}
{"input": ["cuda -keys=cuda,gpu -max_num_threads=1024 -thread_warp_size=32", "batch_matmul.cuda", [["TENSOR", [12, 128, 128], "float32"], ["TENSOR", [12, 64, 128], "float32"], [12, 128, 64], null, 0, 1], {}], "config": {"index": 11389, "code_hash": null, "entity": [["tile_y", "sp", [-1, 32, 2]], ["tile_x", "sp", [-1, 2, 2]], ["tile_k", "sp", [-1, 8]], ["auto_unroll_max_step", "ot", 16], ["unroll_explicit", "ot", 0]]}, "result": [[8.60138615036744e-05], 0, 1.2311289310455322, 1655831461.9041314], "version": 0.2, "tvm_version": "0.8.0"}
{"input": ["cuda -keys=cuda,gpu -max_num_threads=1024 -thread_warp_size=32", "batch_matmul.cuda", [["TENSOR", [12, 128, 128], "float32"], ["TENSOR", [12, 64, 128], "float32"], [12, 128, 64], null, 0, 1], {}], "config": {"index": 8159, "code_hash": null, "entity": [["tile_y", "sp", [-1, 4, 8]], ["tile_x", "sp", [-1, 4, 1]], ["tile_k", "sp", [-1, 1]], ["auto_unroll_max_step", "ot", 16], ["unroll_explicit", "ot", 0]]}, "result": [[0.00018608431100478469], 0, 1.2411715984344482, 1655831462.7583814], "version": 0.2, "tvm_version": "0.8.0"}
{"input": ["cuda -keys=cuda,gpu -max_num_threads=1024 -thread_warp_size=32", "batch_matmul.cuda", [["TENSOR", [12, 128, 128], "float32"], ["TENSOR", [12, 64, 128], "float32"], [12, 128, 64], null, 0, 1], {}], "config": {"index": 17440, "code_hash": null, "entity": [["tile_y", "sp", [-1, 2, 4]], ["tile_x", "sp", [-1, 2, 2]], ["tile_k", "sp", [-1, 2]], ["auto_unroll_max_step", "ot", 32], ["unroll_explicit", "ot", 0]]}, "result": [[0.0001909975914994097], 0, 1.207606554031372, 1655831463.6366854], "version": 0.2, "tvm_version": "0.8.0"}
{"input": ["cuda -keys=cuda,gpu -max_num_threads=1024 -thread_warp_size=32", "batch_matmul.cuda", [["TENSOR", [12, 128, 128], "float32"], ["TENSOR", [12, 64, 128], "float32"], [12, 128, 64], null, 0, 1], {}], "config": {"index": 58503, "code_hash": null, "entity": [["tile_y", "sp", [-1, 8, 1]], ["tile_x", "sp", [-1, 2, 1]], ["tile_k", "sp", [-1, 4]], ["auto_unroll_max_step", "ot", 64], ["unroll_explicit", "ot", 1]]}, "result": [[0.00020271078339818418], 0, 1.2537074089050293, 1655831464.4897223], "version": 0.2, "tvm_version": "0.8.0"}
{"input": ["cuda -keys=cuda,gpu -max_num_threads=1024 -thread_warp_size=32", "batch_matmul.cuda", [["TENSOR", [12, 128, 128], "float32"], ["TENSOR", [12, 64, 128], "float32"], [12, 128, 64], null, 0, 1], {}], "config": {"index": 45555, "code_hash": null, "entity": [["tile_y", "sp", [-1, 1, 4]], ["tile_x", "sp", [-1, 32, 1]], ["tile_k", "sp", [-1, 32]], ["auto_unroll_max_step", "ot", 16], ["unroll_explicit", "ot", 1]]}, "result": [[4.5577044888502746e-05], 0, 1.2806017398834229, 1655831465.3900638], "version": 0.2, "tvm_version": "0.8.0"}
{"input": ["cuda -keys=cuda,gpu -max_num_threads=1024 -thread_warp_size=32", "batch_matmul.cuda", [["TENSOR", [12, 128, 128], "float32"], ["TENSOR", [12, 64, 128], "float32"], [12, 128, 64], null, 0, 1], {}], "config": {"index": 35703, "code_hash": null, "entity": [["tile_y", "sp", [-1, 2, 16]], ["tile_x", "sp", [-1, 16, 2]], ["tile_k", "sp", [-1, 8]], ["auto_unroll_max_step", "ot", 8], ["unroll_explicit", "ot", 1]]}, "result": [[2.0209700893418898e-05], 0, 1.27018141746521, 1655831466.2636402], "version": 0.2, "tvm_version": "0.8.0"}
{"input": ["cuda -keys=cuda,gpu -max_num_threads=1024 -thread_warp_size=32", "batch_matmul.cuda", [["TENSOR", [12, 128, 128], "float32"], ["TENSOR", [12, 64, 128], "float32"], [12, 128, 64], null, 0, 1], {}], "config": {"index": 25206, "code_hash": null, "entity": [["tile_y", "sp", [-1, 64, 1]], ["tile_x", "sp", [-1, 1, 1]], ["tile_k", "sp", [-1, 2]], ["auto_unroll_max_step", "ot", 64], ["unroll_explicit", "ot", 0]]}, "result": [[0.000478327131736527], 0, 1.6381134986877441, 1655831467.5344474], "version": 0.2, "tvm_version": "0.8.0"}
{"input": ["cuda -keys=cuda,gpu -max_num_threads=1024 -thread_warp_size=32", "batch_matmul.cuda", [["TENSOR", [12, 128, 128], "float32"], ["TENSOR", [12, 64, 128], "float32"], [12, 128, 64], null, 0, 1], {}], "config": {"index": 28108, "code_hash": null, "entity": [["tile_y", "sp", [-1, 4, 16]], ["tile_x", "sp", [-1, 4, 16]], ["tile_k", "sp", [-1, 8]], ["auto_unroll_max_step", "ot", 64], ["unroll_explicit", "ot", 0]]}, "result": [[9.0065532802427e-05], 0, 2.213709592819214, 1655831469.0404532], "version": 0.2, "tvm_version": "0.8.0"}
