exp/partial_log/bert_xgb_knob_cuda_1000.json.tmp
{"input": ["cuda -keys=cuda,gpu -max_num_threads=1024 -thread_warp_size=32", "dense_small_batch.gpu", [["TENSOR", [1, 768], "float32"], ["TENSOR", [768, 768], "float32"], null, "float32"], {}], "config": {"index": 16, "code_hash": null, "entity": [["tile_k", "sp", [-1, 384]]]}, "result": [[1.2617479366100875e-05], 0, 1.5890247821807861, 1655820220.9396827], "version": 0.2, "tvm_version": "0.8.0"}
{"input": ["cuda -keys=cuda,gpu -max_num_threads=1024 -thread_warp_size=32", "dense_small_batch.gpu", [["TENSOR", [1, 768], "float32"], ["TENSOR", [768, 768], "float32"], null, "float32"], {}], "config": {"index": 9, "code_hash": null, "entity": [["tile_k", "sp", [-1, 32]]]}, "result": [[4.259612471012626e-06], 0, 1.4450702667236328, 1655820222.1871912], "version": 0.2, "tvm_version": "0.8.0"}
{"input": ["cuda -keys=cuda,gpu -max_num_threads=1024 -thread_warp_size=32", "dense_small_batch.gpu", [["TENSOR", [1, 768], "float32"], ["TENSOR", [768, 768], "float32"], null, "float32"], {}], "config": {"index": 13, "code_hash": null, "entity": [["tile_k", "sp", [-1, 128]]]}, "result": [[5.499210904882919e-06], 0, 1.4501962661743164, 1655820224.1092296], "version": 0.2, "tvm_version": "0.8.0"}
{"input": ["cuda -keys=cuda,gpu -max_num_threads=1024 -thread_warp_size=32", "dense_small_batch.gpu", [["TENSOR", [1, 768], "float32"], ["TENSOR", [768, 768], "float32"], null, "float32"], {}], "config": {"index": 8, "code_hash": null, "entity": [["tile_k", "sp", [-1, 24]]]}, "result": [[5.311176240067552e-06], 0, 1.5325653553009033, 1655820225.3938048], "version": 0.2, "tvm_version": "0.8.0"}
{"input": ["cuda -keys=cuda,gpu -max_num_threads=1024 -thread_warp_size=32", "dense_small_batch.gpu", [["TENSOR", [1, 768], "float32"], ["TENSOR", [768, 768], "float32"], null, "float32"], {}], "config": {"index": 14, "code_hash": null, "entity": [["tile_k", "sp", [-1, 192]]]}, "result": [[6.759238427699731e-06], 0, 1.4596335887908936, 1655820227.3066862], "version": 0.2, "tvm_version": "0.8.0"}
{"input": ["cuda -keys=cuda,gpu -max_num_threads=1024 -thread_warp_size=32", "dense_small_batch.gpu", [["TENSOR", [1, 768], "float32"], ["TENSOR", [768, 768], "float32"], null, "float32"], {}], "config": {"index": 3, "code_hash": null, "entity": [["tile_k", "sp", [-1, 4]]]}, "result": [[1.4355614565157498e-05], 0, 1.145228624343872, 1655820228.8189104], "version": 0.2, "tvm_version": "0.8.0"}
{"input": ["cuda -keys=cuda,gpu -max_num_threads=1024 -thread_warp_size=32", "dense_small_batch.gpu", [["TENSOR", [1, 768], "float32"], ["TENSOR", [768, 768], "float32"], null, "float32"], {}], "config": {"index": 1, "code_hash": null, "entity": [["tile_k", "sp", [-1, 2]]]}, "result": [[2.5999288464786352e-05], 0, 1.1022655963897705, 1655820230.3084655], "version": 0.2, "tvm_version": "0.8.0"}
{"input": ["cuda -keys=cuda,gpu -max_num_threads=1024 -thread_warp_size=32", "dense_small_batch.gpu", [["TENSOR", [1, 768], "float32"], ["TENSOR", [768, 768], "float32"], null, "float32"], {}], "config": {"index": 10, "code_hash": null, "entity": [["tile_k", "sp", [-1, 48]]]}, "result": [[5.348471325069832e-06], 0, 1.5249817371368408, 1655820231.590311], "version": 0.2, "tvm_version": "0.8.0"}
{"input": ["cuda -keys=cuda,gpu -max_num_threads=1024 -thread_warp_size=32", "dense_small_batch.gpu", [["TENSOR", [1, 768], "float32"], ["TENSOR", [768, 768], "float32"], null, "float32"], {}], "config": {"index": 11, "code_hash": null, "entity": [["tile_k", "sp", [-1, 64]]]}, "result": [[4.845447056672018e-06], 0, 1.4897160530090332, 1655820233.490368], "version": 0.2, "tvm_version": "0.8.0"}
{"input": ["cuda -keys=cuda,gpu -max_num_threads=1024 -thread_warp_size=32", "dense_small_batch.gpu", [["TENSOR", [1, 768], "float32"], ["TENSOR", [768, 768], "float32"], null, "float32"], {}], "config": {"index": 4, "code_hash": null, "entity": [["tile_k", "sp", [-1, 6]]]}, "result": [[1.0871599127484245e-05], 0, 1.0676043033599854, 1655820235.0084558], "version": 0.2, "tvm_version": "0.8.0"}
{"input": ["cuda -keys=cuda,gpu -max_num_threads=1024 -thread_warp_size=32", "dense_small_batch.gpu", [["TENSOR", [1, 768], "float32"], ["TENSOR", [768, 768], "float32"], null, "float32"], {}], "config": {"index": 12, "code_hash": null, "entity": [["tile_k", "sp", [-1, 96]]]}, "result": [[5.2760622820569405e-06], 0, 1.4655201435089111, 1655820236.2649782], "version": 0.2, "tvm_version": "0.8.0"}
{"input": ["cuda -keys=cuda,gpu -max_num_threads=1024 -thread_warp_size=32", "dense_small_batch.gpu", [["TENSOR", [1, 768], "float32"], ["TENSOR", [768, 768], "float32"], null, "float32"], {}], "config": {"index": 17, "code_hash": null, "entity": [["tile_k", "sp", [-1, 768]]]}, "result": [[2.6116234647632e-05], 0, 1.4882841110229492, 1655820237.5272415], "version": 0.2, "tvm_version": "0.8.0"}
{"input": ["cuda -keys=cuda,gpu -max_num_threads=1024 -thread_warp_size=32", "dense_small_batch.gpu", [["TENSOR", [1, 768], "float32"], ["TENSOR", [768, 768], "float32"], null, "float32"], {}], "config": {"index": 15, "code_hash": null, "entity": [["tile_k", "sp", [-1, 256]]]}, "result": [[7.75212544661881e-06], 0, 1.420577049255371, 1655820239.4067261], "version": 0.2, "tvm_version": "0.8.0"}
{"input": ["cuda -keys=cuda,gpu -max_num_threads=1024 -thread_warp_size=32", "dense_small_batch.gpu", [["TENSOR", [1, 768], "float32"], ["TENSOR", [768, 768], "float32"], null, "float32"], {}], "config": {"index": 5, "code_hash": null, "entity": [["tile_k", "sp", [-1, 8]]]}, "result": [[8.945469402773848e-06], 0, 1.0778729915618896, 1655820240.272236], "version": 0.2, "tvm_version": "0.8.0"}
{"input": ["cuda -keys=cuda,gpu -max_num_threads=1024 -thread_warp_size=32", "dense_small_batch.gpu", [["TENSOR", [1, 768], "float32"], ["TENSOR", [768, 768], "float32"], null, "float32"], {}], "config": {"index": 7, "code_hash": null, "entity": [["tile_k", "sp", [-1, 16]]]}, "result": [[6.032058136123607e-06], 0, 1.4663715362548828, 1655820242.205842], "version": 0.2, "tvm_version": "0.8.0"}
{"input": ["cuda -keys=cuda,gpu -max_num_threads=1024 -thread_warp_size=32", "dense_small_batch.gpu", [["TENSOR", [1, 768], "float32"], ["TENSOR", [768, 768], "float32"], null, "float32"], {}], "config": {"index": 2, "code_hash": null, "entity": [["tile_k", "sp", [-1, 3]]]}, "result": [[1.8905034507634966e-05], 0, 1.0686209201812744, 1655820243.0987449], "version": 0.2, "tvm_version": "0.8.0"}
{"input": ["cuda -keys=cuda,gpu -max_num_threads=1024 -thread_warp_size=32", "dense_small_batch.gpu", [["TENSOR", [1, 768], "float32"], ["TENSOR", [768, 768], "float32"], null, "float32"], {}], "config": {"index": 6, "code_hash": null, "entity": [["tile_k", "sp", [-1, 12]]]}, "result": [[7.061209571331367e-06], 0, 1.0235486030578613, 1655820244.6063523], "version": 0.2, "tvm_version": "0.8.0"}
{"input": ["cuda -keys=cuda,gpu -max_num_threads=1024 -thread_warp_size=32", "dense_small_batch.gpu", [["TENSOR", [1, 768], "float32"], ["TENSOR", [768, 768], "float32"], null, "float32"], {}], "config": {"index": 0, "code_hash": null, "entity": [["tile_k", "sp", [-1, 1]]]}, "result": [[4.7953091748644855e-05], 0, 1.447007417678833, 1655820245.8684113], "version": 0.2, "tvm_version": "0.8.0"}
{"input": ["cuda -keys=cuda,gpu -max_num_threads=1024 -thread_warp_size=32", "dense_large_batch.gpu", [["TENSOR", [128, 3072], "float32"], ["TENSOR", [768, 3072], "float32"], null, "float32"], {}], "config": {"index": 12939849, "code_hash": null, "entity": [["tile_x", "sp", [-1, 2, 2, 1]], ["tile_y", "sp", [-1, 1, 2, 3]], ["tile_k", "sp", [-1, 1, 128]]]}, "result": [[0.04930561125], 0, 3.973421335220337, 1655820292.5081546], "version": 0.2, "tvm_version": "0.8.0"}
{"input": ["cuda -keys=cuda,gpu -max_num_threads=1024 -thread_warp_size=32", "dense_large_batch.gpu", [["TENSOR", [128, 3072], "float32"], ["TENSOR", [768, 3072], "float32"], null, "float32"], {}], "config": {"index": 13573449, "code_hash": null, "entity": [["tile_x", "sp", [-1, 2, 2, 1]], ["tile_y", "sp", [-1, 1, 2, 3]], ["tile_k", "sp", [-1, 1, 192]]]}, "result": [[0.04604794575], 0, 3.731924533843994, 1655820408.0657232], "version": 0.2, "tvm_version": "0.8.0"}
{"input": ["cuda -keys=cuda,gpu -max_num_threads=1024 -thread_warp_size=32", "dense_large_batch.gpu", [["TENSOR", [128, 3072], "float32"], ["TENSOR", [768, 3072], "float32"], null, "float32"], {}], "config": {"index": 14444649, "code_hash": null, "entity": [["tile_x", "sp", [-1, 2, 2, 1]], ["tile_y", "sp", [-1, 1, 2, 3]], ["tile_k", "sp", [-1, 1, 384]]]}, "result": [[0.0445155775], 0, 3.6207022666931152, 1655820411.391068], "version": 0.2, "tvm_version": "0.8.0"}
{"input": ["cuda -keys=cuda,gpu -max_num_threads=1024 -thread_warp_size=32", "dense_large_batch.gpu", [["TENSOR", [128, 3072], "float32"], ["TENSOR", [768, 3072], "float32"], null, "float32"], {}], "config": {"index": 13969449, "code_hash": null, "entity": [["tile_x", "sp", [-1, 2, 2, 1]], ["tile_y", "sp", [-1, 1, 2, 3]], ["tile_k", "sp", [-1, 1, 256]]]}, "result": [[0.0452595541], 0, 3.6412034034729004, 1655820414.9692523], "version": 0.2, "tvm_version": "0.8.0"}
{"input": ["cuda -keys=cuda,gpu -max_num_threads=1024 -thread_warp_size=32", "dense_large_batch.gpu", [["TENSOR", [128, 3072], "float32"], ["TENSOR", [768, 3072], "float32"], null, "float32"], {}], "config": {"index": 14761449, "code_hash": null, "entity": [["tile_x", "sp", [-1, 2, 2, 1]], ["tile_y", "sp", [-1, 1, 2, 3]], ["tile_k", "sp", [-1, 1, 512]]]}, "result": [[0.056159852850000004], 0, 4.315646648406982, 1655820419.0011268], "version": 0.2, "tvm_version": "0.8.0"}
{"input": ["cuda -keys=cuda,gpu -max_num_threads=1024 -thread_warp_size=32", "dense_large_batch.gpu", [["TENSOR", [128, 3072], "float32"], ["TENSOR", [768, 3072], "float32"], null, "float32"], {}], "config": {"index": 13969511, "code_hash": null, "entity": [["tile_x", "sp", [-1, 2, 2, 4]], ["tile_y", "sp", [-1, 1, 2, 3]], ["tile_k", "sp", [-1, 1, 256]]]}, "result": [[0.040362839750000004], 0, 3.5206851959228516, 1655820495.9830215], "version": 0.2, "tvm_version": "0.8.0"}
{"input": ["cuda -keys=cuda,gpu -max_num_threads=1024 -thread_warp_size=32", "dense_large_batch.gpu", [["TENSOR", [128, 3072], "float32"], ["TENSOR", [768, 3072], "float32"], null, "float32"], {}], "config": {"index": 13969484, "code_hash": null, "entity": [["tile_x", "sp", [-1, 2, 2, 2]], ["tile_y", "sp", [-1, 1, 2, 3]], ["tile_k", "sp", [-1, 1, 256]]]}, "result": [[0.03297334835], 0, 2.9456677436828613, 1655820498.5786006], "version": 0.2, "tvm_version": "0.8.0"}
{"input": ["cuda -keys=cuda,gpu -max_num_threads=1024 -thread_warp_size=32", "dense_large_batch.gpu", [["TENSOR", [128, 3072], "float32"], ["TENSOR", [768, 3072], "float32"], null, "float32"], {}], "config": {"index": 13573530, "code_hash": null, "entity": [["tile_x", "sp", [-1, 1, 2, 8]], ["tile_y", "sp", [-1, 1, 2, 3]], ["tile_k", "sp", [-1, 1, 192]]]}, "result": [[0.04072577695], 0, 3.9541375637054443, 1655820502.133593], "version": 0.2, "tvm_version": "0.8.0"}
{"input": ["cuda -keys=cuda,gpu -max_num_threads=1024 -thread_warp_size=32", "dense_large_batch.gpu", [["TENSOR", [128, 3072], "float32"], ["TENSOR", [768, 3072], "float32"], null, "float32"], {}], "config": {"index": 13573484, "code_hash": null, "entity": [["tile_x", "sp", [-1, 2, 2, 2]], ["tile_y", "sp", [-1, 1, 2, 3]], ["tile_k", "sp", [-1, 1, 192]]]}, "result": [[0.0326187907], 0, 2.930534601211548, 1655820504.7701707], "version": 0.2, "tvm_version": "0.8.0"}
{"input": ["cuda -keys=cuda,gpu -max_num_threads=1024 -thread_warp_size=32", "dense_large_batch.gpu", [["TENSOR", [128, 3072], "float32"], ["TENSOR", [768, 3072], "float32"], null, "float32"], {}], "config": {"index": 14444710, "code_hash": null, "entity": [["tile_x", "sp", [-1, 1, 2, 4]], ["tile_y", "sp", [-1, 1, 2, 3]], ["tile_k", "sp", [-1, 1, 384]]]}, "result": [[0.049842284599999995], 0, 4.0944414138793945, 1655820508.494576], "version": 0.2, "tvm_version": "0.8.0"}
{"input": ["cuda -keys=cuda,gpu -max_num_threads=1024 -thread_warp_size=32", "dense_large_batch.gpu", [["TENSOR", [128, 3072], "float32"], ["TENSOR", [768, 3072], "float32"], null, "float32"], {}], "config": {"index": 14444683, "code_hash": null, "entity": [["tile_x", "sp", [-1, 1, 2, 2]], ["tile_y", "sp", [-1, 1, 2, 3]], ["tile_k", "sp", [-1, 1, 384]]]}, "result": [[0.058016723699999995], 0, 4.486515998840332, 1655820512.663682], "version": 0.2, "tvm_version": "0.8.0"}
{"input": ["cuda -keys=cuda,gpu -max_num_threads=1024 -thread_warp_size=32", "dense_large_batch.gpu", [["TENSOR", [128, 3072], "float32"], ["TENSOR", [768, 3072], "float32"], null, "float32"], {}], "config": {"index": 13969530, "code_hash": null, "entity": [["tile_x", "sp", [-1, 1, 2, 8]], ["tile_y", "sp", [-1, 1, 2, 3]], ["tile_k", "sp", [-1, 1, 256]]]}, "result": [[0.03975137635], 0, 3.5687358379364014, 1655820515.79182], "version": 0.2, "tvm_version": "0.8.0"}
{"input": ["cuda -keys=cuda,gpu -max_num_threads=1024 -thread_warp_size=32", "dense_large_batch.gpu", [["TENSOR", [128, 3072], "float32"], ["TENSOR", [768, 3072], "float32"], null, "float32"], {}], "config": {"index": 13573511, "code_hash": null, "entity": [["tile_x", "sp", [-1, 2, 2, 4]], ["tile_y", "sp", [-1, 1, 2, 3]], ["tile_k", "sp", [-1, 1, 192]]]}, "result": [[0.04175265875], 0, 3.5441293716430664, 1655820523.706957], "version": 0.2, "tvm_version": "0.8.0"}
{"input": ["cuda -keys=cuda,gpu -max_num_threads=1024 -thread_warp_size=32", "dense_large_batch.gpu", [["TENSOR", [128, 3072], "float32"], ["TENSOR", [768, 3072], "float32"], null, "float32"], {}], "config": {"index": 13573510, "code_hash": null, "entity": [["tile_x", "sp", [-1, 1, 2, 4]], ["tile_y", "sp", [-1, 1, 2, 3]], ["tile_k", "sp", [-1, 1, 192]]]}, "result": [[0.04151289815], 0, 3.593707323074341, 1655820526.8604615], "version": 0.2, "tvm_version": "0.8.0"}
{"input": ["cuda -keys=cuda,gpu -max_num_threads=1024 -thread_warp_size=32", "dense_large_batch.gpu", [["TENSOR", [128, 3072], "float32"], ["TENSOR", [768, 3072], "float32"], null, "float32"], {}], "config": {"index": 14444684, "code_hash": null, "entity": [["tile_x", "sp", [-1, 2, 2, 2]], ["tile_y", "sp", [-1, 1, 2, 3]], ["tile_k", "sp", [-1, 1, 384]]]}, "result": [[0.04689921655], 0, 3.8864641189575195, 1655820530.5120895], "version": 0.2, "tvm_version": "0.8.0"}
{"input": ["cuda -keys=cuda,gpu -max_num_threads=1024 -thread_warp_size=32", "dense_large_batch.gpu", [["TENSOR", [128, 3072], "float32"], ["TENSOR", [768, 3072], "float32"], null, "float32"], {}], "config": {"index": 13969485, "code_hash": null, "entity": [["tile_x", "sp", [-1, 4, 2, 2]], ["tile_y", "sp", [-1, 1, 2, 3]], ["tile_k", "sp", [-1, 1, 256]]]}, "result": [[0.04187309645], 0, 3.5358591079711914, 1655820573.3919978], "version": 0.2, "tvm_version": "0.8.0"}
{"input": ["cuda -keys=cuda,gpu -max_num_threads=1024 -thread_warp_size=32", "dense_large_batch.gpu", [["TENSOR", [128, 3072], "float32"], ["TENSOR", [768, 3072], "float32"], null, "float32"], {}], "config": {"index": 13573485, "code_hash": null, "entity": [["tile_x", "sp", [-1, 4, 2, 2]], ["tile_y", "sp", [-1, 1, 2, 3]], ["tile_k", "sp", [-1, 1, 192]]]}, "result": [[0.04304563585], 0, 3.6087417602539062, 1655820576.7446237], "version": 0.2, "tvm_version": "0.8.0"}
{"input": ["cuda -keys=cuda,gpu -max_num_threads=1024 -thread_warp_size=32", "dense_large_batch.gpu", [["TENSOR", [128, 3072], "float32"], ["TENSOR", [768, 3072], "float32"], null, "float32"], {}], "config": {"index": 13969510, "code_hash": null, "entity": [["tile_x", "sp", [-1, 1, 2, 4]], ["tile_y", "sp", [-1, 1, 2, 3]], ["tile_k", "sp", [-1, 1, 256]]]}, "result": [[0.0399125642], 0, 3.418835401535034, 1655820580.4292798], "version": 0.2, "tvm_version": "0.8.0"}
{"input": ["cuda -keys=cuda,gpu -max_num_threads=1024 -thread_warp_size=32", "dense_large_batch.gpu", [["TENSOR", [128, 3072], "float32"], ["TENSOR", [768, 3072], "float32"], null, "float32"], {}], "config": {"index": 13969483, "code_hash": null, "entity": [["tile_x", "sp", [-1, 1, 2, 2]], ["tile_y", "sp", [-1, 1, 2, 3]], ["tile_k", "sp", [-1, 1, 256]]]}, "result": [[0.04597335245], 0, 3.688255548477173, 1655820583.7991416], "version": 0.2, "tvm_version": "0.8.0"}
{"input": ["cuda -keys=cuda,gpu -max_num_threads=1024 -thread_warp_size=32", "dense_large_batch.gpu", [["TENSOR", [128, 3072], "float32"], ["TENSOR", [768, 3072], "float32"], null, "float32"], {}], "config": {"index": 13652684, "code_hash": null, "entity": [["tile_x", "sp", [-1, 2, 2, 2]], ["tile_y", "sp", [-1, 1, 2, 3]], ["tile_k", "sp", [-1, 2, 192]]]}, "result": [[0.0372109802], 0, 3.564685583114624, 1655820588.5595248], "version": 0.2, "tvm_version": "0.8.0"}
{"input": ["cuda -keys=cuda,gpu -max_num_threads=1024 -thread_warp_size=32", "dense_large_batch.gpu", [["TENSOR", [128, 3072], "float32"], ["TENSOR", [768, 3072], "float32"], null, "float32"], {}], "config": {"index": 13573483, "code_hash": null, "entity": [["tile_x", "sp", [-1, 1, 2, 2]], ["tile_y", "sp", [-1, 1, 2, 3]], ["tile_k", "sp", [-1, 1, 192]]]}, "result": [[0.04780312625], 0, 3.8408970832824707, 1655820592.250679], "version": 0.2, "tvm_version": "0.8.0"}
{"input": ["cuda -keys=cuda,gpu -max_num_threads=1024 -thread_warp_size=32", "dense_large_batch.gpu", [["TENSOR", [128, 3072], "float32"], ["TENSOR", [768, 3072], "float32"], null, "float32"], {}], "config": {"index": 12939883, "code_hash": null, "entity": [["tile_x", "sp", [-1, 1, 2, 2]], ["tile_y", "sp", [-1, 1, 2, 3]], ["tile_k", "sp", [-1, 1, 128]]]}, "result": [[0.0504019389], 0, 4.067541837692261, 1655820642.4708383], "version": 0.2, "tvm_version": "0.8.0"}
{"input": ["cuda -keys=cuda,gpu -max_num_threads=1024 -thread_warp_size=32", "dense_large_batch.gpu", [["TENSOR", [128, 3072], "float32"], ["TENSOR", [768, 3072], "float32"], null, "float32"], {}], "config": {"index": 12939910, "code_hash": null, "entity": [["tile_x", "sp", [-1, 1, 2, 4]], ["tile_y", "sp", [-1, 1, 2, 3]], ["tile_k", "sp", [-1, 1, 128]]]}, "result": [[0.0335419595], 0, 3.220182418823242, 1655820645.2168043], "version": 0.2, "tvm_version": "0.8.0"}
{"input": ["cuda -keys=cuda,gpu -max_num_threads=1024 -thread_warp_size=32", "dense_large_batch.gpu", [["TENSOR", [128, 3072], "float32"], ["TENSOR", [768, 3072], "float32"], null, "float32"], {}], "config": {"index": 13957363, "code_hash": null, "entity": [["tile_x", "sp", [-1, 1, 2, 2]], ["tile_y", "sp", [-1, 1, 2, 2]], ["tile_k", "sp", [-1, 1, 256]]]}, "result": [[0.05330803155], 0, 4.089268684387207, 1655820649.007493], "version": 0.2, "tvm_version": "0.8.0"}
{"input": ["cuda -keys=cuda,gpu -max_num_threads=1024 -thread_warp_size=32", "dense_large_batch.gpu", [["TENSOR", [128, 3072], "float32"], ["TENSOR", [768, 3072], "float32"], null, "float32"], {}], "config": {"index": 13957390, "code_hash": null, "entity": [["tile_x", "sp", [-1, 1, 2, 4]], ["tile_y", "sp", [-1, 1, 2, 2]], ["tile_k", "sp", [-1, 1, 256]]]}, "result": [[0.04559367425], 0, 3.829946756362915, 1655820661.8420725], "version": 0.2, "tvm_version": "0.8.0"}
{"input": ["cuda -keys=cuda,gpu -max_num_threads=1024 -thread_warp_size=32", "dense_large_batch.gpu", [["TENSOR", [128, 3072], "float32"], ["TENSOR", [768, 3072], "float32"], null, "float32"], {}], "config": {"index": 12939884, "code_hash": null, "entity": [["tile_x", "sp", [-1, 2, 2, 2]], ["tile_y", "sp", [-1, 1, 2, 3]], ["tile_k", "sp", [-1, 1, 128]]]}, "result": [[0.0326081242], 0, 3.0035133361816406, 1655820664.4447207], "version": 0.2, "tvm_version": "0.8.0"}
{"input": ["cuda -keys=cuda,gpu -max_num_threads=1024 -thread_warp_size=32", "dense_large_batch.gpu", [["TENSOR", [128, 3072], "float32"], ["TENSOR", [768, 3072], "float32"], null, "float32"], {}], "config": {"index": 13561363, "code_hash": null, "entity": [["tile_x", "sp", [-1, 1, 2, 2]], ["tile_y", "sp", [-1, 1, 2, 2]], ["tile_k", "sp", [-1, 1, 192]]]}, "result": [[0.05363758755], 0, 4.2244813442230225, 1655820673.0109203], "version": 0.2, "tvm_version": "0.8.0"}
{"input": ["cuda -keys=cuda,gpu -max_num_threads=1024 -thread_warp_size=32", "dense_large_batch.gpu", [["TENSOR", [128, 3072], "float32"], ["TENSOR", [768, 3072], "float32"], null, "float32"], {}], "config": {"index": 13561390, "code_hash": null, "entity": [["tile_x", "sp", [-1, 1, 2, 4]], ["tile_y", "sp", [-1, 1, 2, 2]], ["tile_k", "sp", [-1, 1, 192]]]}, "result": [[0.04140368645], 0, 3.5674941539764404, 1655820680.845311], "version": 0.2, "tvm_version": "0.8.0"}
{"input": ["cuda -keys=cuda,gpu -max_num_threads=1024 -thread_warp_size=32", "dense_large_batch.gpu", [["TENSOR", [128, 3072], "float32"], ["TENSOR", [768, 3072], "float32"], null, "float32"], {}], "config": {"index": 3356683, "code_hash": null, "entity": [["tile_x", "sp", [-1, 1, 2, 2]], ["tile_y", "sp", [-1, 1, 2, 3]], ["tile_k", "sp", [-1, 1, 3]]]}, "result": [[0.0101844328], 0, 1.4888014793395996, 1655820686.670726], "version": 0.2, "tvm_version": "0.8.0"}
{"input": ["cuda -keys=cuda,gpu -max_num_threads=1024 -thread_warp_size=32", "dense_large_batch.gpu", [["TENSOR", [128, 3072], "float32"], ["TENSOR", [768, 3072], "float32"], null, "float32"], {}], "config": {"index": 7712683, "code_hash": null, "entity": [["tile_x", "sp", [-1, 1, 2, 2]], ["tile_y", "sp", [-1, 1, 2, 3]], ["tile_k", "sp", [-1, 1, 12]]]}, "result": [[0.0057369183125], 0, 1.5718185901641846, 1655820687.8198428], "version": 0.2, "tvm_version": "0.8.0"}
{"input": ["cuda -keys=cuda,gpu -max_num_threads=1024 -thread_warp_size=32", "dense_large_batch.gpu", [["TENSOR", [128, 3072], "float32"], ["TENSOR", [768, 3072], "float32"], null, "float32"], {}], "config": {"index": 4227883, "code_hash": null, "entity": [["tile_x", "sp", [-1, 1, 2, 2]], ["tile_y", "sp", [-1, 1, 2, 3]], ["tile_k", "sp", [-1, 1, 4]]]}, "result": [[0.007658862850000001], 0, 1.3816792964935303, 1655820688.7579832], "version": 0.2, "tvm_version": "0.8.0"}
{"input": ["cuda -keys=cuda,gpu -max_num_threads=1024 -thread_warp_size=32", "dense_large_batch.gpu", [["TENSOR", [128, 3072], "float32"], ["TENSOR", [768, 3072], "float32"], null, "float32"], {}], "config": {"index": 10167883, "code_hash": null, "entity": [["tile_x", "sp", [-1, 1, 2, 2]], ["tile_y", "sp", [-1, 1, 2, 3]], ["tile_k", "sp", [-1, 1, 32]]]}, "result": [[0.004097435333333334], 0, 1.404371976852417, 1655820689.7932236], "version": 0.2, "tvm_version": "0.8.0"}
{"input": ["cuda -keys=cuda,gpu -max_num_threads=1024 -thread_warp_size=32", "dense_large_batch.gpu", [["TENSOR", [128, 3072], "float32"], ["TENSOR", [768, 3072], "float32"], null, "float32"], {}], "config": {"index": 11118283, "code_hash": null, "entity": [["tile_x", "sp", [-1, 1, 2, 2]], ["tile_y", "sp", [-1, 1, 2, 3]], ["tile_k", "sp", [-1, 1, 48]]]}, "result": [[0.06002975290000001], 0, 4.809344053268433, 1655820693.9848943], "version": 0.2, "tvm_version": "0.8.0"}
{"input": ["cuda -keys=cuda,gpu -max_num_threads=1024 -thread_warp_size=32", "dense_large_batch.gpu", [["TENSOR", [128, 3072], "float32"], ["TENSOR", [768, 3072], "float32"], null, "float32"], {}], "config": {"index": 12464683, "code_hash": null, "entity": [["tile_x", "sp", [-1, 1, 2, 2]], ["tile_y", "sp", [-1, 1, 2, 3]], ["tile_k", "sp", [-1, 1, 96]]]}, "result": [[0.054988093249999995], 0, 4.349802732467651, 1655820698.320464], "version": 0.2, "tvm_version": "0.8.0"}
{"input": ["cuda -keys=cuda,gpu -max_num_threads=1024 -thread_warp_size=32", "dense_large_batch.gpu", [["TENSOR", [128, 3072], "float32"], ["TENSOR", [768, 3072], "float32"], null, "float32"], {}], "config": {"index": 11672683, "code_hash": null, "entity": [["tile_x", "sp", [-1, 1, 2, 2]], ["tile_y", "sp", [-1, 1, 2, 3]], ["tile_k", "sp", [-1, 1, 64]]]}, "result": [[0.05479448495], 0, 4.6770288944244385, 1655820702.218358], "version": 0.2, "tvm_version": "0.8.0"}
{"input": ["cuda -keys=cuda,gpu -max_num_threads=1024 -thread_warp_size=32", "dense_large_batch.gpu", [["TENSOR", [128, 3072], "float32"], ["TENSOR", [768, 3072], "float32"], null, "float32"], {}], "config": {"index": 6445483, "code_hash": null, "entity": [["tile_x", "sp", [-1, 1, 2, 2]], ["tile_y", "sp", [-1, 1, 2, 3]], ["tile_k", "sp", [-1, 1, 8]]]}, "result": [[0.003875081547619047], 0, 1.267688274383545, 1655820703.25319], "version": 0.2, "tvm_version": "0.8.0"}
{"input": ["cuda -keys=cuda,gpu -max_num_threads=1024 -thread_warp_size=32", "dense_large_batch.gpu", [["TENSOR", [128, 3072], "float32"], ["TENSOR", [768, 3072], "float32"], null, "float32"], {}], "config": {"index": 1772683, "code_hash": null, "entity": [["tile_x", "sp", [-1, 1, 2, 2]], ["tile_y", "sp", [-1, 1, 2, 3]], ["tile_k", "sp", [-1, 1, 2]]]}, "result": [[0.01252881525], 0, 1.6736814975738525, 1655820704.4793854], "version": 0.2, "tvm_version": "0.8.0"}
{"input": ["cuda -keys=cuda,gpu -max_num_threads=1024 -thread_warp_size=32", "dense_large_batch.gpu", [["TENSOR", [128, 3072], "float32"], ["TENSOR", [768, 3072], "float32"], null, "float32"], {}], "config": {"index": 8425483, "code_hash": null, "entity": [["tile_x", "sp", [-1, 1, 2, 2]], ["tile_y", "sp", [-1, 1, 2, 3]], ["tile_k", "sp", [-1, 1, 16]]]}, "result": [[0.004363578459459459], 0, 1.316730260848999, 1655820705.5178163], "version": 0.2, "tvm_version": "0.8.0"}
{"input": ["cuda -keys=cuda,gpu -max_num_threads=1024 -thread_warp_size=32", "dense_large_batch.gpu", [["TENSOR", [128, 3072], "float32"], ["TENSOR", [768, 3072], "float32"], null, "float32"], {}], "config": {"index": 5653483, "code_hash": null, "entity": [["tile_x", "sp", [-1, 1, 2, 2]], ["tile_y", "sp", [-1, 1, 2, 3]], ["tile_k", "sp", [-1, 1, 6]]]}, "result": [[0.00591941784375], 0, 1.3567087650299072, 1655820706.6583047], "version": 0.2, "tvm_version": "0.8.0"}
{"input": ["cuda -keys=cuda,gpu -max_num_threads=1024 -thread_warp_size=32", "dense_large_batch.gpu", [["TENSOR", [128, 3072], "float32"], ["TENSOR", [768, 3072], "float32"], null, "float32"], {}], "config": {"index": 30283, "code_hash": null, "entity": [["tile_x", "sp", [-1, 1, 2, 2]], ["tile_y", "sp", [-1, 1, 2, 3]], ["tile_k", "sp", [-1, 1, 1]]]}, "result": [[0.02195711745], 0, 2.215233564376831, 1655820708.466087], "version": 0.2, "tvm_version": "0.8.0"}
{"input": ["cuda -keys=cuda,gpu -max_num_threads=1024 -thread_warp_size=32", "dense_large_batch.gpu", [["TENSOR", [128, 3072], "float32"], ["TENSOR", [768, 3072], "float32"], null, "float32"], {}], "config": {"index": 5653510, "code_hash": null, "entity": [["tile_x", "sp", [-1, 1, 2, 4]], ["tile_y", "sp", [-1, 1, 2, 3]], ["tile_k", "sp", [-1, 1, 6]]]}, "result": [[0.004144414307692307], 0, 1.3217384815216064, 1655820709.5438132], "version": 0.2, "tvm_version": "0.8.0"}
{"input": ["cuda -keys=cuda,gpu -max_num_threads=1024 -thread_warp_size=32", "dense_large_batch.gpu", [["TENSOR", [128, 3072], "float32"], ["TENSOR", [768, 3072], "float32"], null, "float32"], {}], "config": {"index": 9534310, "code_hash": null, "entity": [["tile_x", "sp", [-1, 1, 2, 4]], ["tile_y", "sp", [-1, 1, 2, 3]], ["tile_k", "sp", [-1, 1, 24]]]}, "result": [[0.04644111995], 0, 3.811607599258423, 1655820712.8822134], "version": 0.2, "tvm_version": "0.8.0"}
{"input": ["cuda -keys=cuda,gpu -max_num_threads=1024 -thread_warp_size=32", "dense_large_batch.gpu", [["TENSOR", [128, 3072], "float32"], ["TENSOR", [768, 3072], "float32"], null, "float32"], {}], "config": {"index": 4227910, "code_hash": null, "entity": [["tile_x", "sp", [-1, 1, 2, 4]], ["tile_y", "sp", [-1, 1, 2, 3]], ["tile_k", "sp", [-1, 1, 4]]]}, "result": [[0.00544863009375], 0, 1.393519401550293, 1655820713.9964747], "version": 0.2, "tvm_version": "0.8.0"}
{"input": ["cuda -keys=cuda,gpu -max_num_threads=1024 -thread_warp_size=32", "dense_large_batch.gpu", [["TENSOR", [128, 3072], "float32"], ["TENSOR", [768, 3072], "float32"], null, "float32"], {}], "config": {"index": 30310, "code_hash": null, "entity": [["tile_x", "sp", [-1, 1, 2, 4]], ["tile_y", "sp", [-1, 1, 2, 3]], ["tile_k", "sp", [-1, 1, 1]]]}, "result": [[0.01475512495], 0, 1.6592495441436768, 1655820715.3662643], "version": 0.2, "tvm_version": "0.8.0"}
{"input": ["cuda -keys=cuda,gpu -max_num_threads=1024 -thread_warp_size=32", "dense_large_batch.gpu", [["TENSOR", [128, 3072], "float32"], ["TENSOR", [768, 3072], "float32"], null, "float32"], {}], "config": {"index": 10167910, "code_hash": null, "entity": [["tile_x", "sp", [-1, 1, 2, 4]], ["tile_y", "sp", [-1, 1, 2, 3]], ["tile_k", "sp", [-1, 1, 32]]]}, "result": [[0.043807950549999995], 0, 3.7043473720550537, 1655820718.5426595], "version": 0.2, "tvm_version": "0.8.0"}
{"input": ["cuda -keys=cuda,gpu -max_num_threads=1024 -thread_warp_size=32", "dense_large_batch.gpu", [["TENSOR", [128, 3072], "float32"], ["TENSOR", [768, 3072], "float32"], null, "float32"], {}], "config": {"index": 3356710, "code_hash": null, "entity": [["tile_x", "sp", [-1, 1, 2, 4]], ["tile_y", "sp", [-1, 1, 2, 3]], ["tile_k", "sp", [-1, 1, 3]]]}, "result": [[0.006932388625], 0, 1.644932508468628, 1655820719.8090208], "version": 0.2, "tvm_version": "0.8.0"}
{"input": ["cuda -keys=cuda,gpu -max_num_threads=1024 -thread_warp_size=32", "dense_large_batch.gpu", [["TENSOR", [128, 3072], "float32"], ["TENSOR", [768, 3072], "float32"], null, "float32"], {}], "config": {"index": 11672710, "code_hash": null, "entity": [["tile_x", "sp", [-1, 1, 2, 4]], ["tile_y", "sp", [-1, 1, 2, 3]], ["tile_k", "sp", [-1, 1, 64]]]}, "result": [[0.0405225251], 0, 4.134714841842651, 1655820722.8469334], "version": 0.2, "tvm_version": "0.8.0"}
{"input": ["cuda -keys=cuda,gpu -max_num_threads=1024 -thread_warp_size=32", "dense_large_batch.gpu", [["TENSOR", [128, 3072], "float32"], ["TENSOR", [768, 3072], "float32"], null, "float32"], {}], "config": {"index": 6445510, "code_hash": null, "entity": [["tile_x", "sp", [-1, 1, 2, 4]], ["tile_y", "sp", [-1, 1, 2, 3]], ["tile_k", "sp", [-1, 1, 8]]]}, "result": [[0.0034205137083333334], 0, 1.4305107593536377, 1655820723.8626935], "version": 0.2, "tvm_version": "0.8.0"}
{"input": ["cuda -keys=cuda,gpu -max_num_threads=1024 -thread_warp_size=32", "dense_large_batch.gpu", [["TENSOR", [128, 3072], "float32"], ["TENSOR", [768, 3072], "float32"], null, "float32"], {}], "config": {"index": 12464710, "code_hash": null, "entity": [["tile_x", "sp", [-1, 1, 2, 4]], ["tile_y", "sp", [-1, 1, 2, 3]], ["tile_k", "sp", [-1, 1, 96]]]}, "result": [[0.03561608055], 0, 3.1861398220062256, 1655820726.626076], "version": 0.2, "tvm_version": "0.8.0"}
{"input": ["cuda -keys=cuda,gpu -max_num_threads=1024 -thread_warp_size=32", "dense_large_batch.gpu", [["TENSOR", [128, 3072], "float32"], ["TENSOR", [768, 3072], "float32"], null, "float32"], {}], "config": {"index": 8425510, "code_hash": null, "entity": [["tile_x", "sp", [-1, 1, 2, 4]], ["tile_y", "sp", [-1, 1, 2, 3]], ["tile_k", "sp", [-1, 1, 16]]]}, "result": [[0.0033676806874999997], 0, 1.479076862335205, 1655820727.668486], "version": 0.2, "tvm_version": "0.8.0"}
{"input": ["cuda -keys=cuda,gpu -max_num_threads=1024 -thread_warp_size=32", "dense_large_batch.gpu", [["TENSOR", [128, 3072], "float32"], ["TENSOR", [768, 3072], "float32"], null, "float32"], {}], "config": {"index": 7712710, "code_hash": null, "entity": [["tile_x", "sp", [-1, 1, 2, 4]], ["tile_y", "sp", [-1, 1, 2, 3]], ["tile_k", "sp", [-1, 1, 12]]]}, "result": [[0.00409744917948718], 0, 1.450282096862793, 1655820728.7224782], "version": 0.2, "tvm_version": "0.8.0"}
{"input": ["cuda -keys=cuda,gpu -max_num_threads=1024 -thread_warp_size=32", "dense_large_batch.gpu", [["TENSOR", [128, 3072], "float32"], ["TENSOR", [768, 3072], "float32"], null, "float32"], {}], "config": {"index": 11118310, "code_hash": null, "entity": [["tile_x", "sp", [-1, 1, 2, 4]], ["tile_y", "sp", [-1, 1, 2, 3]], ["tile_k", "sp", [-1, 1, 48]]]}, "result": [[0.041588286099999996], 0, 3.857778787612915, 1655820731.8015678], "version": 0.2, "tvm_version": "0.8.0"}
{"input": ["cuda -keys=cuda,gpu -max_num_threads=1024 -thread_warp_size=32", "dense_large_batch.gpu", [["TENSOR", [128, 3072], "float32"], ["TENSOR", [768, 3072], "float32"], null, "float32"], {}], "config": {"index": 13957364, "code_hash": null, "entity": [["tile_x", "sp", [-1, 2, 2, 2]], ["tile_y", "sp", [-1, 1, 2, 2]], ["tile_k", "sp", [-1, 1, 256]]]}, "result": [[0.0477640572], 0, 3.8152081966400146, 1655820741.8334005], "version": 0.2, "tvm_version": "0.8.0"}
{"input": ["cuda -keys=cuda,gpu -max_num_threads=1024 -thread_warp_size=32", "dense_large_batch.gpu", [["TENSOR", [128, 3072], "float32"], ["TENSOR", [768, 3072], "float32"], null, "float32"], {}], "config": {"index": 12939911, "code_hash": null, "entity": [["tile_x", "sp", [-1, 2, 2, 4]], ["tile_y", "sp", [-1, 1, 2, 3]], ["tile_k", "sp", [-1, 1, 128]]]}, "result": [[0.033916829849999997], 0, 3.098691701889038, 1655820744.5412633], "version": 0.2, "tvm_version": "0.8.0"}
{"input": ["cuda -keys=cuda,gpu -max_num_threads=1024 -thread_warp_size=32", "dense_large_batch.gpu", [["TENSOR", [128, 3072], "float32"], ["TENSOR", [768, 3072], "float32"], null, "float32"], {}], "config": {"index": 13561364, "code_hash": null, "entity": [["tile_x", "sp", [-1, 2, 2, 2]], ["tile_y", "sp", [-1, 1, 2, 2]], ["tile_k", "sp", [-1, 1, 192]]]}, "result": [[0.042795735950000004], 0, 3.5810506343841553, 1655820756.2445781], "version": 0.2, "tvm_version": "0.8.0"}
{"input": ["cuda -keys=cuda,gpu -max_num_threads=1024 -thread_warp_size=32", "dense_large_batch.gpu", [["TENSOR", [128, 3072], "float32"], ["TENSOR", [768, 3072], "float32"], null, "float32"], {}], "config": {"index": 30284, "code_hash": null, "entity": [["tile_x", "sp", [-1, 2, 2, 2]], ["tile_y", "sp", [-1, 1, 2, 3]], ["tile_k", "sp", [-1, 1, 1]]]}, "result": [[0.01494451135], 0, 1.560171365737915, 1655820757.6355002], "version": 0.2, "tvm_version": "0.8.0"}
{"input": ["cuda -keys=cuda,gpu -max_num_threads=1024 -thread_warp_size=32", "dense_large_batch.gpu", [["TENSOR", [128, 3072], "float32"], ["TENSOR", [768, 3072], "float32"], null, "float32"], {}], "config": {"index": 3356684, "code_hash": null, "entity": [["tile_x", "sp", [-1, 2, 2, 2]], ["tile_y", "sp", [-1, 1, 2, 3]], ["tile_k", "sp", [-1, 1, 3]]]}, "result": [[0.007117737875], 0, 1.5005254745483398, 1655820758.9179397], "version": 0.2, "tvm_version": "0.8.0"}
{"input": ["cuda -keys=cuda,gpu -max_num_threads=1024 -thread_warp_size=32", "dense_large_batch.gpu", [["TENSOR", [128, 3072], "float32"], ["TENSOR", [768, 3072], "float32"], null, "float32"], {}], "config": {"index": 4227884, "code_hash": null, "entity": [["tile_x", "sp", [-1, 2, 2, 2]], ["tile_y", "sp", [-1, 1, 2, 3]], ["tile_k", "sp", [-1, 1, 4]]]}, "result": [[0.00544961003125], 0, 1.3478546142578125, 1655820760.0025904], "version": 0.2, "tvm_version": "0.8.0"}
{"input": ["cuda -keys=cuda,gpu -max_num_threads=1024 -thread_warp_size=32", "dense_large_batch.gpu", [["TENSOR", [128, 3072], "float32"], ["TENSOR", [768, 3072], "float32"], null, "float32"], {}], "config": {"index": 5653484, "code_hash": null, "entity": [["tile_x", "sp", [-1, 2, 2, 2]], ["tile_y", "sp", [-1, 1, 2, 3]], ["tile_k", "sp", [-1, 1, 6]]]}, "result": [[0.0041266602820512815], 0, 1.2975990772247314, 1655820761.0200937], "version": 0.2, "tvm_version": "0.8.0"}
{"input": ["cuda -keys=cuda,gpu -max_num_threads=1024 -thread_warp_size=32", "dense_large_batch.gpu", [["TENSOR", [128, 3072], "float32"], ["TENSOR", [768, 3072], "float32"], null, "float32"], {}], "config": {"index": 9534284, "code_hash": null, "entity": [["tile_x", "sp", [-1, 2, 2, 2]], ["tile_y", "sp", [-1, 1, 2, 3]], ["tile_k", "sp", [-1, 1, 24]]]}, "result": [[0.002553132552238806], 0, 1.4573898315429688, 1655820762.0651467], "version": 0.2, "tvm_version": "0.8.0"}
{"input": ["cuda -keys=cuda,gpu -max_num_threads=1024 -thread_warp_size=32", "dense_large_batch.gpu", [["TENSOR", [128, 3072], "float32"], ["TENSOR", [768, 3072], "float32"], null, "float32"], {}], "config": {"index": 12464684, "code_hash": null, "entity": [["tile_x", "sp", [-1, 2, 2, 2]], ["tile_y", "sp", [-1, 1, 2, 3]], ["tile_k", "sp", [-1, 1, 96]]]}, "result": [[0.03425915035], 0, 3.037151336669922, 1655820764.7164829], "version": 0.2, "tvm_version": "0.8.0"}
{"input": ["cuda -keys=cuda,gpu -max_num_threads=1024 -thread_warp_size=32", "dense_large_batch.gpu", [["TENSOR", [128, 3072], "float32"], ["TENSOR", [768, 3072], "float32"], null, "float32"], {}], "config": {"index": 7712684, "code_hash": null, "entity": [["tile_x", "sp", [-1, 2, 2, 2]], ["tile_y", "sp", [-1, 1, 2, 3]], ["tile_k", "sp", [-1, 1, 12]]]}, "result": [[0.004082606102564103], 0, 1.317082166671753, 1655820765.750181], "version": 0.2, "tvm_version": "0.8.0"}
{"input": ["cuda -keys=cuda,gpu -max_num_threads=1024 -thread_warp_size=32", "dense_large_batch.gpu", [["TENSOR", [128, 3072], "float32"], ["TENSOR", [768, 3072], "float32"], null, "float32"], {}], "config": {"index": 6445484, "code_hash": null, "entity": [["tile_x", "sp", [-1, 2, 2, 2]], ["tile_y", "sp", [-1, 1, 2, 3]], ["tile_k", "sp", [-1, 1, 8]]]}, "result": [[0.0032195754901960783], 0, 1.281554937362671, 1655820766.771917], "version": 0.2, "tvm_version": "0.8.0"}
{"input": ["cuda -keys=cuda,gpu -max_num_threads=1024 -thread_warp_size=32", "dense_large_batch.gpu", [["TENSOR", [128, 3072], "float32"], ["TENSOR", [768, 3072], "float32"], null, "float32"], {}], "config": {"index": 1772684, "code_hash": null, "entity": [["tile_x", "sp", [-1, 2, 2, 2]], ["tile_y", "sp", [-1, 1, 2, 3]], ["tile_k", "sp", [-1, 1, 2]]]}, "result": [[0.008531209500000001], 0, 1.20524001121521, 1655820767.747343], "version": 0.2, "tvm_version": "0.8.0"}
{"input": ["cuda -keys=cuda,gpu -max_num_threads=1024 -thread_warp_size=32", "dense_large_batch.gpu", [["TENSOR", [128, 3072], "float32"], ["TENSOR", [768, 3072], "float32"], null, "float32"], {}], "config": {"index": 8425484, "code_hash": null, "entity": [["tile_x", "sp", [-1, 2, 2, 2]], ["tile_y", "sp", [-1, 1, 2, 3]], ["tile_k", "sp", [-1, 1, 16]]]}, "result": [[0.003361823734693878], 0, 1.3540008068084717, 1655820768.7789116], "version": 0.2, "tvm_version": "0.8.0"}
{"input": ["cuda -keys=cuda,gpu -max_num_threads=1024 -thread_warp_size=32", "dense_large_batch.gpu", [["TENSOR", [128, 3072], "float32"], ["TENSOR", [768, 3072], "float32"], null, "float32"], {}], "config": {"index": 10167884, "code_hash": null, "entity": [["tile_x", "sp", [-1, 2, 2, 2]], ["tile_y", "sp", [-1, 1, 2, 3]], ["tile_k", "sp", [-1, 1, 32]]]}, "result": [[0.04049954735], 0, 3.5083401203155518, 1655820771.803302], "version": 0.2, "tvm_version": "0.8.0"}
{"input": ["cuda -keys=cuda,gpu -max_num_threads=1024 -thread_warp_size=32", "dense_large_batch.gpu", [["TENSOR", [128, 3072], "float32"], ["TENSOR", [768, 3072], "float32"], null, "float32"], {}], "config": {"index": 11672684, "code_hash": null, "entity": [["tile_x", "sp", [-1, 2, 2, 2]], ["tile_y", "sp", [-1, 1, 2, 3]], ["tile_k", "sp", [-1, 1, 64]]]}, "result": [[0.03843678375], 0, 3.6986591815948486, 1655820774.7279947], "version": 0.2, "tvm_version": "0.8.0"}
{"input": ["cuda -keys=cuda,gpu -max_num_threads=1024 -thread_warp_size=32", "dense_large_batch.gpu", [["TENSOR", [128, 3072], "float32"], ["TENSOR", [768, 3072], "float32"], null, "float32"], {}], "config": {"index": 11118284, "code_hash": null, "entity": [["tile_x", "sp", [-1, 2, 2, 2]], ["tile_y", "sp", [-1, 1, 2, 3]], ["tile_k", "sp", [-1, 1, 48]]]}, "result": [[0.0368625084], 0, 3.551156520843506, 1655820777.5236316], "version": 0.2, "tvm_version": "0.8.0"}
{"input": ["cuda -keys=cuda,gpu -max_num_threads=1024 -thread_warp_size=32", "dense_large_batch.gpu", [["TENSOR", [128, 3072], "float32"], ["TENSOR", [768, 3072], "float32"], null, "float32"], {}], "config": {"index": 9534283, "code_hash": null, "entity": [["tile_x", "sp", [-1, 1, 2, 2]], ["tile_y", "sp", [-1, 1, 2, 3]], ["tile_k", "sp", [-1, 1, 24]]]}, "result": [[0.0032555398448275864], 0, 1.6628952026367188, 1655820819.1630611], "version": 0.2, "tvm_version": "0.8.0"}
{"input": ["cuda -keys=cuda,gpu -max_num_threads=1024 -thread_warp_size=32", "dense_large_batch.gpu", [["TENSOR", [128, 3072], "float32"], ["TENSOR", [768, 3072], "float32"], null, "float32"], {}], "config": {"index": 8425511, "code_hash": null, "entity": [["tile_x", "sp", [-1, 2, 2, 4]], ["tile_y", "sp", [-1, 1, 2, 3]], ["tile_k", "sp", [-1, 1, 16]]]}, "result": [[0.0372184679], 0, 3.2957210540771484, 1655820821.978087], "version": 0.2, "tvm_version": "0.8.0"}
{"input": ["cuda -keys=cuda,gpu -max_num_threads=1024 -thread_warp_size=32", "dense_large_batch.gpu", [["TENSOR", [128, 3072], "float32"], ["TENSOR", [768, 3072], "float32"], null, "float32"], {}], "config": {"index": 7712711, "code_hash": null, "entity": [["tile_x", "sp", [-1, 2, 2, 4]], ["tile_y", "sp", [-1, 1, 2, 3]], ["tile_k", "sp", [-1, 1, 12]]]}, "result": [[0.003799982595238095], 0, 1.4055542945861816, 1655820823.0314724], "version": 0.2, "tvm_version": "0.8.0"}
{"input": ["cuda -keys=cuda,gpu -max_num_threads=1024 -thread_warp_size=32", "dense_large_batch.gpu", [["TENSOR", [128, 3072], "float32"], ["TENSOR", [768, 3072], "float32"], null, "float32"], {}], "config": {"index": 6445511, "code_hash": null, "entity": [["tile_x", "sp", [-1, 2, 2, 4]], ["tile_y", "sp", [-1, 1, 2, 3]], ["tile_k", "sp", [-1, 1, 8]]]}, "result": [[0.00286391175], 0, 1.4003095626831055, 1655820824.0633907], "version": 0.2, "tvm_version": "0.8.0"}
{"input": ["cuda -keys=cuda,gpu -max_num_threads=1024 -thread_warp_size=32", "dense_large_batch.gpu", [["TENSOR", [128, 3072], "float32"], ["TENSOR", [768, 3072], "float32"], null, "float32"], {}], "config": {"index": 9534311, "code_hash": null, "entity": [["tile_x", "sp", [-1, 2, 2, 4]], ["tile_y", "sp", [-1, 1, 2, 3]], ["tile_k", "sp", [-1, 1, 24]]]}, "result": [[0.03333920705], 0, 3.144369602203369, 1655820826.6400568], "version": 0.2, "tvm_version": "0.8.0"}
{"input": ["cuda -keys=cuda,gpu -max_num_threads=1024 -thread_warp_size=32", "dense_large_batch.gpu", [["TENSOR", [128, 3072], "float32"], ["TENSOR", [768, 3072], "float32"], null, "float32"], {}], "config": {"index": 5653511, "code_hash": null, "entity": [["tile_x", "sp", [-1, 2, 2, 4]], ["tile_y", "sp", [-1, 1, 2, 3]], ["tile_k", "sp", [-1, 1, 6]]]}, "result": [[0.00322878204], 0, 1.3859760761260986, 1655820827.6806707], "version": 0.2, "tvm_version": "0.8.0"}
{"input": ["cuda -keys=cuda,gpu -max_num_threads=1024 -thread_warp_size=32", "dense_large_batch.gpu", [["TENSOR", [128, 3072], "float32"], ["TENSOR", [768, 3072], "float32"], null, "float32"], {}], "config": {"index": 1772710, "code_hash": null, "entity": [["tile_x", "sp", [-1, 1, 2, 4]], ["tile_y", "sp", [-1, 1, 2, 3]], ["tile_k", "sp", [-1, 1, 2]]]}, "result": [[0.0081139509], 0, 1.1625995635986328, 1655820828.6296523], "version": 0.2, "tvm_version": "0.8.0"}
{"input": ["cuda -keys=cuda,gpu -max_num_threads=1024 -thread_warp_size=32", "dense_large_batch.gpu", [["TENSOR", [128, 3072], "float32"], ["TENSOR", [768, 3072], "float32"], null, "float32"], {}], "config": {"index": 8413364, "code_hash": null, "entity": [["tile_x", "sp", [-1, 2, 2, 2]], ["tile_y", "sp", [-1, 1, 2, 2]], ["tile_k", "sp", [-1, 1, 16]]]}, "result": [[0.0044976999999999994], 0, 1.436314344406128, 1655820829.6819215], "version": 0.2, "tvm_version": "0.8.0"}
{"input": ["cuda -keys=cuda,gpu -max_num_threads=1024 -thread_warp_size=32", "dense_large_batch.gpu", [["TENSOR", [128, 3072], "float32"], ["TENSOR", [768, 3072], "float32"], null, "float32"], {}], "config": {"index": 7700564, "code_hash": null, "entity": [["tile_x", "sp", [-1, 2, 2, 2]], ["tile_y", "sp", [-1, 1, 2, 2]], ["tile_k", "sp", [-1, 1, 12]]]}, "result": [[0.0047317110303030305], 0, 1.4173662662506104, 1655820830.7446046], "version": 0.2, "tvm_version": "0.8.0"}
{"input": ["cuda -keys=cuda,gpu -max_num_threads=1024 -thread_warp_size=32", "dense_large_batch.gpu", [["TENSOR", [128, 3072], "float32"], ["TENSOR", [768, 3072], "float32"], null, "float32"], {}], "config": {"index": 6433364, "code_hash": null, "entity": [["tile_x", "sp", [-1, 2, 2, 2]], ["tile_y", "sp", [-1, 1, 2, 2]], ["tile_k", "sp", [-1, 1, 8]]]}, "result": [[0.004302617999999999], 0, 1.3520808219909668, 1655820831.8156376], "version": 0.2, "tvm_version": "0.8.0"}
{"input": ["cuda -keys=cuda,gpu -max_num_threads=1024 -thread_warp_size=32", "dense_large_batch.gpu", [["TENSOR", [128, 3072], "float32"], ["TENSOR", [768, 3072], "float32"], null, "float32"], {}], "config": {"index": 30311, "code_hash": null, "entity": [["tile_x", "sp", [-1, 2, 2, 4]], ["tile_y", "sp", [-1, 1, 2, 3]], ["tile_k", "sp", [-1, 1, 1]]]}, "result": [[0.011805515649999999], 0, 1.4717590808868408, 1655820833.0105681], "version": 0.2, "tvm_version": "0.8.0"}
{"input": ["cuda -keys=cuda,gpu -max_num_threads=1024 -thread_warp_size=32", "dense_large_batch.gpu", [["TENSOR", [128, 3072], "float32"], ["TENSOR", [768, 3072], "float32"], null, "float32"], {}], "config": {"index": 1772711, "code_hash": null, "entity": [["tile_x", "sp", [-1, 2, 2, 4]], ["tile_y", "sp", [-1, 1, 2, 3]], ["tile_k", "sp", [-1, 1, 2]]]}, "result": [[0.00681213275], 0, 1.6069347858428955, 1655820834.3114965], "version": 0.2, "tvm_version": "0.8.0"}
{"input": ["cuda -keys=cuda,gpu -max_num_threads=1024 -thread_warp_size=32", "dense_large_batch.gpu", [["TENSOR", [128, 3072], "float32"], ["TENSOR", [768, 3072], "float32"], null, "float32"], {}], "config": {"index": 4227911, "code_hash": null, "entity": [["tile_x", "sp", [-1, 2, 2, 4]], ["tile_y", "sp", [-1, 1, 2, 3]], ["tile_k", "sp", [-1, 1, 4]]]}, "result": [[0.005095182656250001], 0, 1.3660204410552979, 1655820835.38181], "version": 0.2, "tvm_version": "0.8.0"}
{"input": ["cuda -keys=cuda,gpu -max_num_threads=1024 -thread_warp_size=32", "dense_large_batch.gpu", [["TENSOR", [128, 3072], "float32"], ["TENSOR", [768, 3072], "float32"], null, "float32"], {}], "config": {"index": 3356711, "code_hash": null, "entity": [["tile_x", "sp", [-1, 2, 2, 4]], ["tile_y", "sp", [-1, 1, 2, 3]], ["tile_k", "sp", [-1, 1, 3]]]}, "result": [[0.00532028190625], 0, 1.3365368843078613, 1655820836.487724], "version": 0.2, "tvm_version": "0.8.0"}
{"input": ["cuda -keys=cuda,gpu -max_num_threads=1024 -thread_warp_size=32", "dense_large_batch.gpu", [["TENSOR", [128, 3072], "float32"], ["TENSOR", [768, 3072], "float32"], null, "float32"], {}], "config": {"index": 8413363, "code_hash": null, "entity": [["tile_x", "sp", [-1, 1, 2, 2]], ["tile_y", "sp", [-1, 1, 2, 2]], ["tile_k", "sp", [-1, 1, 16]]]}, "result": [[0.006492633875], 0, 1.5793437957763672, 1655820837.6956165], "version": 0.2, "tvm_version": "0.8.0"}
{"input": ["cuda -keys=cuda,gpu -max_num_threads=1024 -thread_warp_size=32", "dense_large_batch.gpu", [["TENSOR", [128, 3072], "float32"], ["TENSOR", [768, 3072], "float32"], null, "float32"], {}], "config": {"index": 10167911, "code_hash": null, "entity": [["tile_x", "sp", [-1, 2, 2, 4]], ["tile_y", "sp", [-1, 1, 2, 3]], ["tile_k", "sp", [-1, 1, 32]]]}, "result": [[0.0334687814], 0, 3.4361255168914795, 1655820840.3037868], "version": 0.2, "tvm_version": "0.8.0"}
{"input": ["cuda -keys=cuda,gpu -max_num_threads=1024 -thread_warp_size=32", "dense_large_batch.gpu", [["TENSOR", [128, 3072], "float32"], ["TENSOR", [768, 3072], "float32"], null, "float32"], {}], "config": {"index": 12464711, "code_hash": null, "entity": [["tile_x", "sp", [-1, 2, 2, 4]], ["tile_y", "sp", [-1, 1, 2, 3]], ["tile_k", "sp", [-1, 1, 96]]]}, "result": [[0.03096948995], 0, 3.0404579639434814, 1655820842.7833383], "version": 0.2, "tvm_version": "0.8.0"}
{"input": ["cuda -keys=cuda,gpu -max_num_threads=1024 -thread_warp_size=32", "dense_large_batch.gpu", [["TENSOR", [128, 3072], "float32"], ["TENSOR", [768, 3072], "float32"], null, "float32"], {}], "config": {"index": 8413390, "code_hash": null, "entity": [["tile_x", "sp", [-1, 1, 2, 4]], ["tile_y", "sp", [-1, 1, 2, 2]], ["tile_k", "sp", [-1, 1, 16]]]}, "result": [[0.004507567971428571], 0, 1.410902976989746, 1655820843.8276126], "version": 0.2, "tvm_version": "0.8.0"}
{"input": ["cuda -keys=cuda,gpu -max_num_threads=1024 -thread_warp_size=32", "dense_large_batch.gpu", [["TENSOR", [128, 3072], "float32"], ["TENSOR", [768, 3072], "float32"], null, "float32"], {}], "config": {"index": 9522164, "code_hash": null, "entity": [["tile_x", "sp", [-1, 2, 2, 2]], ["tile_y", "sp", [-1, 1, 2, 2]], ["tile_k", "sp", [-1, 1, 24]]]}, "result": [[0.0031306067500000002], 0, 1.423659086227417, 1655820844.8676322], "version": 0.2, "tvm_version": "0.8.0"}
{"input": ["cuda -keys=cuda,gpu -max_num_threads=1024 -thread_warp_size=32", "dense_large_batch.gpu", [["TENSOR", [128, 3072], "float32"], ["TENSOR", [768, 3072], "float32"], null, "float32"], {}], "config": {"index": 5641364, "code_hash": null, "entity": [["tile_x", "sp", [-1, 2, 2, 2]], ["tile_y", "sp", [-1, 1, 2, 2]], ["tile_k", "sp", [-1, 1, 6]]]}, "result": [[0.00490649921875], 0, 1.3673381805419922, 1655820845.93304], "version": 0.2, "tvm_version": "0.8.0"}
{"input": ["cuda -keys=cuda,gpu -max_num_threads=1024 -thread_warp_size=32", "dense_large_batch.gpu", [["TENSOR", [128, 3072], "float32"], ["TENSOR", [768, 3072], "float32"], null, "float32"], {}], "config": {"index": 7700563, "code_hash": null, "entity": [["tile_x", "sp", [-1, 1, 2, 2]], ["tile_y", "sp", [-1, 1, 2, 2]], ["tile_k", "sp", [-1, 1, 12]]]}, "result": [[0.006209152125], 0, 1.4808461666107178, 1655820847.1124773], "version": 0.2, "tvm_version": "0.8.0"}
{"input": ["cuda -keys=cuda,gpu -max_num_threads=1024 -thread_warp_size=32", "dense_large_batch.gpu", [["TENSOR", [128, 3072], "float32"], ["TENSOR", [768, 3072], "float32"], null, "float32"], {}], "config": {"index": 7712685, "code_hash": null, "entity": [["tile_x", "sp", [-1, 4, 2, 2]], ["tile_y", "sp", [-1, 1, 2, 3]], ["tile_k", "sp", [-1, 1, 12]]]}, "result": [[0.0038080877073170733], 0, 1.4470446109771729, 1655820848.1569505], "version": 0.2, "tvm_version": "0.8.0"}
{"input": ["cuda -keys=cuda,gpu -max_num_threads=1024 -thread_warp_size=32", "dense_large_batch.gpu", [["TENSOR", [128, 3072], "float32"], ["TENSOR", [768, 3072], "float32"], null, "float32"], {}], "config": {"index": 8425485, "code_hash": null, "entity": [["tile_x", "sp", [-1, 4, 2, 2]], ["tile_y", "sp", [-1, 1, 2, 3]], ["tile_k", "sp", [-1, 1, 16]]]}, "result": [[0.0371096397], 0, 3.3025906085968018, 1655820850.94403], "version": 0.2, "tvm_version": "0.8.0"}
{"input": ["cuda -keys=cuda,gpu -max_num_threads=1024 -thread_warp_size=32", "dense_large_batch.gpu", [["TENSOR", [128, 3072], "float32"], ["TENSOR", [768, 3072], "float32"], null, "float32"], {}], "config": {"index": 6433363, "code_hash": null, "entity": [["tile_x", "sp", [-1, 1, 2, 2]], ["tile_y", "sp", [-1, 1, 2, 2]], ["tile_k", "sp", [-1, 1, 8]]]}, "result": [[0.00504171640625], 0, 1.3262763023376465, 1655820851.976784], "version": 0.2, "tvm_version": "0.8.0"}
{"input": ["cuda -keys=cuda,gpu -max_num_threads=1024 -thread_warp_size=32", "dense_large_batch.gpu", [["TENSOR", [128, 3072], "float32"], ["TENSOR", [768, 3072], "float32"], null, "float32"], {}], "config": {"index": 6445485, "code_hash": null, "entity": [["tile_x", "sp", [-1, 4, 2, 2]], ["tile_y", "sp", [-1, 1, 2, 3]], ["tile_k", "sp", [-1, 1, 8]]]}, "result": [[0.002726887433333333], 0, 1.314769983291626, 1655820853.0310504], "version": 0.2, "tvm_version": "0.8.0"}
{"input": ["cuda -keys=cuda,gpu -max_num_threads=1024 -thread_warp_size=32", "dense_large_batch.gpu", [["TENSOR", [128, 3072], "float32"], ["TENSOR", [768, 3072], "float32"], null, "float32"], {}], "config": {"index": 7700590, "code_hash": null, "entity": [["tile_x", "sp", [-1, 1, 2, 4]], ["tile_y", "sp", [-1, 1, 2, 2]], ["tile_k", "sp", [-1, 1, 12]]]}, "result": [[0.0047810632121212115], 0, 1.3036456108093262, 1655820854.1022508], "version": 0.2, "tvm_version": "0.8.0"}
{"input": ["cuda -keys=cuda,gpu -max_num_threads=1024 -thread_warp_size=32", "dense_large_batch.gpu", [["TENSOR", [128, 3072], "float32"], ["TENSOR", [768, 3072], "float32"], null, "float32"], {}], "config": {"index": 6433390, "code_hash": null, "entity": [["tile_x", "sp", [-1, 1, 2, 4]], ["tile_y", "sp", [-1, 1, 2, 2]], ["tile_k", "sp", [-1, 1, 8]]]}, "result": [[0.004591968735294117], 0, 1.3412957191467285, 1655820855.151873], "version": 0.2, "tvm_version": "0.8.0"}
{"input": ["cuda -keys=cuda,gpu -max_num_threads=1024 -thread_warp_size=32", "dense_large_batch.gpu", [["TENSOR", [128, 3072], "float32"], ["TENSOR", [768, 3072], "float32"], null, "float32"], {}], "config": {"index": 9522163, "code_hash": null, "entity": [["tile_x", "sp", [-1, 1, 2, 2]], ["tile_y", "sp", [-1, 1, 2, 2]], ["tile_k", "sp", [-1, 1, 24]]]}, "result": [[0.003907413902439025], 0, 1.3703680038452148, 1655820856.188476], "version": 0.2, "tvm_version": "0.8.0"}
{"input": ["cuda -keys=cuda,gpu -max_num_threads=1024 -thread_warp_size=32", "dense_large_batch.gpu", [["TENSOR", [128, 3072], "float32"], ["TENSOR", [768, 3072], "float32"], null, "float32"], {}], "config": {"index": 9522190, "code_hash": null, "entity": [["tile_x", "sp", [-1, 1, 2, 4]], ["tile_y", "sp", [-1, 1, 2, 2]], ["tile_k", "sp", [-1, 1, 24]]]}, "result": [[0.0034274383404255325], 0, 1.380185842514038, 1655820857.2345183], "version": 0.2, "tvm_version": "0.8.0"}
{"input": ["cuda -keys=cuda,gpu -max_num_threads=1024 -thread_warp_size=32", "dense_large_batch.gpu", [["TENSOR", [128, 3072], "float32"], ["TENSOR", [768, 3072], "float32"], null, "float32"], {}], "config": {"index": 8425449, "code_hash": null, "entity": [["tile_x", "sp", [-1, 2, 2, 1]], ["tile_y", "sp", [-1, 1, 2, 3]], ["tile_k", "sp", [-1, 1, 16]]]}, "result": [[0.004002613225000001], 0, 1.387237310409546, 1655820858.2788177], "version": 0.2, "tvm_version": "0.8.0"}
{"input": ["cuda -keys=cuda,gpu -max_num_threads=1024 -thread_warp_size=32", "dense_large_batch.gpu", [["TENSOR", [128, 3072], "float32"], ["TENSOR", [768, 3072], "float32"], null, "float32"], {}], "config": {"index": 5641363, "code_hash": null, "entity": [["tile_x", "sp", [-1, 1, 2, 2]], ["tile_y", "sp", [-1, 1, 2, 2]], ["tile_k", "sp", [-1, 1, 6]]]}, "result": [[0.0065521879375000005], 0, 1.608808994293213, 1655820859.5380867], "version": 0.2, "tvm_version": "0.8.0"}
{"input": ["cuda -keys=cuda,gpu -max_num_threads=1024 -thread_warp_size=32", "dense_large_batch.gpu", [["TENSOR", [128, 3072], "float32"], ["TENSOR", [768, 3072], "float32"], null, "float32"], {}], "config": {"index": 5653485, "code_hash": null, "entity": [["tile_x", "sp", [-1, 4, 2, 2]], ["tile_y", "sp", [-1, 1, 2, 3]], ["tile_k", "sp", [-1, 1, 6]]]}, "result": [[0.00321793918], 0, 1.3837275505065918, 1655820860.5709918], "version": 0.2, "tvm_version": "0.8.0"}
{"input": ["cuda -keys=cuda,gpu -max_num_threads=1024 -thread_warp_size=32", "dense_large_batch.gpu", [["TENSOR", [128, 3072], "float32"], ["TENSOR", [768, 3072], "float32"], null, "float32"], {}], "config": {"index": 8413391, "code_hash": null, "entity": [["tile_x", "sp", [-1, 2, 2, 4]], ["tile_y", "sp", [-1, 1, 2, 2]], ["tile_k", "sp", [-1, 1, 16]]]}, "result": [[0.0039741164], 0, 1.4714570045471191, 1655820861.6445842], "version": 0.2, "tvm_version": "0.8.0"}
{"input": ["cuda -keys=cuda,gpu -max_num_threads=1024 -thread_warp_size=32", "dense_large_batch.gpu", [["TENSOR", [128, 3072], "float32"], ["TENSOR", [768, 3072], "float32"], null, "float32"], {}], "config": {"index": 5641390, "code_hash": null, "entity": [["tile_x", "sp", [-1, 1, 2, 4]], ["tile_y", "sp", [-1, 1, 2, 2]], ["tile_k", "sp", [-1, 1, 6]]]}, "result": [[0.00493581878125], 0, 1.345362663269043, 1655820862.6720374], "version": 0.2, "tvm_version": "0.8.0"}
{"input": ["cuda -keys=cuda,gpu -max_num_threads=1024 -thread_warp_size=32", "dense_large_batch.gpu", [["TENSOR", [128, 3072], "float32"], ["TENSOR", [768, 3072], "float32"], null, "float32"], {}], "config": {"index": 9534285, "code_hash": null, "entity": [["tile_x", "sp", [-1, 4, 2, 2]], ["tile_y", "sp", [-1, 1, 2, 3]], ["tile_k", "sp", [-1, 1, 24]]]}, "result": [[0.033150277], 0, 3.2066056728363037, 1655820865.2522173], "version": 0.2, "tvm_version": "0.8.0"}
{"input": ["cuda -keys=cuda,gpu -max_num_threads=1024 -thread_warp_size=32", "dense_large_batch.gpu", [["TENSOR", [128, 3072], "float32"], ["TENSOR", [768, 3072], "float32"], null, "float32"], {}], "config": {"index": 7712649, "code_hash": null, "entity": [["tile_x", "sp", [-1, 2, 2, 1]], ["tile_y", "sp", [-1, 1, 2, 3]], ["tile_k", "sp", [-1, 1, 12]]]}, "result": [[0.005544847375], 0, 1.4616708755493164, 1655820866.3765426], "version": 0.2, "tvm_version": "0.8.0"}
{"input": ["cuda -keys=cuda,gpu -max_num_threads=1024 -thread_warp_size=32", "dense_large_batch.gpu", [["TENSOR", [128, 3072], "float32"], ["TENSOR", [768, 3072], "float32"], null, "float32"], {}], "config": {"index": 18164, "code_hash": null, "entity": [["tile_x", "sp", [-1, 2, 2, 2]], ["tile_y", "sp", [-1, 1, 2, 2]], ["tile_k", "sp", [-1, 1, 1]]]}, "result": [[0.01863022525], 0, 1.8805475234985352, 1655820867.9899015], "version": 0.2, "tvm_version": "0.8.0"}
{"input": ["cuda -keys=cuda,gpu -max_num_threads=1024 -thread_warp_size=32", "dense_large_batch.gpu", [["TENSOR", [128, 3072], "float32"], ["TENSOR", [768, 3072], "float32"], null, "float32"], {}], "config": {"index": 1760564, "code_hash": null, "entity": [["tile_x", "sp", [-1, 2, 2, 2]], ["tile_y", "sp", [-1, 1, 2, 2]], ["tile_k", "sp", [-1, 1, 2]]]}, "result": [[0.01055301505], 0, 1.457916498184204, 1655820869.1013038], "version": 0.2, "tvm_version": "0.8.0"}
{"input": ["cuda -keys=cuda,gpu -max_num_threads=1024 -thread_warp_size=32", "dense_large_batch.gpu", [["TENSOR", [128, 3072], "float32"], ["TENSOR", [768, 3072], "float32"], null, "float32"], {}], "config": {"index": 6445449, "code_hash": null, "entity": [["tile_x", "sp", [-1, 2, 2, 1]], ["tile_y", "sp", [-1, 1, 2, 3]], ["tile_k", "sp", [-1, 1, 8]]]}, "result": [[0.003728307279069768], 0, 1.3579745292663574, 1655820870.1506305], "version": 0.2, "tvm_version": "0.8.0"}
{"input": ["cuda -keys=cuda,gpu -max_num_threads=1024 -thread_warp_size=32", "dense_large_batch.gpu", [["TENSOR", [128, 3072], "float32"], ["TENSOR", [768, 3072], "float32"], null, "float32"], {}], "config": {"index": 7700591, "code_hash": null, "entity": [["tile_x", "sp", [-1, 2, 2, 4]], ["tile_y", "sp", [-1, 1, 2, 2]], ["tile_k", "sp", [-1, 1, 12]]]}, "result": [[0.00486956040625], 0, 1.4128119945526123, 1655820871.1964276], "version": 0.2, "tvm_version": "0.8.0"}
{"input": ["cuda -keys=cuda,gpu -max_num_threads=1024 -thread_warp_size=32", "dense_large_batch.gpu", [["TENSOR", [128, 3072], "float32"], ["TENSOR", [768, 3072], "float32"], null, "float32"], {}], "config": {"index": 5653449, "code_hash": null, "entity": [["tile_x", "sp", [-1, 2, 2, 1]], ["tile_y", "sp", [-1, 1, 2, 3]], ["tile_k", "sp", [-1, 1, 6]]]}, "result": [[0.00579897796875], 0, 1.589460849761963, 1655820909.9749453], "version": 0.2, "tvm_version": "0.8.0"}
{"input": ["cuda -keys=cuda,gpu -max_num_threads=1024 -thread_warp_size=32", "dense_large_batch.gpu", [["TENSOR", [128, 3072], "float32"], ["TENSOR", [768, 3072], "float32"], null, "float32"], {}], "config": {"index": 4215763, "code_hash": null, "entity": [["tile_x", "sp", [-1, 1, 2, 2]], ["tile_y", "sp", [-1, 1, 2, 2]], ["tile_k", "sp", [-1, 1, 4]]]}, "result": [[0.00873516485], 0, 1.2474842071533203, 1655820910.9609113], "version": 0.2, "tvm_version": "0.8.0"}
{"input": ["cuda -keys=cuda,gpu -max_num_threads=1024 -thread_warp_size=32", "dense_large_batch.gpu", [["TENSOR", [128, 3072], "float32"], ["TENSOR", [768, 3072], "float32"], null, "float32"], {}], "config": {"index": 6433329, "code_hash": null, "entity": [["tile_x", "sp", [-1, 2, 2, 1]], ["tile_y", "sp", [-1, 1, 2, 2]], ["tile_k", "sp", [-1, 1, 8]]]}, "result": [[0.0048912160625], 0, 1.2955021858215332, 1655820912.0177383], "version": 0.2, "tvm_version": "0.8.0"}
{"input": ["cuda -keys=cuda,gpu -max_num_threads=1024 -thread_warp_size=32", "dense_large_batch.gpu", [["TENSOR", [128, 3072], "float32"], ["TENSOR", [768, 3072], "float32"], null, "float32"], {}], "config": {"index": 6433328, "code_hash": null, "entity": [["tile_x", "sp", [-1, 1, 2, 1]], ["tile_y", "sp", [-1, 1, 2, 2]], ["tile_k", "sp", [-1, 1, 8]]]}, "result": [[0.0073439660624999995], 0, 1.5614237785339355, 1655820913.3230321], "version": 0.2, "tvm_version": "0.8.0"}
{"input": ["cuda -keys=cuda,gpu -max_num_threads=1024 -thread_warp_size=32", "dense_large_batch.gpu", [["TENSOR", [128, 3072], "float32"], ["TENSOR", [768, 3072], "float32"], null, "float32"], {}], "config": {"index": 4227849, "code_hash": null, "entity": [["tile_x", "sp", [-1, 2, 2, 1]], ["tile_y", "sp", [-1, 1, 2, 3]], ["tile_k", "sp", [-1, 1, 4]]]}, "result": [[0.007287730468750001], 0, 1.6198627948760986, 1655820914.669678], "version": 0.2, "tvm_version": "0.8.0"}
{"input": ["cuda -keys=cuda,gpu -max_num_threads=1024 -thread_warp_size=32", "dense_large_batch.gpu", [["TENSOR", [128, 3072], "float32"], ["TENSOR", [768, 3072], "float32"], null, "float32"], {}], "config": {"index": 4215764, "code_hash": null, "entity": [["tile_x", "sp", [-1, 2, 2, 2]], ["tile_y", "sp", [-1, 1, 2, 2]], ["tile_k", "sp", [-1, 1, 4]]]}, "result": [[0.00656413728125], 0, 1.55110764503479, 1655820915.904743], "version": 0.2, "tvm_version": "0.8.0"}
{"input": ["cuda -keys=cuda,gpu -max_num_threads=1024 -thread_warp_size=32", "dense_large_batch.gpu", [["TENSOR", [128, 3072], "float32"], ["TENSOR", [768, 3072], "float32"], null, "float32"], {}], "config": {"index": 3356649, "code_hash": null, "entity": [["tile_x", "sp", [-1, 2, 2, 1]], ["tile_y", "sp", [-1, 1, 2, 3]], ["tile_k", "sp", [-1, 1, 3]]]}, "result": [[0.01006671755], 0, 1.373098373413086, 1655820917.0149748], "version": 0.2, "tvm_version": "0.8.0"}
{"input": ["cuda -keys=cuda,gpu -max_num_threads=1024 -thread_warp_size=32", "dense_large_batch.gpu", [["TENSOR", [128, 3072], "float32"], ["TENSOR", [768, 3072], "float32"], null, "float32"], {}], "config": {"index": 6433365, "code_hash": null, "entity": [["tile_x", "sp", [-1, 4, 2, 2]], ["tile_y", "sp", [-1, 1, 2, 2]], ["tile_k", "sp", [-1, 1, 8]]]}, "result": [[0.0035273024000000005], 0, 1.458533525466919, 1655820918.0423067], "version": 0.2, "tvm_version": "0.8.0"}
{"input": ["cuda -keys=cuda,gpu -max_num_threads=1024 -thread_warp_size=32", "dense_large_batch.gpu", [["TENSOR", [128, 3072], "float32"], ["TENSOR", [768, 3072], "float32"], null, "float32"], {}], "config": {"index": 4227885, "code_hash": null, "entity": [["tile_x", "sp", [-1, 4, 2, 2]], ["tile_y", "sp", [-1, 1, 2, 3]], ["tile_k", "sp", [-1, 1, 4]]]}, "result": [[0.0050079743125], 0, 1.341447353363037, 1655820919.1344502], "version": 0.2, "tvm_version": "0.8.0"}
{"input": ["cuda -keys=cuda,gpu -max_num_threads=1024 -thread_warp_size=32", "dense_large_batch.gpu", [["TENSOR", [128, 3072], "float32"], ["TENSOR", [768, 3072], "float32"], null, "float32"], {}], "config": {"index": 6433391, "code_hash": null, "entity": [["tile_x", "sp", [-1, 2, 2, 4]], ["tile_y", "sp", [-1, 1, 2, 2]], ["tile_k", "sp", [-1, 1, 8]]]}, "result": [[0.0037792707317073166], 0, 1.246072769165039, 1655820920.1414402], "version": 0.2, "tvm_version": "0.8.0"}
{"input": ["cuda -keys=cuda,gpu -max_num_threads=1024 -thread_warp_size=32", "dense_large_batch.gpu", [["TENSOR", [128, 3072], "float32"], ["TENSOR", [768, 3072], "float32"], null, "float32"], {}], "config": {"index": 7700529, "code_hash": null, "entity": [["tile_x", "sp", [-1, 2, 2, 1]], ["tile_y", "sp", [-1, 1, 2, 2]], ["tile_k", "sp", [-1, 1, 12]]]}, "result": [[0.006093202749999999], 0, 1.4708747863769531, 1655820921.3359544], "version": 0.2, "tvm_version": "0.8.0"}
{"input": ["cuda -keys=cuda,gpu -max_num_threads=1024 -thread_warp_size=32", "dense_large_batch.gpu", [["TENSOR", [128, 3072], "float32"], ["TENSOR", [768, 3072], "float32"], null, "float32"], {}], "config": {"index": 7700528, "code_hash": null, "entity": [["tile_x", "sp", [-1, 1, 2, 1]], ["tile_y", "sp", [-1, 1, 2, 2]], ["tile_k", "sp", [-1, 1, 12]]]}, "result": [[0.00922550925], 0, 1.2928740978240967, 1655820922.3528364], "version": 0.2, "tvm_version": "0.8.0"}
