exp/partial_log/bert_random_cuda_1000.json
{"input": ["cuda -keys=cuda,gpu -max_num_threads=1024 -thread_warp_size=32", "dense_small_batch.gpu", [["TENSOR", [1, 768], "float32"], ["TENSOR", [768, 768], "float32"], null, "float32"], {}], "config": {"index": 9, "code_hash": null, "entity": [["tile_k", "sp", [-1, 32]]]}, "result": [[4.348668223469243e-06], 0, 1.5410058498382568, 1662442894.6856897], "version": 0.2, "tvm_version": "0.8.0"}
{"input": ["cuda -keys=cuda,gpu -max_num_threads=1024 -thread_warp_size=32", "dense_large_batch.gpu", [["TENSOR", [128, 3072], "float32"], ["TENSOR", [768, 3072], "float32"], null, "float32"], {}], "config": {"index": 522384, "code_hash": null, "entity": [["tile_x", "sp", [-1, 8, 8, 1]], ["tile_y", "sp", [-1, 1, 8, 6]], ["tile_k", "sp", [-1, 12, 1]]]}, "result": [[0.0005253101441717791], 0, 1.842545509338379, 1662443002.5180864], "version": 0.2, "tvm_version": "0.8.0"}
{"input": ["cuda -keys=cuda,gpu -max_num_threads=1024 -thread_warp_size=32", "dense_small_batch.gpu", [["TENSOR", [128, 3072], "float32"], ["TENSOR", [768, 3072], "float32"], null, "float32"], {}], "config": {"index": 16, "code_hash": null, "entity": [["tile_k", "sp", [-1, 384]]]}, "result": [[0.0041716392972972974], 0, 1.3252108097076416, 1662443596.9989572], "version": 0.2, "tvm_version": "0.8.0"}
{"input": ["cuda -keys=cuda,gpu -max_num_threads=1024 -thread_warp_size=32", "dense_large_batch.gpu", [["TENSOR", [128, 768], "float32"], ["TENSOR", [3072, 768], "float32"], null, "float32"], {}], "config": {"index": 10047969, "code_hash": null, "entity": [["tile_x", "sp", [-1, 2, 2, 1]], ["tile_y", "sp", [-1, 4, 2, 2]], ["tile_k", "sp", [-1, 24, 8]]]}, "result": [[0.005191280468749999], 0, 5.393170595169067, 1662443805.4682848], "version": 0.2, "tvm_version": "0.8.0"}
{"input": ["cuda -keys=cuda,gpu -max_num_threads=1024 -thread_warp_size=32", "dense_small_batch.gpu", [["TENSOR", [128, 768], "float32"], ["TENSOR", [3072, 768], "float32"], null, "float32"], {}], "config": {"index": 13, "code_hash": null, "entity": [["tile_k", "sp", [-1, 128]]]}, "result": [[0.004167047972972973], 0, 1.333294153213501, 1662444221.1129296], "version": 0.2, "tvm_version": "0.8.0"}
{"input": ["cuda -keys=cuda,gpu -max_num_threads=1024 -thread_warp_size=32", "batch_matmul.cuda", [["TENSOR", [12, 128, 128], "float32"], ["TENSOR", [12, 64, 128], "float32"], [12, 128, 64], null, 0, 1], {}], "config": {"index": 21626, "code_hash": null, "entity": [["tile_y", "sp", [-1, 1, 16]], ["tile_x", "sp", [-1, 32, 2]], ["tile_k", "sp", [-1, 32]], ["auto_unroll_max_step", "ot", 32], ["unroll_explicit", "ot", 0]]}, "result": [[1.8425035472578763e-05], 0, 1.9697301387786865, 1662445313.5867705], "version": 0.2, "tvm_version": "0.8.0"}
{"input": ["cuda -keys=cuda,gpu -max_num_threads=1024 -thread_warp_size=32", "batch_matmul.cuda", [["TENSOR", [12, 128, 64], "float32"], ["TENSOR", [12, 128, 64], "float32"], [12, 128, 128], null, 0, 1], {}], "config": {"index": 40636, "code_hash": null, "entity": [["tile_y", "sp", [-1, 4, 16]], ["tile_x", "sp", [-1, 16, 2]], ["tile_k", "sp", [-1, 8]], ["auto_unroll_max_step", "ot", 8], ["unroll_explicit", "ot", 1]]}, "result": [[1.7701815644271344e-05], 0, 1.447467565536499, 1662448427.5561554], "version": 0.2, "tvm_version": "0.8.0"}
{"input": ["cuda -keys=cuda,gpu -max_num_threads=1024 -thread_warp_size=32", "dense_large_batch.gpu", [["TENSOR", [128, 768], "float32"], ["TENSOR", [768, 768], "float32"], null, "float32"], {}], "config": {"index": 2026516, "code_hash": null, "entity": [["tile_x", "sp", [-1, 2, 4, 4]], ["tile_y", "sp", [-1, 1, 4, 6]], ["tile_k", "sp", [-1, 16, 2]]]}, "result": [[0.00015295823787740166], 0, 2.6430888175964355, 1662451311.4393055], "version": 0.2, "tvm_version": "0.8.0"}
{"input": ["cuda -keys=cuda,gpu -max_num_threads=1024 -thread_warp_size=32", "dense_small_batch.gpu", [["TENSOR", [128, 768], "float32"], ["TENSOR", [768, 768], "float32"], null, "float32"], {}], "config": {"index": 9, "code_hash": null, "entity": [["tile_k", "sp", [-1, 32]]]}, "result": [[0.00032976966356589146], 0, 1.3181183338165283, 1662451888.6048627], "version": 0.2, "tvm_version": "0.8.0"}
