exp/partial_log/bert_grid_cuda_500.json
{"input": ["cuda -keys=cuda,gpu -max_num_threads=1024 -thread_warp_size=32", "dense_small_batch.gpu", [["TENSOR", [1, 768], "float32"], ["TENSOR", [768, 768], "float32"], null, "float32"], {}], "config": {"index": 9, "code_hash": null, "entity": [["tile_k", "sp", [-1, 32]]]}, "result": [[4.353215048845633e-06], 0, 1.5905516147613525, 1662426510.3859181], "version": 0.2, "tvm_version": "0.8.0"}
{"input": ["cuda -keys=cuda,gpu -max_num_threads=1024 -thread_warp_size=32", "dense_large_batch.gpu", [["TENSOR", [128, 3072], "float32"], ["TENSOR", [768, 3072], "float32"], null, "float32"], {}], "config": {"index": 485, "code_hash": null, "entity": [["tile_x", "sp", [-1, 32, 1, 1]], ["tile_y", "sp", [-1, 6, 1, 1]], ["tile_k", "sp", [-1, 1, 1]]]}, "result": [[0.00518629140625], 0, 1.5243067741394043, 1662426866.3489723], "version": 0.2, "tvm_version": "0.8.0"}
{"input": ["cuda -keys=cuda,gpu -max_num_threads=1024 -thread_warp_size=32", "dense_small_batch.gpu", [["TENSOR", [128, 3072], "float32"], ["TENSOR", [768, 3072], "float32"], null, "float32"], {}], "config": {"index": 16, "code_hash": null, "entity": [["tile_k", "sp", [-1, 384]]]}, "result": [[0.00417002427027027], 0, 1.3081936836242676, 1662429264.3919017], "version": 0.2, "tvm_version": "0.8.0"}
{"input": ["cuda -keys=cuda,gpu -max_num_threads=1024 -thread_warp_size=32", "dense_large_batch.gpu", [["TENSOR", [128, 768], "float32"], ["TENSOR", [3072, 768], "float32"], null, "float32"], {}], "config": {"index": 485, "code_hash": null, "entity": [["tile_x", "sp", [-1, 32, 1, 1]], ["tile_y", "sp", [-1, 6, 1, 1]], ["tile_k", "sp", [-1, 1, 1]]]}, "result": [[0.004401266527777777], 0, 1.434523582458496, 1662429600.621344], "version": 0.2, "tvm_version": "0.8.0"}
{"input": ["cuda -keys=cuda,gpu -max_num_threads=1024 -thread_warp_size=32", "dense_small_batch.gpu", [["TENSOR", [128, 768], "float32"], ["TENSOR", [3072, 768], "float32"], null, "float32"], {}], "config": {"index": 13, "code_hash": null, "entity": [["tile_k", "sp", [-1, 128]]]}, "result": [[0.004166070702702703], 0, 1.3224091529846191, 1662432365.5664136], "version": 0.2, "tvm_version": "0.8.0"}
{"input": ["cuda -keys=cuda,gpu -max_num_threads=1024 -thread_warp_size=32", "batch_matmul.cuda", [["TENSOR", [12, 128, 128], "float32"], ["TENSOR", [12, 64, 128], "float32"], [12, 128, 64], null, 0, 1], {}], "config": {"index": 424, "code_hash": null, "entity": [["tile_y", "sp", [-1, 4, 16]], ["tile_x", "sp", [-1, 16, 2]], ["tile_k", "sp", [-1, 1]], ["auto_unroll_max_step", "ot", 8], ["unroll_explicit", "ot", 0]]}, "result": [[5.394395784490532e-05], 0, 1.7418529987335205, 1662432817.8310292], "version": 0.2, "tvm_version": "0.8.0"}
{"input": ["cuda -keys=cuda,gpu -max_num_threads=1024 -thread_warp_size=32", "batch_matmul.cuda", [["TENSOR", [12, 128, 64], "float32"], ["TENSOR", [12, 128, 64], "float32"], [12, 128, 128], null, 0, 1], {}], "config": {"index": 460, "code_hash": null, "entity": [["tile_y", "sp", [-1, 4, 16]], ["tile_x", "sp", [-1, 16, 2]], ["tile_k", "sp", [-1, 1]], ["auto_unroll_max_step", "ot", 8], ["unroll_explicit", "ot", 0]]}, "result": [[4.4751729636048526e-05], 0, 1.5461175441741943, 1662436189.9168804], "version": 0.2, "tvm_version": "0.8.0"}
{"input": ["cuda -keys=cuda,gpu -max_num_threads=1024 -thread_warp_size=32", "dense_large_batch.gpu", [["TENSOR", [128, 768], "float32"], ["TENSOR", [768, 768], "float32"], null, "float32"], {}], "config": {"index": 485, "code_hash": null, "entity": [["tile_x", "sp", [-1, 32, 1, 1]], ["tile_y", "sp", [-1, 6, 1, 1]], ["tile_k", "sp", [-1, 1, 1]]]}, "result": [[0.0012564017421875], 0, 1.3782892227172852, 1662439233.392033], "version": 0.2, "tvm_version": "0.8.0"}
{"input": ["cuda -keys=cuda,gpu -max_num_threads=1024 -thread_warp_size=32", "dense_small_batch.gpu", [["TENSOR", [128, 768], "float32"], ["TENSOR", [768, 768], "float32"], null, "float32"], {}], "config": {"index": 9, "code_hash": null, "entity": [["tile_k", "sp", [-1, 32]]]}, "result": [[0.0003346181271317829], 0, 1.407684087753296, 1662441458.4490721], "version": 0.2, "tvm_version": "0.8.0"}
