exp/partial_log/roberta_xgb_knob_cuda_100.json
{"input": ["cuda -keys=cuda,gpu -max_num_threads=1024 -thread_warp_size=32", "dense_small_batch.gpu", [["TENSOR", [1, 768], "float32"], ["TENSOR", [768, 768], "float32"], null, "float32"], {}], "config": {"index": 9, "code_hash": null, "entity": [["tile_k", "sp", [-1, 32]]]}, "result": [[4.308257205680257e-06], 0, 1.4288160800933838, 1655998363.6614783], "version": 0.2, "tvm_version": "0.8.0"}
{"input": ["cuda -keys=cuda,gpu -max_num_threads=1024 -thread_warp_size=32", "dense_large_batch.gpu", [["TENSOR", [128, 3072], "float32"], ["TENSOR", [768, 3072], "float32"], null, "float32"], {}], "config": {"index": 4797608, "code_hash": null, "entity": [["tile_x", "sp", [-1, 1, 2, 1]], ["tile_y", "sp", [-1, 1, 2, 6]], ["tile_k", "sp", [-1, 16, 4]]]}, "result": [[0.005543926500000001], 0, 1.9952454566955566, 1655998403.4783094], "version": 0.2, "tvm_version": "0.8.0"}
{"input": ["cuda -keys=cuda,gpu -max_num_threads=1024 -thread_warp_size=32", "dense_small_batch.gpu", [["TENSOR", [128, 3072], "float32"], ["TENSOR", [768, 3072], "float32"], null, "float32"], {}], "config": {"index": 16, "code_hash": null, "entity": [["tile_k", "sp", [-1, 384]]]}, "result": [[0.0041622031351351355], 0, 1.20894455909729, 1656003337.8466713], "version": 0.2, "tvm_version": "0.8.0"}
{"input": ["cuda -keys=cuda,gpu -max_num_threads=1024 -thread_warp_size=32", "dense_large_batch.gpu", [["TENSOR", [128, 768], "float32"], ["TENSOR", [3072, 768], "float32"], null, "float32"], {}], "config": {"index": 3205620, "code_hash": null, "entity": [["tile_x", "sp", [-1, 4, 16, 2]], ["tile_y", "sp", [-1, 1, 16, 3]], ["tile_k", "sp", [-1, 8, 2]]]}, "result": [[0.0011919062142857143], 0, 1.5048103332519531, 1656003482.8821957], "version": 0.2, "tvm_version": "0.8.0"}
{"input": ["cuda -keys=cuda,gpu -max_num_threads=1024 -thread_warp_size=32", "dense_small_batch.gpu", [["TENSOR", [128, 768], "float32"], ["TENSOR", [3072, 768], "float32"], null, "float32"], {}], "config": {"index": 13, "code_hash": null, "entity": [["tile_k", "sp", [-1, 128]]]}, "result": [[0.004163141432432433], 0, 1.1842756271362305, 1656007989.2150788], "version": 0.2, "tvm_version": "0.8.0"}
{"input": ["cuda -keys=cuda,gpu -max_num_threads=1024 -thread_warp_size=32", "batch_matmul.cuda", [["TENSOR", [12, 128, 128], "float32"], ["TENSOR", [12, 64, 128], "float32"], [12, 128, 64], null, 0, 1], {}], "config": {"index": 20364, "code_hash": null, "entity": [["tile_y", "sp", [-1, 8, 8]], ["tile_x", "sp", [-1, 32, 1]], ["tile_k", "sp", [-1, 16]], ["auto_unroll_max_step", "ot", 32], ["unroll_explicit", "ot", 0]]}, "result": [[2.399813890634821e-05], 0, 1.2727997303009033, 1656008106.3377166], "version": 0.2, "tvm_version": "0.8.0"}
{"input": ["cuda -keys=cuda,gpu -max_num_threads=1024 -thread_warp_size=32", "batch_matmul.cuda", [["TENSOR", [12, 128, 64], "float32"], ["TENSOR", [12, 128, 64], "float32"], [12, 128, 128], null, 0, 1], {}], "config": {"index": 34195, "code_hash": null, "entity": [["tile_y", "sp", [-1, 2, 32]], ["tile_x", "sp", [-1, 32, 2]], ["tile_k", "sp", [-1, 32]], ["auto_unroll_max_step", "ot", 64], ["unroll_explicit", "ot", 0]]}, "result": [[1.403255538307004e-05], 0, 1.5233936309814453, 1656012544.9207745], "version": 0.2, "tvm_version": "0.8.0"}
{"input": ["cuda -keys=cuda,gpu -max_num_threads=1024 -thread_warp_size=32", "dense_large_batch.gpu", [["TENSOR", [128, 768], "float32"], ["TENSOR", [768, 768], "float32"], null, "float32"], {}], "config": {"index": 4618708, "code_hash": null, "entity": [["tile_x", "sp", [-1, 4, 16, 1]], ["tile_y", "sp", [-1, 2, 16, 2]], ["tile_k", "sp", [-1, 2, 6]]]}, "result": [[0.00012851320135363789], 0, 1.2558910846710205, 1656016892.9780307], "version": 0.2, "tvm_version": "0.8.0"}
{"input": ["cuda -keys=cuda,gpu -max_num_threads=1024 -thread_warp_size=32", "dense_small_batch.gpu", [["TENSOR", [128, 768], "float32"], ["TENSOR", [768, 768], "float32"], null, "float32"], {}], "config": {"index": 9, "code_hash": null, "entity": [["tile_k", "sp", [-1, 32]]]}, "result": [[0.00033636868788819874], 0, 1.2995243072509766, 1656020974.974284], "version": 0.2, "tvm_version": "0.8.0"}
